activity,activity type,authors,classifications,code,comment,database,filename,flow,location,name,parameters,production amount,reference product,synonyms,type,unit
90000c08-ef27-52d8-80b8-20327adaa03c,market activity,"{'data entry': {'name': 'Avraam Symeonidis', 'email': 'Symeonidis@ecoinvent.org'}, 'data generator': {'name': 'Avraam Symeonidis', 'email': 'Symeonidis@ecoinvent.org'}}","[('ISIC rev.4 ecoinvent', '2012:Manufacture of fertilizers and nitrogen compounds'), ('CPC', '34631: Potassium chloride (muriate of potash)')]",9ba6b1149020b45811b3b6476242695e,"This is a market activity. Each market represents the consumption mix of a product in a given geography, connecting suppliers with consumers of the same product in the same geographical area. Markets group the producers and also the imports of the product (if relevant) within the same geographical area. They also account for transport to the consumer and for the losses during that process, when relevant.
This dataset is a consumption mix, representing the supply of ''potassium chloride, industrial grade'' from activities that produce it, to activities that consume it within the geography of this dataset, Europe. 
If 1 kg of this 'potassium chloride, industrial grade' is used as fertiliser, it is equivalent to circa 0.6 kg of Potassium as K2O.
The dataset considers transportation from the producer to the consumer of this product, transportation distances are based on default transport distances for markets (found in file 'Default Transport Assumptions' at https://www.ecoinvent.org/support/documents-and-files/documents-and-files.html).
'Potassium chloride, industrial grade' is an inorganic substance with a CAS no. : 7447-40-7. It is called 'potassium;chloride' under IUPAC naming and its molecular formula is: KCl. It is solid in normal conditions of temperature and pressure. Based on EU regulations (REGULATION (EU) 2019/1009), if this substance would be used as fertiliser, it could be labelled as N-P-K of: (0-0-50).
Geography:  This activity delivers the product of ''potassium chloride, industrial grade'' within the geography of Europe.",cutoff-3.9.1,90000c08-ef27-52d8-80b8-20327adaa03c_f9c6e4e7-e45c-423e-b48e-f7e140efb38e.spold,f9c6e4e7-e45c-423e-b48e-f7e140efb38e,RER,market for potassium chloride,[],1.0,potassium chloride,[],process,kilogram
5a673e2b-9dc1-5553-bf95-98627425f6a3,market activity,"{'data entry': {'name': 'David FitzGerald', 'email': 'fitzgerald@ecoinvent.org'}, 'data generator': {'name': 'David FitzGerald', 'email': 'fitzgerald@ecoinvent.org'}}","[('ISIC rev.4 ecoinvent', '3530:Steam and air conditioning supply'), ('CPC', '17300: Steam and hot water')]",e94f48ca9779dd7cb236e53a6ca05ec1,"This is a market activity. Each market represents the consumption mix of a product in a given geography, connecting suppliers with consumers of the same product in the same geographical area. Markets group the producers and also the imports of the product (if relevant) within the same geographical area. They also account for transport to the consumer and for the losses during that process, when relevant.
This is the market for  'heat, from steam, in chemical industry', in the geography of Europe.
This market contains no transport or losses, as they are irrelevant for the delivered product.
This product represents heat measured in MJ. The heat is produced with the average fuel mix used in the chemical and petrochemical industry. It is to be used for heat energy in an average chemical plant. ",cutoff-3.9.1,5a673e2b-9dc1-5553-bf95-98627425f6a3_63ead738-2005-498c-8359-7f65c134a1a4.spold,63ead738-2005-498c-8359-7f65c134a1a4,RER,"market for heat, from steam, in chemical industry",[],1.0,"heat, from steam, in chemical industry",[],process,megajoule
2ba682a2-719f-51df-951f-eec02f61e0c5,market group,"{'data entry': {'name': '[System]', 'email': 'support@ecoinvent.org'}, 'data generator': {'name': '[System]', 'email': 'support@ecoinvent.org'}}","[('ISIC rev.4 ecoinvent', '3510:Electric power generation, transmission and distribution'), ('CPC', '17100: Electrical energy')]",d2cf377db3ed6bbbe4ea357e2d2def51,"This dataset is a market group. Market groups represent a 'market of markets'. Their purpose is to group a set of markets into larger, geographically relevant datasets.
Market groups are created for convenience and ease of use. They only group other markets and/or market groups contained within their geography.
Losses and relevant exchanges (transport, transport infrastructure, etc.) are not included in this dataset. They are present in the contained markets.  
This is the market group for 'electricity, medium voltage', in China.",cutoff-3.9.1,2ba682a2-719f-51df-951f-eec02f61e0c5_759b89bd-3aa6-42ad-b767-5bb9ef5d331d.spold,759b89bd-3aa6-42ad-b767-5bb9ef5d331d,CN,"market group for electricity, medium voltage",[],1.0,"electricity, medium voltage",[],process,kilowatt hour
a72aa017-4a2f-52c1-b1f0-b3c8c2b47678,market activity,"{'data entry': {'name': 'Lucia Valsasina', 'email': 'valsasina@ecoinvent.org'}, 'data generator': {'name': 'Lucia Valsasina', 'email': 'valsasina@ecoinvent.org'}}","[('EcoSpold01Categories', 'transport systems/road'), ('ISIC rev.4 ecoinvent', '4923:Freight transport by road'), ('CPC', '6511: Road transport services of freight')]",302ab5bea8285e6aa37b5f7c8a816ad8,"This is a market activity. Each market represents the consumption mix of a product in a given geography, connecting suppliers with consumers of the same product in the same geographical area. Markets group the producers and also the imports of the product (if relevant) within the same geographical area. They also account for transport to the consumer and for the losses during that process, when relevant.
This is the market for  'transport, freight, lorry >32 metric ton, EURO3', in the geography of Europe.
This market contains no transport or losses, as they are irrelevant for the delivered product.
This is delivering the service of transportation of 1 metric ton across the distance of 1 km. This service only considers the transportation of goods. The vehicle operates with diesel, its emission standard is classified as EURO3 and it falls under the lorry size class of  >32 metric tons. The average freight load factor of a >32 metric ton lorry is 15.96 tonnes, with a gross vehicle weight (GVW) of 29.96 tonnes. It has a lifetime capacity of 540,000 km as heavy commercial vehicle. Data for transport is calculated for an average load factor, including empty return trips.",cutoff-3.9.1,a72aa017-4a2f-52c1-b1f0-b3c8c2b47678_b909dee2-76bd-4eae-87d5-fc831390f99b.spold,b909dee2-76bd-4eae-87d5-fc831390f99b,RER,"market for transport, freight, lorry >32 metric ton, EURO3",[],1.0,"transport, freight, lorry >32 metric ton, EURO3",[],process,ton kilometer
044043d2-bdfc-55f1-9d2d-e8431d5266c7,market activity,"{'data entry': {'name': 'Guillaume Bourgault', 'email': 'bourgault@ecoinvent.org'}, 'data generator': {'name': '[System]', 'email': 'support@ecoinvent.org'}}","[('ISIC rev.4 ecoinvent', '2410:Manufacture of basic iron and steel'), ('EcoSpold01Categories', 'metals/extraction'), ('CPC', '4121: Flat-rolled products of steel, not further worked than hot-rolled')]",a0bd454544d5b0919de48edec5c458e7,"This is a market activity. In the case of services or immobile infrastructures, markets are connecting suppliers and consumers at a global level. For specific connections at regional level, direct links between the local producing activities and the local consumers are preferred. Transport or losses are logically not relevant for this type of products.
This is the market for  'steel, low-alloyed, hot rolled', in the Global geography.
This market contains no transport or losses, as they are irrelevant for the delivered product.",cutoff-3.9.1,044043d2-bdfc-55f1-9d2d-e8431d5266c7_8cb650d5-8a48-4719-81b1-2080b3b4387f.spold,8cb650d5-8a48-4719-81b1-2080b3b4387f,GLO,"market for steel, low-alloyed, hot rolled",[],1.0,"steel, low-alloyed, hot rolled",[],process,kilogram
0e97db67-9266-5047-8b19-0374449de40d,market activity,"{'data entry': {'name': '[System]', 'email': 'support@ecoinvent.org'}, 'data generator': {'name': '[System]', 'email': 'support@ecoinvent.org'}}","[('EcoSpold01Categories', 'natural gas/power plants'), ('ISIC rev.4 ecoinvent', '3510:Electric power generation, transmission and distribution'), ('CPC', '17100: Electrical energy')]",c3bedcebac04b5b65dddf73fe3da7405,"This is a market activity. Each market represents the consumption mix of a product in a given geography, connecting suppliers with consumers of the same product in the same geographical area. Markets group the producers and also the imports of the product (if relevant) within the same geographical area. They also account for transport to the consumer and for the losses during that process, when relevant.
This is the market for  'sweet gas, burned in gas turbine', in the Global geography.
This market contains no transport or losses, as they are irrelevant for the delivered product.
'sweet gas, burned in gas turbine' describes the use of a fossil fuel. It is used as a gaseous fuel and is sourced from natural gas processing plants. This exchange provides the treatment of sweet gas (hydrogen sulfide poor) to produce electricity.",cutoff-3.9.1,0e97db67-9266-5047-8b19-0374449de40d_7f8a51d3-2d37-4535-a185-3c2351aea9e6.spold,7f8a51d3-2d37-4535-a185-3c2351aea9e6,GLO,"market for sweet gas, burned in gas turbine",[],1.0,"sweet gas, burned in gas turbine",[],process,megajoule
eb20a51e-adb7-55d5-a2dd-3d60c97a92c6,market activity,"{'data entry': {'name': 'Carl Vadenbo', 'email': 'vadenbo@ecoinvent.org'}, 'data generator': {'name': 'Carl Vadenbo', 'email': 'vadenbo@ecoinvent.org'}}","[('ISIC rev.4 ecoinvent', '3520:Manufacture of gas; distribution of gaseous fuels through mains'), ('CPC', '12020: Natural gas, liquefied or in the gaseous state')]",af1b9da369e14cc9f20170a17290ac5d,"This is a market activity. Each market represents the consumption mix of a product in a given geography, connecting suppliers with consumers of the same product in the same geographical area. Markets group the producers and the imports of the product (if relevant) within the same geographical area. They also account for transport (distribution) to the consumer and for the losses during that process, when relevant.
This is the market for ‘natural gas, high pressure"" [m3], in the geography of Russian Federation. Imports to the market for natural gas in Russian Federation have not been considered, and this activity is hence supplied with gas from domestic production only.It contains information on energy and transport requirement (excluding for any imports, which are modelled in separate datasets) and the losses and emissions occurring during the distribution.
The product ‘natural gas, high pressure"" is a fossil fuel, for which a generic gross calorific value (GCV) of 40MJ/m3, a net calorific value (NCV) of 36.0 MJ/m3 and a density of 0.735kg/m3 for natural gas are applied, in line with the global statistics (referring to standard cubic meters, Sm3, measured at 15°C and 1013 mbar), based on Meili et al. (2022). It is used as a gaseous fuel and is sourced from oil and gas production and evaporation of liquid natural gas. The initial overpressure of the gas is 1-5 bar (1000-5000 hPa). Natural gas supplied at high pressure is predominantly used by large consumers, e.g., power plants and industries. 
Reference(s): 
Bussa, M., N. Jungbluth, Ch. Meili (2022) Life cycle inventories for long-distance transport and distribution of natural gas. ESU-services Ltd. Schaffhausen, Switzerland. Available from: http://esu-services.ch/data/public-lci-reports/
Geography:  Russian Federation
Technology:  This dataset refers only to the delivery of high pressure natural gas, which has 1-5 bar overpressure. The gas is supplied to consumers via onshore pipelines. The delivery at low pressure (0.1 bar overpressure), e.g., to households, is not considered within this activity. 
Time period:  Energy requirements are from 2019 and leakage data are from 2018.",cutoff-3.9.1,eb20a51e-adb7-55d5-a2dd-3d60c97a92c6_a9007f10-7e39-4d50-8f4a-d6d03ce3d673.spold,a9007f10-7e39-4d50-8f4a-d6d03ce3d673,RU,"market for natural gas, high pressure",[],1.0,"natural gas, high pressure",[],process,cubic meter
7ac71fd7-a65b-5f2c-9289-7335f9945c11,market activity,"{'data entry': {'name': 'Guillaume Bourgault', 'email': 'bourgault@ecoinvent.org'}, 'data generator': {'name': '[System]', 'email': 'support@ecoinvent.org'}}","[('EcoSpold01Categories', 'metals/extraction'), ('ISIC rev.4 ecoinvent', '2420:Manufacture of basic precious and other non-ferrous metals'), ('CPC', '4153: Semi-finished products of aluminium or aluminium alloys')]",d25c8e0755ee9899fb4e892990397a68,"This is a market activity. Each market represents the consumption mix of a product in a given geography, connecting suppliers with consumers of the same product in the same geographical area. Markets group the producers and also the imports of the product (if relevant) within the same geographical area. They also account for transport to the consumer and for the losses during that process, when relevant.
This is the market for  'aluminium, wrought alloy', in the Global geography.
In this market, expert judgement was used to develop product specific transport distance estimations.",cutoff-3.9.1,7ac71fd7-a65b-5f2c-9289-7335f9945c11_fef44ccb-917e-4c8d-bb35-a1898827b659.spold,fef44ccb-917e-4c8d-bb35-a1898827b659,GLO,"market for aluminium, wrought alloy",[],1.0,"aluminium, wrought alloy",[],process,kilogram
4438999c-7021-5448-8097-8803c5cdfc11,market activity,"{'data entry': {'name': 'Carl Vadenbo', 'email': 'vadenbo@ecoinvent.org'}, 'data generator': {'name': 'Christoph Meili', 'email': 'meili@esu-services.ch'}}","[('ISIC rev.4 ecoinvent', '4661:Wholesale of solid, liquid and gaseous fuels and related products'), ('CPC', '12010: Petroleum oils and oils obtained from bituminous minerals, crude')]",ffa4308820ee99e0ed078d95d529d837,"This is a market activity. Each market represents the consumption mix of a product in a given geography, connecting suppliers with consumers of the same product in the same geographical area. Markets group the producers and the imports of the product (if relevant) within the same geographical area. They also account for transport (distribution) to the consumer and for the losses during that process, when relevant.
This is the market for crude ‘petroleum"" oil [kg], in the geography of Europe without Switzerland.The consumption mix is calculated based on international trade statistics for 2019. The modelling approach for transport from extraction site to the port of destination via pipelines or tanker freight ships is described in Meili et al. (2022, section 3.4). Further transport from seaport to refinery is described in section 3.6: For most European countries, distances for transport of crude oil from import to refineries are assumed to be on average about 100km in onshore pipelines. Exceptions are, e.g., transport from Kazakhstan, Russia and Azerbaijan to Europe. There, transport is assumed to be done completely in onshore pipelines which therefore are considerably longer. For countries with smaller production rates like the Netherlands, Germany, and the United Kingdom, it is assumed that the whole production is refined locally. The distance for transport in a local onshore pipeline is therefore set to a generic value of 10km.Crude ""petroleum"" oil is a fossil fuel with a net calorific value of 43.4 MJ/kg. The density of petroleum set to 858.1 kg/m3. Its main application is as the feedstock for petroleum refineries, for the production of various fuels and petrochemicals.
Reference(s): 
C. Meili, N. Jungbluth, M. Bussa (2022) Life cycle inventories of of long-distance transport of crude oil. ESU-services Ltd. Schaffhausen, Switzerland. Availble from: http://esu-services.ch/data/public-lci-reports/
Geography:  Europe without Switzerland",cutoff-3.9.1,4438999c-7021-5448-8097-8803c5cdfc11_e6aad2de-0b1b-49c3-a0c4-797ba34d87e5.spold,e6aad2de-0b1b-49c3-a0c4-797ba34d87e5,Europe without Switzerland,market for petroleum,[],1.0,petroleum,[],process,kilogram
79d6450d-f9ad-5619-89c3-05c8d7622af3,market activity,"{'data entry': {'name': '[System]', 'email': 'support@ecoinvent.org'}, 'data generator': {'name': '[System]', 'email': 'support@ecoinvent.org'}}","[('ISIC rev.4 ecoinvent', '4312:Site preparation'), ('EcoSpold01Categories', 'construction processes/machinery'), ('CPC', '543: Site preparation services')]",5efd4061851b2bd322f17830fee57dff,"This is a market activity. Each market represents the consumption mix of a product in a given geography, connecting suppliers with consumers of the same product in the same geographical area. Markets group the producers and also the imports of the product (if relevant) within the same geographical area. They also account for transport to the consumer and for the losses during that process, when relevant.
This is the market for  'diesel, burned in building machine', in the Global geography.
This market contains no transport or losses, as they are irrelevant for the delivered product.
diesel, burned in building machine' describes the use of a fossil fuel. It is used as a liquid fuel and is sourced from distillation of heavy oil. This exchange provides the service of burning 1 MJ of diesel in a builiding machinery. The services also includes (air) emissions and the production and provision of fuel. 1 MJ equals 0.0234 kg of diesel (LHV of diesel ca 42.8 MJ/kg).",cutoff-3.9.1,79d6450d-f9ad-5619-89c3-05c8d7622af3_b0f4c2fb-5081-474a-8ffa-1457da8345db.spold,b0f4c2fb-5081-474a-8ffa-1457da8345db,GLO,"market for diesel, burned in building machine",[],1.0,"diesel, burned in building machine",[],process,megajoule
df49d726-2eaf-5806-885b-4f14bb2d60eb,market activity,"{'data entry': {'name': '[System]', 'email': 'support@ecoinvent.org'}, 'data generator': {'name': '[System]', 'email': 'support@ecoinvent.org'}}","[('EcoSpold01Categories', 'natural gas/production'), ('ISIC rev.4 ecoinvent', '0620:Extraction of natural gas'), ('CPC', '39990: Other wastes n.e.c.')]",02485cef82fc3eac5b0396a3d6858d77,"This is a market activity, representing a treatment mix. In the case of products needing treatment, market mixes are supplied by the activities treating the product in the geography defined by the market, and they supply the activities needing to treat the product, as they have generated it as a by-product in the Undefined processes (present as a negative input in system models). Transport to the treating facility or losses are also accounted in this type of markets, when relevant.
This is the market for  'waste natural gas, sweet', in the Global geography.
Transport from producers to consumers of this product in the geography covered by the market is included.",cutoff-3.9.1,df49d726-2eaf-5806-885b-4f14bb2d60eb_10da3c92-bfbe-455c-8029-dfd4e4acedd4.spold,10da3c92-bfbe-455c-8029-dfd4e4acedd4,GLO,"market for waste natural gas, sweet",[],-1.0,"waste natural gas, sweet",[],process,megajoule
d7d701b8-375e-5418-92c7-3919cc55e0cd,market activity,"{'data entry': {'name': 'Karin Treyer', 'email': 'karin.treyer@psi.ch'}, 'data generator': {'name': 'Karin Treyer', 'email': 'karin.treyer@psi.ch'}}","[('ISIC rev.4 ecoinvent', '3510:Electric power generation, transmission and distribution'), ('CPC', '17100: Electrical energy')]",042d51c53bcaa1b78b70cbb4c6e46b58,"This is a market activity. Each market represents the consumption mix of a product in a given geography, connecting suppliers with consumers of the same product in the same geographical area. Markets group the producers and also the imports of the product (if relevant) within the same geographical area. They also account for transport to the consumer and for the losses during that process, when relevant.
This dataset describes the electricity available on the high voltage level in Germany. This is done by showing the transmission of 1kWh electricity at high voltage.
Technology:  Average technology used to transmit and distribute electricity. Includes underground and overhead lines. Electricity production according to related technology datasets.
Definition of the voltage levels:
- High voltage level above 24 kV (large scale industry)
- Medium voltage level between 1 kV and 24 kV (medium to small scale industry, service sector
and public buildings)
- Low voltage level below 1 kV (Households)
Time period:  The 'Start of Period' and 'End of Period' do not refer to the year for which this market is valid. See general comment for the year for which the shares are based on.",cutoff-3.9.1,d7d701b8-375e-5418-92c7-3919cc55e0cd_66c93e71-f32b-4591-901c-55395db5c132.spold,66c93e71-f32b-4591-901c-55395db5c132,DE,"market for electricity, high voltage",[],1.0,"electricity, high voltage",[],process,kilowatt hour
c874baa7-fb17-529f-8827-416305dfecea,market activity,"{'data entry': {'name': 'Carl Vadenbo', 'email': 'vadenbo@ecoinvent.org'}, 'data generator': {'name': 'Maresa Bussa', 'email': 'bussa@esu-services.ch'}}","[('ISIC rev.4 ecoinvent', '3520:Manufacture of gas; distribution of gaseous fuels through mains'), ('CPC', '12020: Natural gas, liquefied or in the gaseous state')]",c8de1013e1728007e0c0dfa8942b6dfb,"This is a market activity. Each market represents the consumption mix of a product in a given geography, connecting suppliers with consumers of the same product in the same geographical area. Markets group the producers and the imports of the product (if relevant) within the same geographical area. They also account for transport (distribution) to the consumer and for the losses during that process, when relevant.
This is the market for ‘natural gas, high pressure"" [m3], in the geography of Germany. The consumption mix is calculated based on own production - if relevant - and trade statistics provided in BP (2020).It contains information on energy and transport requirement (excluding for any imports, which are modelled in separate datasets) and the losses and emissions occurring during the distribution.
The product ‘natural gas, high pressure"" is a fossil fuel, for which a generic gross calorific value (GCV) of 40MJ/m3, a net calorific value (NCV) of 36.0 MJ/m3 and a density of 0.735kg/m3 for natural gas are applied, in line with the global statistics (referring to standard cubic meters, Sm3, measured at 15°C and 1013 mbar), based on Meili et al. (2022). It is used as a gaseous fuel and is sourced from oil and gas production and evaporation of liquid natural gas. The initial overpressure of the gas is 1-5 bar (1000-5000 hPa). Natural gas supplied at high pressure is predominantly used by large consumers, e.g., power plants and industries. 
Reference(s): 
Bussa, M., N. Jungbluth, Ch. Meili (2022) Life cycle inventories for long-distance transport and distribution of natural gas. ESU-services Ltd. Schaffhausen, Switzerland. Available from: http://esu-services.ch/data/public-lci-reports/
BP (2020) BP Statistical Review of World Energy 2019. BP, London, UK. Retrieved from: https://www.bp.com/en/global/corporate/energy-economics/statistical-reviewof-world-energy.html.
Geography:  Germany
Technology:  This dataset refers only to the delivery of high pressure natural gas, which has 1-5 bar overpressure. The gas is supplied to consumers via onshore pipelines. The delivery at low pressure (0.1 bar overpressure), e.g., to households, is not considered within this activity. 
Time period:  Energy requirements are from 2019 and leakage data are from 2018.",cutoff-3.9.1,c874baa7-fb17-529f-8827-416305dfecea_a9007f10-7e39-4d50-8f4a-d6d03ce3d673.spold,a9007f10-7e39-4d50-8f4a-d6d03ce3d673,DE,"market for natural gas, high pressure",[],1.0,"natural gas, high pressure",[],process,cubic meter
3b190359-a32e-5294-af63-983f38ce6525,market group,"{'data entry': {'name': '[System]', 'email': 'support@ecoinvent.org'}, 'data generator': {'name': '[System]', 'email': 'support@ecoinvent.org'}}","[('ISIC rev.4 ecoinvent', '3510:Electric power generation, transmission and distribution'), ('CPC', '17100: Electrical energy')]",0c02fccd63475e8f7e6b9627f34c00bc,"This dataset is a market group. Market groups represent a 'market of markets'. Their purpose is to group a set of markets into larger, geographically relevant datasets.
Market groups are created for convenience and ease of use. They only group other markets and/or market groups contained within their geography.
Losses and relevant exchanges (transport, transport infrastructure, etc.) are not included in this dataset. They are present in the contained markets.  
This is the market group for 'electricity, medium voltage', in Europe.",cutoff-3.9.1,3b190359-a32e-5294-af63-983f38ce6525_759b89bd-3aa6-42ad-b767-5bb9ef5d331d.spold,759b89bd-3aa6-42ad-b767-5bb9ef5d331d,RER,"market group for electricity, medium voltage",[],1.0,"electricity, medium voltage",[],process,kilowatt hour
