activity,activity type,authors,classifications,code,comment,database,filename,flow,location,name,parameters,production amount,reference product,synonyms,type,unit
df989d57-cdf7-5876-9e67-1c7892542a46,market activity,"{'data entry': {'name': 'Pascal Lesage', 'email': 'pascal.lesage@polymtl.ca'}, 'data generator': {'name': 'Pascal Lesage', 'email': 'pascal.lesage@polymtl.ca'}}","[('ISIC rev.4 ecoinvent', '3510:Electric power generation, transmission and distribution'), ('EcoSpold01Categories', 'electricity/supply mix'), ('CPC', '17100: Electrical energy')]",66d43234c756f1864cc486213f495a97,"This is a market activity. Each market represents the consumption mix of a product in a given geography, connecting suppliers with consumers of the same product in the same geographical area. Markets group the producers and also the imports of the product (if relevant) within the same geographical area. They also account for transport to the consumer and for the losses during that process, when relevant.
This dataset describes the electricity available on the medium voltage level for the Asian (without China) primary aluminium-industry, i.e. used for primary aluminium production only. Aluminium industry specific markets are needed in an LCI database because primary aluminium production is very energy intensive, and hence the location of production plants is often determined by access to large amounts of cheap electricity, which often results in an electricity mix that is different from the general grid mix of the countries where the production plants are located.
Geography:  Aluminium producing Asian countries (without China) (AZ, IN, ID, IR, JP, KZ, MY, TJ, TR)
Technology:  Average technology used to transmit and distribute electricity. Includes underground and overhead lines, as well as air-, vacuum- and SF6-insulated high-to-medium voltage switching stations.",cutoff-3.9.1,df989d57-cdf7-5876-9e67-1c7892542a46_4fcfb407-7879-42ad-9582-ab3fbfe5af10.spold,4fcfb407-7879-42ad-9582-ab3fbfe5af10,"IAI Area, Asia, without China and GCC","market for electricity, medium voltage, aluminium industry",[],1.0,"electricity, medium voltage, aluminium industry",[],process,kilowatt hour
7cd32d55-0afb-5c78-bbbb-c6829b57b6fe,market activity,"{'data entry': {'name': '[System]', 'email': 'support@ecoinvent.org'}, 'data generator': {'name': '[System]', 'email': 'support@ecoinvent.org'}}","[('EcoSpold01Categories', 'hard coal/power plants'), ('ISIC rev.4 ecoinvent', '3510:Electric power generation, transmission and distribution'), ('CPC', '34231: Chemical elements n.e.c.; inorganic acids except phosphoric, nitric and sulphonitric; inorganic oxygen compoun[…]')]",043b307c3e9f84641c9228b9770c5469,"This is a market activity. Each market represents the consumption mix of a product in a given geography, connecting suppliers with consumers of the same product in the same geographical area. Markets group the producers and also the imports of the product (if relevant) within the same geographical area. They also account for transport to the consumer and for the losses during that process, when relevant.
This is the market for  'SOx retained, in hard coal flue gas desulfurisation', in the Global geography.
This market contains no transport or losses, as they are irrelevant for the delivered product.
'SOx retained, in hard coal flue gas desulfurisation'  describes the inorganic sulfur oxides retained by flue gas desulfurisation process of a hard coal power plant. It is called 'sulfur oxides' under IUPAC naming and its molecular formula is: SOx. It is gaseous under normal conditions of temperature and pressure. It is modelled as a mix of pure sulfur oxides.",cutoff-3.9.1,7cd32d55-0afb-5c78-bbbb-c6829b57b6fe_6ada853f-7787-4880-b159-826651fadee5.spold,6ada853f-7787-4880-b159-826651fadee5,RoW,"market for SOx retained, in hard coal flue gas desulfurisation",[],1.0,"SOx retained, in hard coal flue gas desulfurisation",[],process,kilogram
09dcbda2-88cc-5636-8b4e-99ea257acc38,market activity,"{'data entry': {'name': '[System]', 'email': 'support@ecoinvent.org'}, 'data generator': {'name': '[System]', 'email': 'support@ecoinvent.org'}}","[('ISIC rev.4 ecoinvent', '5022:Inland freight water transport'), ('EcoSpold01Categories', 'transport systems/ship'), ('CPC', '65222: Inland water transport services of freight by tankers')]",e23691ac3b297831f00a9a9122a9c28d,"This is a market activity. Each market represents the consumption mix of a product in a given geography, connecting suppliers with consumers of the same product in the same geographical area. Markets group the producers and also the imports of the product (if relevant) within the same geographical area. They also account for transport to the consumer and for the losses during that process, when relevant.
This is the market for  'transport, freight, inland waterways, barge tanker', in the Global geography.
This market contains no transport or losses, as they are irrelevant for the delivered product.
This is delivering the service of transportation of 1 metric ton across the distance of 1 km. This service only considers the transportation of goods. The vehicle operates with diesel. It has a transport performance of 881,119,408 tkm, an average life spam of 46.5 years and an average load of 710 tons.  The transport node indirectly considers empty trips (if any) by taking into account the total amount of freight transported throughout the lifetime of the mobile infrastructure.",cutoff-3.9.1,09dcbda2-88cc-5636-8b4e-99ea257acc38_57143a43-20ab-44a5-a4a2-26effbdfafd1.spold,57143a43-20ab-44a5-a4a2-26effbdfafd1,RoW,"market for transport, freight, inland waterways, barge tanker",[],1.0,"transport, freight, inland waterways, barge tanker",[],process,ton kilometer
966f5e04-7b5c-598d-86df-4c78a3e05c14,market group,"{'data entry': {'name': '[System]', 'email': 'support@ecoinvent.org'}, 'data generator': {'name': '[System]', 'email': 'support@ecoinvent.org'}}","[('ISIC rev.4 ecoinvent', '3510:Electric power generation, transmission and distribution'), ('CPC', '17100: Electrical energy')]",3f14d73766e32f808ed54e8b8cbb5def,"This dataset is a market group. Market groups represent a 'market of markets'. Their purpose is to group a set of markets into larger, geographically relevant datasets.
Market groups are created for convenience and ease of use. They only group other markets and/or market groups contained within their geography.
Losses and relevant exchanges (transport, transport infrastructure, etc.) are not included in this dataset. They are present in the contained markets.  
This is the market group for 'electricity, medium voltage', in Northern America.",cutoff-3.9.1,966f5e04-7b5c-598d-86df-4c78a3e05c14_759b89bd-3aa6-42ad-b767-5bb9ef5d331d.spold,759b89bd-3aa6-42ad-b767-5bb9ef5d331d,RNA,"market group for electricity, medium voltage",[],1.0,"electricity, medium voltage",[],process,kilowatt hour
19c7ca5c-eae1-512e-90da-1e3a102bee97,market activity,"{'data entry': {'name': 'Karin Treyer', 'email': 'karin.treyer@psi.ch'}, 'data generator': {'name': 'Karin Treyer', 'email': 'karin.treyer@psi.ch'}}","[('ISIC rev.4 ecoinvent', '3510:Electric power generation, transmission and distribution'), ('CPC', '17100: Electrical energy')]",d03c41d9cf73b33c8f3e947cb6dfb31a,"This is a market activity. Each market represents the consumption mix of a product in a given geography, connecting suppliers with consumers of the same product in the same geographical area. Markets group the producers and also the imports of the product (if relevant) within the same geographical area. They also account for transport to the consumer and for the losses during that process, when relevant.
This dataset describes the electricity available on the high voltage level in Australia. This is done by showing the transmission of 1kWh electricity at high voltage.
Technology:  Average technology used to transmit and distribute electricity. Includes underground and overhead lines. Electricity production according to related technology datasets.
Definition of the voltage levels:
- High voltage level above 24 kV (large scale industry)
- Medium voltage level between 1 kV and 24 kV (medium to small scale industry, service sector
and public buildings)
- Low voltage level below 1 kV (Households)
Time period:  The 'Start of Period' and 'End of Period' do not refer to the year for which this market is valid. See general comment for the year for which the shares are based on.",cutoff-3.9.1,19c7ca5c-eae1-512e-90da-1e3a102bee97_66c93e71-f32b-4591-901c-55395db5c132.spold,66c93e71-f32b-4591-901c-55395db5c132,AU,"market for electricity, high voltage",[],1.0,"electricity, high voltage",[],process,kilowatt hour
fe752fbf-5007-5a2d-8456-c1c899111df6,market activity,"{'data entry': {'name': '[System]', 'email': 'support@ecoinvent.org'}, 'data generator': {'name': '[System]', 'email': 'support@ecoinvent.org'}}","[('EcoSpold01Categories', 'construction processes/machinery'), ('ISIC rev.4 ecoinvent', '2824:Manufacture of machinery for mining, quarrying and construction'), ('CPC', '444: Machinery for mining, quarrying and construction, and parts thereof')]",25363ef0119ae91de734cc621ea2905f,"This is a market activity. Each market represents the consumption mix of a product in a given geography, connecting suppliers with consumers of the same product in the same geographical area. Markets group the producers and also the imports of the product (if relevant) within the same geographical area. They also account for transport to the consumer and for the losses during that process, when relevant.
This is the market for  'building machine', in the Global geography.
Transport from producers to consumers of this product in the geography covered by the market is included.
This is a mobile infrastructure, representing the product of a building machine, a fictitious machine made 100% of steel. The product is based on an average of different building machines. It has an average service life of 10,000 hours and a lifetime of 20 years. The production includes the building materials, machinery and energy consumption for the manufacturing of the machine.                    ",cutoff-3.9.1,fe752fbf-5007-5a2d-8456-c1c899111df6_cc89e7ae-ea0e-4850-9799-b2143f1115fc.spold,cc89e7ae-ea0e-4850-9799-b2143f1115fc,GLO,market for building machine,[],1.0,building machine,[],process,unit
b2047e86-10b9-5ca4-a6d9-e544388f7d82,market activity,"{'data entry': {'name': '[System]', 'email': 'support@ecoinvent.org'}, 'data generator': {'name': '[System]', 'email': 'support@ecoinvent.org'}}","[('ISIC rev.4 ecoinvent', '2011:Manufacture of basic chemicals'), ('CPC', '34231: Chemical elements n.e.c.; inorganic acids except phosphoric, nitric and sulphonitric; inorganic oxygen compoun[…]')]",d02e92f28244066353ac23eb6f71c35e,"This is a market activity. Each market represents the consumption mix of a product in a given geography, connecting suppliers with consumers of the same product in the same geographical area. Markets group the producers and also the imports of the product (if relevant) within the same geographical area. They also account for transport to the consumer and for the losses during that process, when relevant.
This is the market for  'chlorine, liquid', in the Global geography.
Special transport modelling for liquid gases of a dangerous nature: No ship transport and normal transport modelling for chemicals reduced by 70%.
None
chlorine, liquid'  is an inorganic substance with a CAS no. : 007782-50-5. It is called 'molecular chlorine' under IUPAC naming and its molecular formula is: Cl2. It is liquid and appears as a greenish-yellow compressed liquefied gas with a pungent odour. It is modelled as a pure substance. On a consumer level, is used in the following products: laboratory chemicals, water treatment chemicals, biocides (e.g. disinfectants, pest control products) and washing & cleaning products.  There is no publicly available information about the consumption of this substance on industrial sites.",cutoff-3.9.1,b2047e86-10b9-5ca4-a6d9-e544388f7d82_a6b32de2-648a-4cd7-a256-9b122f68dd8b.spold,a6b32de2-648a-4cd7-a256-9b122f68dd8b,RoW,"market for chlorine, liquid",[],1.0,"chlorine, liquid",[],process,kilogram
a6447eb7-3ab1-53c0-b8d2-710a4a8d8713,ordinary transforming activity,"{'data entry': {'name': 'Daniela Baumann', 'email': 'baumann@ecoinvent.org'}, 'data generator': {'name': 'Daniela Baumann', 'email': 'baumann@ecoinvent.org'}}","[('ISIC rev.4 ecoinvent', '2395:Manufacture of articles of concrete, cement and plaster'), ('CPC', '37510: Non-refractory mortars and concretes')]",93ddd652f006bbdf290667958ec5918d,"This is a linking (transfering) activity which links the specific concrete types to the generic 'market for concrete, normal strength'.
The shares of the different types of concrete are set based on production volumes of the respective activities and geographies.",cutoff-3.9.1,a6447eb7-3ab1-53c0-b8d2-710a4a8d8713_eee95138-58c8-4172-9b1f-754ba074325d.spold,eee95138-58c8-4172-9b1f-754ba074325d,RoW,"concrete, all types to generic market for concrete, normal strength",[],1.0,"concrete, normal strength",[],process,cubic meter
62b803ad-e3ff-516b-947d-f08eea52c702,market activity,"{'data entry': {'name': 'Guillaume Bourgault', 'email': 'bourgault@ecoinvent.org'}, 'data generator': {'name': '[System]', 'email': 'support@ecoinvent.org'}}","[('ISIC rev.4 ecoinvent', '2420:Manufacture of basic precious and other non-ferrous metals'), ('EcoSpold01Categories', 'metals/extraction'), ('CPC', '41413: Refined copper and copper alloys, unwrought; master alloys of copper')]",8b62f30ed586a5f23611ef196cc97b93,"This is a market activity. Each market represents the consumption mix of a product in a given geography, connecting suppliers with consumers of the same product in the same geographical area. Markets group the producers and also the imports of the product (if relevant) within the same geographical area. They also account for transport to the consumer and for the losses during that process, when relevant.
This is the market for  'copper, cathode', in the Global geography.
Transport from producers to consumers of this product in the geography covered by the market is included.",cutoff-3.9.1,62b803ad-e3ff-516b-947d-f08eea52c702_fbb039f7-f9cc-46d2-b631-313ddb125c1a.spold,fbb039f7-f9cc-46d2-b631-313ddb125c1a,GLO,"market for copper, cathode",[],1.0,"copper, cathode",[],process,kilogram
7577be39-bd56-59fc-8256-78ad4ac07735,market activity,"{'data entry': {'name': '[System]', 'email': 'support@ecoinvent.org'}, 'data generator': {'name': '[System]', 'email': 'support@ecoinvent.org'}}","[('EcoSpold01Categories', 'transport systems/train'), ('ISIC rev.4 ecoinvent', '4912:Freight rail transport'), ('CPC', '6512: Railway transport services of freight')]",8e45bdf77270459884b0b9a20795e0a8,"This is a market activity. Each market represents the consumption mix of a product in a given geography, connecting suppliers with consumers of the same product in the same geographical area. Markets group the producers and also the imports of the product (if relevant) within the same geographical area. They also account for transport to the consumer and for the losses during that process, when relevant.
This is the market for  'transport, freight train', in the geography of China.
This market contains no transport or losses, as they are irrelevant for the delivered product.
This is delivering the service of transportation of 1 metric ton across the distance of 1 km. This service only considers the transportation of goods. The vehicle operates with diesel, electricity or gard coal, while it has a mass of 1000 Gt.  The transport node indirectly considers empty trips (if any) by taking into account the total amount of freight transported throughout the lifetime of the mobile infrastructure.",cutoff-3.9.1,7577be39-bd56-59fc-8256-78ad4ac07735_0ace02fa-eca5-482d-a829-c18e46a52db4.spold,0ace02fa-eca5-482d-a829-c18e46a52db4,CN,"market for transport, freight train",[],1.0,"transport, freight train",[],process,ton kilometer
9c24f179-bc95-5266-a2e5-253b362aee9b,market activity,"{'data entry': {'name': 'Avraam Symeonidis', 'email': 'Symeonidis@ecoinvent.org'}, 'data generator': {'name': 'Avraam Symeonidis', 'email': 'Symeonidis@ecoinvent.org'}}","[('ISIC rev.4 ecoinvent', '2012:Manufacture of fertilizers and nitrogen compounds'), ('CPC', '34233: Nitric acid, sulphonitric acids')]",b60e1e3a7d89e42fb56b16607b03854b,"This is a market activity. Each market represents the consumption mix of a product in a given geography, connecting suppliers with consumers of the same product in the same geographical area. Markets group the producers and also the imports of the product (if relevant) within the same geographical area. They also account for transport to the consumer and for the losses during that process, when relevant.
This dataset is a consumption mix, representing the supply of ''nitric acid, without water, in 50% solution state'' from activities that produce it, to activities that consume it within the geography of this dataset, China. 
If 1 kg of this 'nitric acid, without water, in 50% solution state' is used as fertiliser, it is equivalent to circa 0.222 kg of Nitrogen as N.
The dataset considers transportation from the producer to the consumer of this product, transportation distances are based on default transport distances for markets (found in file 'Default Transport Assumptions' at https://www.ecoinvent.org/support/documents-and-files/documents-and-files.html).
'Nitric acid, without water, in 50% solution state' is an inorganic substance with a CAS no. : 7697-37-2. It is called 'nitric acid' under IUPAC naming and its molecular formula is: HNO3. It is liquid in normal conditions of temperature and pressure. On a consumer level, 'nitric acid, without water, in 50% solution state' is used in the following products:  washing & cleaning products, fertilisers, polishes and waxes and air care products. On industrial sites, the substance is used for the manufacture of products in the following sectors: pH regulators and water treatment products, washing & cleaning products, non-metal-surface treatment products, metal surface treatment products, water treatment chemicals, semiconductors and laboratory chemicals. Based on EU regulations (REGULATION (EU) 2019/1009), if this substance would be used as fertiliser, it could be labelled as N-P-K of: (22-0-0).
Geography:  This activity delivers the product of ''nitric acid, without water, in 50% solution state'' within the geography of China.",cutoff-3.9.1,9c24f179-bc95-5266-a2e5-253b362aee9b_68db7412-ba35-488b-8a45-9a9f48448522.spold,68db7412-ba35-488b-8a45-9a9f48448522,CN,"market for nitric acid, without water, in 50% solution state",[],1.0,"nitric acid, without water, in 50% solution state",[],process,kilogram
552bc783-062d-5db1-80df-e37d6687eb24,market activity,"{'data entry': {'name': 'Avraam Symeonidis', 'email': 'Symeonidis@ecoinvent.org'}, 'data generator': {'name': 'Avraam Symeonidis', 'email': 'Symeonidis@ecoinvent.org'}}","[('ISIC rev.4 ecoinvent', '2012:Manufacture of fertilizers and nitrogen compounds'), ('CPC', '34233: Nitric acid, sulphonitric acids')]",b04f910b0240f94317e79a9fd5519c96,"This is a market activity. Each market represents the consumption mix of a product in a given geography, connecting suppliers with consumers of the same product in the same geographical area. Markets group the producers and also the imports of the product (if relevant) within the same geographical area. They also account for transport to the consumer and for the losses during that process, when relevant.
This dataset is a consumption mix, representing the supply of ''nitric acid, without water, in 50% solution state'' from activities that produce it, to activities that consume it within the geography of this dataset, Northern America. 
If 1 kg of this 'nitric acid, without water, in 50% solution state' is used as fertiliser, it is equivalent to circa 0.222 kg of Nitrogen as N.
The dataset considers transportation from the producer to the consumer of this product, transportation distances are based on default transport distances for markets (found in file 'Default Transport Assumptions' at https://www.ecoinvent.org/support/documents-and-files/documents-and-files.html).
'Nitric acid, without water, in 50% solution state' is an inorganic substance with a CAS no. : 7697-37-2. It is called 'nitric acid' under IUPAC naming and its molecular formula is: HNO3. It is liquid in normal conditions of temperature and pressure. On a consumer level, 'nitric acid, without water, in 50% solution state' is used in the following products:  washing & cleaning products, fertilisers, polishes and waxes and air care products. On industrial sites, the substance is used for the manufacture of products in the following sectors: pH regulators and water treatment products, washing & cleaning products, non-metal-surface treatment products, metal surface treatment products, water treatment chemicals, semiconductors and laboratory chemicals. Based on EU regulations (REGULATION (EU) 2019/1009), if this substance would be used as fertiliser, it could be labelled as N-P-K of: (22-0-0).
Geography:  This activity delivers the product of ''nitric acid, without water, in 50% solution state'' within the geography of Northern America.",cutoff-3.9.1,552bc783-062d-5db1-80df-e37d6687eb24_68db7412-ba35-488b-8a45-9a9f48448522.spold,68db7412-ba35-488b-8a45-9a9f48448522,RNA,"market for nitric acid, without water, in 50% solution state",[],1.0,"nitric acid, without water, in 50% solution state",[],process,kilogram
c8df1264-afc2-515a-84ba-9666b047162b,market activity,"{'data entry': {'name': '[System]', 'email': 'support@ecoinvent.org'}, 'data generator': {'name': '[System]', 'email': 'support@ecoinvent.org'}}","[('EcoSpold01Categories', 'natural gas/production'), ('ISIC rev.4 ecoinvent', '4220:Construction of utility projects'), ('CPC', '53241: Long-distance pipelines')]",cd7eefd30c06db110bc9b2dc6f025cb1,"This is a market activity. In the case of services or immobile infrastructures, markets are connecting suppliers and consumers at a global level. For specific connections at regional level, direct links between the local producing activities and the local consumers are preferred. Transport or losses are logically not relevant for this type of products.
This is the market for  'pipeline, natural gas, long distance, high capacity, onshore', in the Global geography.
This market contains no transport or losses, as they are irrelevant for the delivered product.
This is an immobile infrastructure, representing the construction of a pipeline, high capacity that is used for natural gas distribution in long distances. It has a 1219mm diameter and a 12.3mm thickness, with a  capacity of 1.1 Mio. Nm3 gas per hour. It has a lifetime of 40 years, while after this period, half of the pipelines are disposed and the other half stays in the soil. The process includes building materials, fuel burned in the machinery, land transformation, helicopter used for inspection and decommission.",cutoff-3.9.1,c8df1264-afc2-515a-84ba-9666b047162b_a38bc59d-71aa-4953-bcfd-503ee77626fc.spold,a38bc59d-71aa-4953-bcfd-503ee77626fc,GLO,"market for pipeline, natural gas, long distance, high capacity, onshore",[],1.0,"pipeline, natural gas, long distance, high capacity, onshore",[],process,kilometer
2675d57f-0b34-5739-aa51-663cb7c20f5f,market activity,"{'data entry': {'name': 'Guillaume Bourgault', 'email': 'bourgault@ecoinvent.org'}, 'data generator': {'name': '[System]', 'email': 'support@ecoinvent.org'}}","[('ISIC rev.4 ecoinvent', '2011:Manufacture of basic chemicals'), ('EcoSpold01Categories', 'nuclear power/production'), ('CPC', '33620: Uranium enriched in U235 and its compounds; plutonium and its compounds; alloys, dispersions, ceramic products[…]')]",fe3eb2c1ad14f5832bd6ebd74b557433,"This is a market activity. Each market represents the consumption mix of a product in a given geography, connecting suppliers with consumers of the same product in the same geographical area. Markets group the producers and also the imports of the product (if relevant) within the same geographical area. They also account for transport to the consumer and for the losses during that process, when relevant.
This is the market for  'uranium, enriched 3.8%, per separative work unit', in the Global geography.
This product is generally considered to be used at the production site.  Therefore, the market does not contain any transport.
The product ""uranium, enriched 3.8%, per separative work unit"" represents a fuel. Uranium enrichment can be obtained through the centrifuge or diffusion process. The factor for the infrastructure requirement is calculated with annual throughput of 1500 t SWU for 30 years operation. The reference product is per separative work unit (SWU). There exist datasets for five different enrichment grades: 3.0%, 3.8%, 3.9%, 4.2% and 4.0%.",cutoff-3.9.1,2675d57f-0b34-5739-aa51-663cb7c20f5f_d0123246-cb50-447f-8df1-74e1119a2114.spold,d0123246-cb50-447f-8df1-74e1119a2114,GLO,"market for uranium, enriched 3.8%, per separative work unit",[],1.0,"uranium, enriched 3.8%, per separative work unit",[],process,unit
