activity,activity type,authors,classifications,code,comment,database,filename,flow,location,name,parameters,production amount,reference product,synonyms,type,unit
4ed73d40-0034-5aae-9f22-a0b92e1f2008,market activity,"{'data entry': {'name': 'Avraam Symeonidis', 'email': 'Symeonidis@ecoinvent.org'}, 'data generator': {'name': 'Avraam Symeonidis', 'email': 'Symeonidis@ecoinvent.org'}}","[('ISIC rev.4 ecoinvent', '2012:Manufacture of fertilizers and nitrogen compounds'), ('CPC', '34651: Ammonia, anhydrous')]",bdacb58853d6014daecc0de37210bddd,"This is a market activity. Each market represents the consumption mix of a product in a given geography, connecting suppliers with consumers of the same product in the same geographical area. Markets group the producers and also the imports of the product (if relevant) within the same geographical area. They also account for transport to the consumer and for the losses during that process, when relevant.
This dataset is a consumption mix, representing the supply of ''ammonia, anhydrous, liquid'' from activities that produce it, to activities that consume it within the geography of this dataset, Europe. 
If 1 kg of this 'ammonia, anhydrous, liquid' is used as fertiliser, it is equivalent to circa 0.822 kg of Nitrogen as N.
The dataset considers transportation from the producer to the consumer of this product, transportation distances are based on default transport distances for markets (found in file 'Default Transport Assumptions' at https://www.ecoinvent.org/support/documents-and-files/documents-and-files.html).
'Ammonia, anhydrous, liquid' is an inorganic substance with a CAS no. : 7664-41-7. It is called 'ammonia' under IUPAC naming and its molecular formula is: H3N. It is gaseous in normal conditions of temperature and pressure and has a distinct pungent odor. On a consumer level, 'ammonia, anhydrous, liquid' is used in the following products: cosmetics and personal care products, heat transfer fluids, washing & cleaning products and coating products. On industrial sites, the substance is used for the manufacture of products in the following sectors: chemicals, textile, leather or fur, pulp, paper and paper products, plastic products and fabricated metal products. Based on EU regulations (REGULATION (EU) 2019/1009), if this substance would be used as fertiliser, it could be labelled as N-P-K of: (82-0-0).
Geography:  This activity delivers the product of ''ammonia, anhydrous, liquid'' within the geography of Europe.",cutoff-3.9.1,4ed73d40-0034-5aae-9f22-a0b92e1f2008_06b8d05b-e1e6-427b-929c-bb55e84e7c08.spold,06b8d05b-e1e6-427b-929c-bb55e84e7c08,RER,"market for ammonia, anhydrous, liquid",[],1.0,"ammonia, anhydrous, liquid",[],process,kilogram
1dadaa32-0800-5801-93a2-ef5845fea64c,market activity,"{'data entry': {'name': 'Karin Treyer', 'email': 'karin.treyer@psi.ch'}, 'data generator': {'name': 'Karin Treyer', 'email': 'karin.treyer@psi.ch'}}","[('EcoSpold01Categories', 'natural gas/power plants'), ('ISIC rev.4 ecoinvent', '3510:Electric power generation, transmission and distribution'), ('CPC', '17100: Electrical energy')]",57c178984cb1d22b4525fbd56906b0c6,"This is a market activity. Each market represents the consumption mix of a product in a given geography, connecting suppliers with consumers of the same product in the same geographical area. Markets group the producers and also the imports of the product (if relevant) within the same geographical area. They also account for transport to the consumer and for the losses during that process, when relevant.
This dataset describes the electricity available on the high voltage level in Poland. This is done by showing the transmission of 1kWh electricity at high voltage.
Technology:  Average technology used to transmit and distribute electricity. Includes underground and overhead lines, as well as air-, vacuum- and SF6-insulated high-to-medium voltage switching stations. Electricity production according to related technology datasets. 
Definition of the voltage levels: 
 - High voltage level above 24 kV (large scale industry)
 - Medium voltage level between 1 kV and 24 kV (medium to small scale industry, service sector
and public buildings)
 - Low voltage level below 1 kV (Households)
Time period:  The 'Start of Period' and 'End of Period' do not refer to the year for which this market is valid. See general comment for the year for which the shares are based on.",cutoff-3.9.1,1dadaa32-0800-5801-93a2-ef5845fea64c_759b89bd-3aa6-42ad-b767-5bb9ef5d331d.spold,759b89bd-3aa6-42ad-b767-5bb9ef5d331d,PL,"market for electricity, medium voltage",[],1.0,"electricity, medium voltage",[],process,kilowatt hour
28ef7b43-16a6-5365-bffa-121660356ea2,ordinary transforming activity,"{'data entry': {'name': 'Tereza Levova', 'email': 'levova@ecoinvent.org'}, 'data generator': {'name': 'Tereza Levova', 'email': 'levova@ecoinvent.org'}}","[('ISIC rev.4 ecoinvent', '4923:Freight transport by road'), ('CPC', '6511: Road transport services of freight')]",9dc38a3e45c6e2f90999ac498905eaca,"This is a linking activity which transfers part of the production volume of the specific transport, freight, lorry of all sizes, EURO4 to the generic market for transport, freight, lorry, unspecified.
The transport, freight, lorry, unspecified is meant to be used by activities, where the size and EURO class of the transport supplied is unkown. 
[This dataset is meant to replace the following datasets:]",cutoff-3.9.1,28ef7b43-16a6-5365-bffa-121660356ea2_cfbce515-3f54-4411-ad9d-3d26b7faa15a.spold,cfbce515-3f54-4411-ad9d-3d26b7faa15a,RER,"transport, freight, lorry, all sizes, EURO4 to generic market for transport, freight, lorry, unspecified",[],1.0,"transport, freight, lorry, unspecified",[],process,ton kilometer
ad3fed2f-2b13-5b9f-b7fd-c500847de4ad,market activity,"{'data entry': {'name': 'David FitzGerald', 'email': 'fitzgerald@ecoinvent.org'}, 'data generator': {'name': 'David FitzGerald', 'email': 'fitzgerald@ecoinvent.org'}}","[('ISIC rev.4 ecoinvent', '3530:Steam and air conditioning supply'), ('CPC', '17300: Steam and hot water')]",337e70e3ec52515067d02f0e169da57e,"This is a market activity. Each market represents the consumption mix of a product in a given geography, connecting suppliers with consumers of the same product in the same geographical area. Markets group the producers and also the imports of the product (if relevant) within the same geographical area. They also account for transport to the consumer and for the losses during that process, when relevant.
This is the market for  'steam, in chemical industry', in the geography of Europe.
This market contains no transport or losses, as they are irrelevant for the delivered product.
steam, in chemical industry'  is gaseous fuel used for heating in the chemical industry (energy content of 2.75 MJ/kg).",cutoff-3.9.1,ad3fed2f-2b13-5b9f-b7fd-c500847de4ad_bd20be8e-9b7a-4391-980f-4ecf8f2867be.spold,bd20be8e-9b7a-4391-980f-4ecf8f2867be,RER,"market for steam, in chemical industry",[],1.0,"steam, in chemical industry",[],process,kilogram
9f571a5d-24da-50c3-ae2b-6b4c4cc11af3,market activity,"{'data entry': {'name': 'Avraam Symeonidis', 'email': 'Symeonidis@ecoinvent.org'}, 'data generator': {'name': 'Avraam Symeonidis', 'email': 'Symeonidis@ecoinvent.org'}}","[('ISIC rev.4 ecoinvent', '0891:Mining of chemical and fertilizer minerals'), ('CPC', '34639: Carnallite, sylvite and other potassic fertilizers, n.e.c.')]",184f0f251720fcf4da91cd70b179d44e,"This is a market activity. Each market represents the consumption mix of a product in a given geography, connecting suppliers with consumers of the same product in the same geographical area. Markets group the producers and also the imports of the product (if relevant) within the same geographical area. They also account for transport to the consumer and for the losses during that process, when relevant.
This dataset is a consumption mix, representing the supply of ''potash salt'' from activities that produce it, to activities that consume it within the geography of this dataset, Europe. 
If 1 kg of this 'potash salt' is used as fertiliser, it is equivalent to circa 0.1 kg of Potassium as K2O.
The dataset considers transportation from the producer to the consumer of this product, transportation distances are based on default transport distances for markets (found in file 'Default Transport Assumptions' at https://www.ecoinvent.org/support/documents-and-files/documents-and-files.html).
'Potash salt' is an inorganic substance. It is solid in normal conditions of temperature and pressure. Based on EU regulations (REGULATION (EU) 2019/1009), if this substance would be used as fertiliser, it could be labelled as N-P-K of: (0-0-8).
Geography:  This activity delivers the product of ''potash salt'' within the geography of Europe.",cutoff-3.9.1,9f571a5d-24da-50c3-ae2b-6b4c4cc11af3_eadd8b3b-9c5d-5166-a244-4f4e46914133.spold,eadd8b3b-9c5d-5166-a244-4f4e46914133,RER,market for potash salt,[],1.0,potash salt,[],process,kilogram
13c7696b-9af5-5c06-91b1-a08b70b87e0b,market activity,"{'data entry': {'name': 'Lucia Valsasina', 'email': 'valsasina@ecoinvent.org'}, 'data generator': {'name': 'Lucia Valsasina', 'email': 'valsasina@ecoinvent.org'}}","[('EcoSpold01Categories', 'transport systems/road'), ('ISIC rev.4 ecoinvent', '4923:Freight transport by road'), ('CPC', '6511: Road transport services of freight')]",d6655a43e0d3a5f786929ade5064e0fd,"This is a market activity. Each market represents the consumption mix of a product in a given geography, connecting suppliers with consumers of the same product in the same geographical area. Markets group the producers and also the imports of the product (if relevant) within the same geographical area. They also account for transport to the consumer and for the losses during that process, when relevant.
This is the market for 'transport, freight, lorry, unspecified', in the the geography of Europe. This is a generic market; the suppliers of this market make available this generic product by redirecting a part of the production of several more specific products.
No transport or losses have been considered for the generic product supplied in this market, as the transport modelled in the upstream niche markets for the more specific products do already account it.
This is delivering the service of transportation of 1 metric ton across the distance of 1 km. This service only considers the transportation of goods. The vehicle operates with diesel, and it provides a fleet average that includes different lorry classes as well as EURO classes. Specific transport activities are available in the database, this represents a generic product that can be used when no further information are available.  This service provides combines data for transport which is calculated for an average load factor, including empty return trips.",cutoff-3.9.1,13c7696b-9af5-5c06-91b1-a08b70b87e0b_cfbce515-3f54-4411-ad9d-3d26b7faa15a.spold,cfbce515-3f54-4411-ad9d-3d26b7faa15a,RER,"market for transport, freight, lorry, unspecified",[],1.0,"transport, freight, lorry, unspecified",[],process,ton kilometer
f01cd604-0abb-5b1d-bc24-d1dbf699158d,ordinary transforming activity,"{'data entry': {'name': 'Tereza Levova', 'email': 'levova@ecoinvent.org'}, 'data generator': {'name': 'Tereza Levova', 'email': 'levova@ecoinvent.org'}}","[('ISIC rev.4 ecoinvent', '4923:Freight transport by road'), ('CPC', '6511: Road transport services of freight')]",cf361b5556d9a5efb113a584d4a44ba5,"This is a linking activity which transfers part of the production volume of the specific transport, freight, lorry of all sizes, EURO3 to the generic market for transport, freight, lorry, unspecified.
The transport, freight, lorry, unspecified is meant to be used by activities, where the size and EURO class of the transport supplied is unkown. 
[This dataset is meant to replace the following datasets:
 - size-specific lorry transport to generic market for lorry transport, RER, 2005 - 2005 (47efd230-3980-416d-95a1-7afb566aab36)]",cutoff-3.9.1,f01cd604-0abb-5b1d-bc24-d1dbf699158d_cfbce515-3f54-4411-ad9d-3d26b7faa15a.spold,cfbce515-3f54-4411-ad9d-3d26b7faa15a,RER,"transport, freight, lorry, all sizes, EURO3 to generic market for transport, freight, lorry, unspecified",[],1.0,"transport, freight, lorry, unspecified",[],process,ton kilometer
ad3023f2-821f-5897-a49a-794a47a1b743,market activity,"{'data entry': {'name': 'Karin Treyer', 'email': 'karin.treyer@psi.ch'}, 'data generator': {'name': 'Karin Treyer', 'email': 'karin.treyer@psi.ch'}}","[('ISIC rev.4 ecoinvent', '3510:Electric power generation, transmission and distribution'), ('CPC', '17100: Electrical energy')]",587de926b32b3b40d8dc089c6746f917,"This is a market activity. Each market represents the consumption mix of a product in a given geography, connecting suppliers with consumers of the same product in the same geographical area. Markets group the producers and also the imports of the product (if relevant) within the same geographical area. They also account for transport to the consumer and for the losses during that process, when relevant.
This dataset describes the electricity available on the high voltage level in United Kingdom. This is done by showing the transmission of 1kWh electricity at high voltage.
Technology:  Average technology used to transmit and distribute electricity. Includes underground and overhead lines. Electricity production according to related technology datasets.
Definition of the voltage levels:
- High voltage level above 24 kV (large scale industry)
- Medium voltage level between 1 kV and 24 kV (medium to small scale industry, service sector
and public buildings)
- Low voltage level below 1 kV (Households)
Time period:  The 'Start of Period' and 'End of Period' do not refer to the year for which this market is valid. See general comment for the year for which the shares are based on.",cutoff-3.9.1,ad3023f2-821f-5897-a49a-794a47a1b743_66c93e71-f32b-4591-901c-55395db5c132.spold,66c93e71-f32b-4591-901c-55395db5c132,GB,"market for electricity, high voltage",[],1.0,"electricity, high voltage",[],process,kilowatt hour
edd72def-80f9-5956-9c00-2f68070263e7,market activity,"{'data entry': {'name': 'Carl Vadenbo', 'email': 'vadenbo@ecoinvent.org'}, 'data generator': {'name': 'Maresa Bussa', 'email': 'bussa@esu-services.ch'}}","[('ISIC rev.4 ecoinvent', '3520:Manufacture of gas; distribution of gaseous fuels through mains'), ('CPC', '12020: Natural gas, liquefied or in the gaseous state')]",59cf8916e90678fe85a12f5b5666972e,"This is a market activity. Each market represents the consumption mix of a product in a given geography, connecting suppliers with consumers of the same product in the same geographical area. Markets group the producers and the imports of the product (if relevant) within the same geographical area. They also account for transport (distribution) to the consumer and for the losses during that process, when relevant.
This is the market for ‘natural gas, high pressure"" [m3], in the geography of Italy. The consumption mix is calculated based on own production - if relevant - and trade statistics provided in BP (2020).It contains information on energy and transport requirement (excluding for any imports, which are modelled in separate datasets) and the losses and emissions occurring during the distribution.
The product ‘natural gas, high pressure"" is a fossil fuel, for which a generic gross calorific value (GCV) of 40MJ/m3, a net calorific value (NCV) of 36.0 MJ/m3 and a density of 0.735kg/m3 for natural gas are applied, in line with the global statistics (referring to standard cubic meters, Sm3, measured at 15°C and 1013 mbar), based on Meili et al. (2022). It is used as a gaseous fuel and is sourced from oil and gas production and evaporation of liquid natural gas. The initial overpressure of the gas is 1-5 bar (1000-5000 hPa). Natural gas supplied at high pressure is predominantly used by large consumers, e.g., power plants and industries. 
Reference(s): 
Bussa, M., N. Jungbluth, Ch. Meili (2022) Life cycle inventories for long-distance transport and distribution of natural gas. ESU-services Ltd. Schaffhausen, Switzerland. Available from: http://esu-services.ch/data/public-lci-reports/
BP (2020) BP Statistical Review of World Energy 2019. BP, London, UK. Retrieved from: https://www.bp.com/en/global/corporate/energy-economics/statistical-reviewof-world-energy.html.
Geography:  Italy
Technology:  This dataset refers only to the delivery of high pressure natural gas, which has 1-5 bar overpressure. The gas is supplied to consumers via onshore pipelines. The delivery at low pressure (0.1 bar overpressure), e.g., to households, is not considered within this activity. 
Time period:  Energy requirements are from 2019 and leakage data are from 2018.",cutoff-3.9.1,edd72def-80f9-5956-9c00-2f68070263e7_a9007f10-7e39-4d50-8f4a-d6d03ce3d673.spold,a9007f10-7e39-4d50-8f4a-d6d03ce3d673,IT,"market for natural gas, high pressure",[],1.0,"natural gas, high pressure",[],process,cubic meter
b15ab842-2312-5bb6-8236-2938afe4d3c6,market group,"{'data entry': {'name': '[System]', 'email': 'support@ecoinvent.org'}, 'data generator': {'name': '[System]', 'email': 'support@ecoinvent.org'}}","[('ISIC rev.4 ecoinvent', '3510:Electric power generation, transmission and distribution'), ('CPC', '17100: Electrical energy')]",6f3bff7be2bf2f55a7afd206b7512bfd,"This dataset is a market group. Market groups represent a 'market of markets'. Their purpose is to group a set of markets into larger, geographically relevant datasets.
Market groups are created for convenience and ease of use. They only group other markets and/or market groups contained within their geography.
Losses and relevant exchanges (transport, transport infrastructure, etc.) are not included in this dataset. They are present in the contained markets.  
This is the market group for 'electricity, low voltage', in Europe.",cutoff-3.9.1,b15ab842-2312-5bb6-8236-2938afe4d3c6_d69294d7-8d64-4915-a896-9996a014c410.spold,d69294d7-8d64-4915-a896-9996a014c410,RER,"market group for electricity, low voltage",[],1.0,"electricity, low voltage",[],process,kilowatt hour
1b5f1a79-fb78-54d8-b587-3f6d0b0b544d,market activity,"{'data entry': {'name': 'Lucia Valsasina', 'email': 'valsasina@ecoinvent.org'}, 'data generator': {'name': 'Lucia Valsasina', 'email': 'valsasina@ecoinvent.org'}}","[('ISIC rev.4 ecoinvent', '4923:Freight transport by road'), ('EcoSpold01Categories', 'transport systems/road'), ('CPC', '6511: Road transport services of freight')]",6ca7b29718f15f4e8ec4ef6a90987fd5,"This is a market activity. Each market represents the consumption mix of a product in a given geography, connecting suppliers with consumers of the same product in the same geographical area. Markets group the producers and also the imports of the product (if relevant) within the same geographical area. They also account for transport to the consumer and for the losses during that process, when relevant.
This is the market for  'transport, freight, lorry >32 metric ton, EURO4', in the geography of Europe.
This market contains no transport or losses, as they are irrelevant for the delivered product.
This is delivering the service of transportation of 1 metric ton across the distance of 1 km. This service only considers the transportation of goods. The vehicle operates with diesel, its emission standard is classified as EURO4 and it falls under the lorry size class of  >32 metric tons. The average freight load factor of a >32 metric ton lorry is 15.96 tonnes, with a gross vehicle weight (GVW) of 29.96 tonnes. It has a lifetime capacity of 540,000 km as heavy commercial vehicle. Data for transport is calculated for an average load factor, including empty return trips.",cutoff-3.9.1,1b5f1a79-fb78-54d8-b587-3f6d0b0b544d_fea783cd-1b3e-47ed-a4a1-346094ebc39a.spold,fea783cd-1b3e-47ed-a4a1-346094ebc39a,RER,"market for transport, freight, lorry >32 metric ton, EURO4",[],1.0,"transport, freight, lorry >32 metric ton, EURO4",[],process,ton kilometer
9d614153-581e-53ff-8757-15298d84da88,market activity,"{'data entry': {'name': 'Avraam Symeonidis', 'email': 'Symeonidis@ecoinvent.org'}, 'data generator': {'name': 'Avraam Symeonidis', 'email': 'Symeonidis@ecoinvent.org'}}","[('ISIC rev.4 ecoinvent', '2012:Manufacture of fertilizers and nitrogen compounds'), ('CPC', '34642: Diammonium hydrogenorthophosphate (diammonium phosphate)')]",045cd6e7461f467bdb6dd947c54324ff,"This is a market activity. Each market represents the consumption mix of a product in a given geography, connecting suppliers with consumers of the same product in the same geographical area. Markets group the producers and also the imports of the product (if relevant) within the same geographical area. They also account for transport to the consumer and for the losses during that process, when relevant.
This dataset is a consumption mix, representing the supply of ''diammonium phosphate'' from activities that produce it, to activities that consume it within the geography of this dataset, Europe. 
If 1 kg of this 'diammonium phosphate' is used as fertiliser, it is equivalent to circa 0.18 kg of Nitrogen as N and 0.46 kg of Phosphorus as P2O5.
The dataset considers transportation from the producer to the consumer of this product, transportation distances are based on default transport distances for markets (found in file 'Default Transport Assumptions' at https://www.ecoinvent.org/support/documents-and-files/documents-and-files.html).
'Diammonium phosphate' is an inorganic substance, mixture of nitrogen and phosphate fertiliser. It is solid in normal conditions of temperature and pressure. On a consumer level, 'diammonium phosphate' is used in the following products: fertilisers and plant protection products. On industrial sites, the substance is used for the manufacture of products in the following sectors: pH regulators and water treatment products, coating products, paper chemicals and dyes, polymers, textile treatment products and dyes, fuels, leather treatment products and pharmaceuticals. Based on EU regulations (REGULATION (EU) 2019/1009), if this substance would be used as fertiliser, it could be labelled as N-P-K of: (18-20-0).
Geography:  This activity delivers the product of ''diammonium phosphate'' within the geography of Europe.",cutoff-3.9.1,9d614153-581e-53ff-8757-15298d84da88_deacf25b-6aee-5105-893d-b78661769ca8.spold,deacf25b-6aee-5105-893d-b78661769ca8,RER,market for diammonium phosphate,[],1.0,diammonium phosphate,[],process,kilogram
80205fa6-64db-55ab-9783-f3a5d45b90ac,market activity,"{'data entry': {'name': 'Guillaume Bourgault', 'email': 'bourgault@ecoinvent.org'}, 'data generator': {'name': '[System]', 'email': 'support@ecoinvent.org'}}","[('EcoSpold01Categories', 'metals/extraction'), ('ISIC rev.4 ecoinvent', '2410:Manufacture of basic iron and steel'), ('CPC', '41121: Non-alloy steel in ingots or other primary forms, and semi-finished products of non-alloy steel')]",d872e0d78319cb13e12b96de83e19dd7,"This is a market activity. Each market represents the consumption mix of a product in a given geography, connecting suppliers with consumers of the same product in the same geographical area. Markets group the producers and also the imports of the product (if relevant) within the same geographical area. They also account for transport to the consumer and for the losses during that process, when relevant.
This is the market for  'steel, unalloyed', in the Global geography.
Transport distances are based on the ecoinvent ""Default Transport Assumptions"" model, accessible on the ecoinvent website.
Geography:  Activity represents the supply of iron ore concentrate globally.",cutoff-3.9.1,80205fa6-64db-55ab-9783-f3a5d45b90ac_a2fd8c95-f2db-436a-9f24-f33b17f7975b.spold,a2fd8c95-f2db-436a-9f24-f33b17f7975b,GLO,"market for steel, unalloyed",[],1.0,"steel, unalloyed",[],process,kilogram
525210f4-0466-5e8e-b31c-7d70d36cd55a,market group,"{'data entry': {'name': '[System]', 'email': 'support@ecoinvent.org'}, 'data generator': {'name': '[System]', 'email': 'support@ecoinvent.org'}}","[('ISIC rev.4 ecoinvent', '3510:Electric power generation, transmission and distribution'), ('CPC', '17100: Electrical energy')]",419243ae593d779ce102a6cde5f99de0,"This dataset is a market group. Market groups represent a 'market of markets'. Their purpose is to group a set of markets into larger, geographically relevant datasets.
Market groups are created for convenience and ease of use. They only group other markets and/or market groups contained within their geography.
Losses and relevant exchanges (transport, transport infrastructure, etc.) are not included in this dataset. They are present in the contained markets.  
This is the market group for 'electricity, low voltage', in Europe without Switzerland.",cutoff-3.9.1,525210f4-0466-5e8e-b31c-7d70d36cd55a_d69294d7-8d64-4915-a896-9996a014c410.spold,d69294d7-8d64-4915-a896-9996a014c410,Europe without Switzerland,"market group for electricity, low voltage",[],1.0,"electricity, low voltage",[],process,kilowatt hour
