activity,activity type,authors,classifications,code,comment,database,filename,flow,location,name,parameters,production amount,reference product,synonyms,type,unit
056395a3-5fe3-50b2-a9db-0478d03a6baa,market activity,"{'data entry': {'name': 'Karin Treyer', 'email': 'karin.treyer@psi.ch'}, 'data generator': {'name': 'Karin Treyer', 'email': 'karin.treyer@psi.ch'}}","[('EcoSpold01Categories', 'electricity/supply mix'), ('ISIC rev.4 ecoinvent', '3510:Electric power generation, transmission and distribution'), ('CPC', '17100: Electrical energy')]",8f00928cc7c8110608017f53445d02f3,"This is a market activity. Each market represents the consumption mix of a product in a given geography, connecting suppliers with consumers of the same product in the same geographical area. Markets group the producers and also the imports of the product (if relevant) within the same geographical area. They also account for transport to the consumer and for the losses during that process, when relevant.
This dataset describes the electricity available on the high voltage level in Poland. This is done by showing the transmission of 1kWh electricity at high voltage.
Technology:  Average technology used to transmit and distribute electricity. Includes underground and overhead lines, as well as air-, vacuum- and SF6-insulated high-to-medium voltage switching stations. Electricity production according to related technology datasets.
Time period:  The 'Start of Period' and 'End of Period' do not refer to the year for which this market is valid. See general comment for the year for which the shares are based on.",cutoff-3.9.1,056395a3-5fe3-50b2-a9db-0478d03a6baa_d69294d7-8d64-4915-a896-9996a014c410.spold,d69294d7-8d64-4915-a896-9996a014c410,PL,"market for electricity, low voltage",[],1.0,"electricity, low voltage",[],process,kilowatt hour
372a1991-e0af-5fbf-8611-295a535373ad,market activity,"{'data entry': {'name': 'Guillaume Bourgault', 'email': 'bourgault@ecoinvent.org'}, 'data generator': {'name': '[System]', 'email': 'support@ecoinvent.org'}}","[('EcoSpold01Categories', 'metals/extraction'), ('ISIC rev.4 ecoinvent', '2410:Manufacture of basic iron and steel'), ('CPC', '4124: Bars and rods, hot-rolled, of iron or steel')]",bd3a3818f60643fd78eccefa7b4390c1,"This is a market activity. Each market represents the consumption mix of a product in a given geography, connecting suppliers with consumers of the same product in the same geographical area. Markets group the producers and also the imports of the product (if relevant) within the same geographical area. They also account for transport to the consumer and for the losses during that process, when relevant.
This is the market for  'reinforcing steel', in the Global geography.
In this market, expert judgement was used to develop product specific transport distance estimations.",cutoff-3.9.1,372a1991-e0af-5fbf-8611-295a535373ad_9ba48284-0f03-4fec-800d-de77833b12f6.spold,9ba48284-0f03-4fec-800d-de77833b12f6,GLO,market for reinforcing steel,[],1.0,reinforcing steel,[],process,kilogram
00ae5d69-d28d-5bb2-a1ee-b24863b2c081,market group,"{'data entry': {'name': '[System]', 'email': 'support@ecoinvent.org'}, 'data generator': {'name': '[System]', 'email': 'support@ecoinvent.org'}}","[('ISIC rev.4 ecoinvent', '3520:Manufacture of gas; distribution of gaseous fuels through mains'), ('CPC', '12020: Natural gas, liquefied or in the gaseous state')]",e3ab796d95c29b9140f0915aa3d8ced2,"This dataset is a market group. Market groups represent a 'market of markets'. Their purpose is to group a set of markets into larger, geographically relevant datasets.
Market groups are created for convenience and ease of use. They only group other markets and/or market groups contained within their geography.
Losses and relevant exchanges (transport, transport infrastructure, etc.) are not included in this dataset. They are present in the contained markets.  
This is the market group for 'natural gas, high pressure', in Europe without Switzerland.",cutoff-3.9.1,00ae5d69-d28d-5bb2-a1ee-b24863b2c081_a9007f10-7e39-4d50-8f4a-d6d03ce3d673.spold,a9007f10-7e39-4d50-8f4a-d6d03ce3d673,Europe without Switzerland,"market group for natural gas, high pressure",[],1.0,"natural gas, high pressure",[],process,cubic meter
9caa234c-86e4-50e3-a588-c4ca30453075,market activity,"{'data entry': {'name': 'Karin Treyer', 'email': 'karin.treyer@psi.ch'}, 'data generator': {'name': 'Karin Treyer', 'email': 'karin.treyer@psi.ch'}}","[('ISIC rev.4 ecoinvent', '3510:Electric power generation, transmission and distribution'), ('CPC', '17100: Electrical energy')]",a74c4b4fcba44a29f808f55f837267e2,"This is a market activity. Each market represents the consumption mix of a product in a given geography, connecting suppliers with consumers of the same product in the same geographical area. Markets group the producers and also the imports of the product (if relevant) within the same geographical area. They also account for transport to the consumer and for the losses during that process, when relevant.
This dataset describes the electricity available on the high voltage level in Poland. This is done by showing the transmission of 1kWh electricity at high voltage.
Technology:  Average technology used to transmit and distribute electricity. Includes underground and overhead lines. Electricity production according to related technology datasets.
Definition of the voltage levels:
- High voltage level above 24 kV (large scale industry)
- Medium voltage level between 1 kV and 24 kV (medium to small scale industry, service sector
and public buildings)
- Low voltage level below 1 kV (Households)
Time period:  The 'Start of Period' and 'End of Period' do not refer to the year for which this market is valid. See general comment for the year for which the shares are based on.",cutoff-3.9.1,9caa234c-86e4-50e3-a588-c4ca30453075_66c93e71-f32b-4591-901c-55395db5c132.spold,66c93e71-f32b-4591-901c-55395db5c132,PL,"market for electricity, high voltage",[],1.0,"electricity, high voltage",[],process,kilowatt hour
29f2329c-76d9-590b-ab5f-ec9341f881f4,market activity,"{'data entry': {'name': 'Johannes Müller', 'email': 'mueller@ecoinvent.org'}, 'data generator': {'name': 'Johannes Müller', 'email': 'mueller@ecoinvent.org'}}","[('ISIC rev.4 ecoinvent', '2410:Manufacture of basic iron and steel'), ('EcoSpold01Categories', 'metals/extraction'), ('CPC', '41111: Pig iron and spiegeleisen in pigs, blocks or other primary forms')]",a309624068522e73107aef09fc7aca59,"This is a market activity. Each market represents the consumption mix of a product in a given geography, connecting suppliers with consumers of the same product in the same geographical area. Markets group the producers and also the imports of the product (if relevant) within the same geographical area. They also account for transport to the consumer and for the losses during that process, when relevant.
This is the market for  'pig iron', in the Global geography.
This activity represents the global supply of pig iron (hot metal) to steelmaking plants.
Transport distances are based on the ecoinvent ""Default Transport Assumptions"" model, accessible on the ecoinvent website.
Geography:  Activity represents the supply of iron ore concentrate globally.",cutoff-3.9.1,29f2329c-76d9-590b-ab5f-ec9341f881f4_a636ed9e-f90a-48cb-a180-c75b1fc92cf1.spold,a636ed9e-f90a-48cb-a180-c75b1fc92cf1,RoW,market for pig iron,[],1.0,pig iron,[],process,kilogram
17946531-bbf2-55a9-a410-13ddfdb9c68c,market activity,"{'data entry': {'name': 'Karin Treyer', 'email': 'karin.treyer@psi.ch'}, 'data generator': {'name': 'Karin Treyer', 'email': 'karin.treyer@psi.ch'}}","[('ISIC rev.4 ecoinvent', '3510:Electric power generation, transmission and distribution'), ('EcoSpold01Categories', 'electricity/supply mix'), ('CPC', '17100: Electrical energy')]",5c9a1c84014e7f93940761dce4c4af07,"This is a market activity. Each market represents the consumption mix of a product in a given geography, connecting suppliers with consumers of the same product in the same geographical area. Markets group the producers and also the imports of the product (if relevant) within the same geographical area. They also account for transport to the consumer and for the losses during that process, when relevant.
This dataset describes the electricity available on the high voltage level in Germany. This is done by showing the transmission of 1kWh electricity at high voltage.
Technology:  Average technology used to transmit and distribute electricity. Includes underground and overhead lines, as well as air-, vacuum- and SF6-insulated high-to-medium voltage switching stations. Electricity production according to related technology datasets.
Time period:  The 'Start of Period' and 'End of Period' do not refer to the year for which this market is valid. See general comment for the year for which the shares are based on.",cutoff-3.9.1,17946531-bbf2-55a9-a410-13ddfdb9c68c_d69294d7-8d64-4915-a896-9996a014c410.spold,d69294d7-8d64-4915-a896-9996a014c410,DE,"market for electricity, low voltage",[],1.0,"electricity, low voltage",[],process,kilowatt hour
4be0eb22-306e-5693-80e0-7e625cb639d7,market activity,"{'data entry': {'name': 'Niels Jungbluth', 'email': 'ecoinvent@esu-services.ch'}, 'data generator': {'name': 'Niels Jungbluth', 'email': 'ecoinvent@esu-services.ch'}}","[('EcoSpold01Categories', 'oil/fuels'), ('ISIC rev.4 ecoinvent', '1920:Manufacture of refined petroleum products'), ('CPC', '33360: Gas oil')]",93406e2b0b71b9681c5aba419dddc642,"This is a market activity. Each market represents the consumption mix of a product in a given geography, connecting suppliers with consumers of the same product in the same geographical area. Markets group the producers and also the imports of the product (if relevant) within the same geographical area. They also account for transport to the consumer and for the losses during that process, when relevant.
This is the market for  'diesel, low-sulfur', in the geography of Europe without Switzerland.
Inventory for the distribution of petroleum product to the final consumer (household, car, power plant, etc.) including all necessary transports.
[This dataset was already contained in the ecoinvent database version 2. It was not individually updated during the transfer to ecoinvent version 3. Life Cycle Impact Assessment results may still have changed, as they are affected by changes in the supply chain, i.e. in other datasets. This dataset was generated following the ecoinvent quality guidelines for version 2. It may have been subject to central changes described in the ecoinvent version 3 change report (http://www.ecoinvent.org/database/ecoinvent-version-3/reports-of-changes/), and the results of the central updates were reviewed extensively. The changes added e.g. consistent water flows and other information throughout the database. The documentation of this dataset can be found in the ecoinvent reports of version 2, which are still available via the ecoinvent website. The change report linked above covers all central changes that were made during the conversion process.]
diesel, low-sulfur' is a fossil fuel with a calorific value of 42.8 MJ/kg. It is used as a liquid fuel and is sourced from fractional distillation of crude oil. Its main applications are in the following sectors: automotive, railroad, aviation, agricultural and military vehicle fuel.
Geography:  Surveys mainly for DE and CH.
Technology:  Distribution of petroleum products.
Time period:  Most information for the year 2000. Split up of NMVOC emissions published 1989.",cutoff-3.9.1,4be0eb22-306e-5693-80e0-7e625cb639d7_b80eb2d5-1256-41bb-a61d-83252d0dfd4d.spold,b80eb2d5-1256-41bb-a61d-83252d0dfd4d,Europe without Switzerland,"market for diesel, low-sulfur","[{'description': 'fraction, process water, to air', 'id': 'daadf2d4-7bbb-4f69-8ab5-58df4c1685eb', 'unit': 'dimensionless', 'comment': 'Literature value. In case when no industry/process specific data are available, default evaporation fraction value is used. This value is 15% and is based on literature (Statistics Canada, 2007 & Shaffer, K.H., 2008, Consumptive water use in the Great Lakes Basin, USGS & Shiklomanov, 2003, World Water Resources at the Beginning of the 21st Century) and has been approved by an expert.', 'amount': 0.15, 'pedigree': {'reliability': 4, 'completeness': 4, 'temporal correlation': 3, 'geographical correlation': 2, 'further technological correlation': 4}, 'uncertainty type': 2, 'loc': -1.9, 'scale': 0.30335622624235026, 'scale without pedigree': 0.2, 'name': 'fraction_PW_to_air'}, {'description': 'fraction, tap water, to air', 'id': '148c8010-cc60-48cd-9b40-fc7278e377f7', 'unit': 'dimensionless', 'comment': 'Calculated value. See comment in the other parametres present in this dataset. Tap water is considered to be always used as process water, thus process water fractions to air are applied to all tap water input flows to calculate the amount of water consumed in the processes.', 'amount': 0.15, 'pedigree': {'reliability': 4, 'completeness': 4, 'temporal correlation': 3, 'geographical correlation': 2, 'further technological correlation': 4}, 'uncertainty type': 2, 'loc': -1.9, 'scale': 0.30335622624235026, 'scale without pedigree': 0.2, 'name': 'fraction_TW_to_air'}]",1.0,"diesel, low-sulfur",['green diesel'],process,kilogram
f5eff8f9-7b0c-54d7-baa3-c8ef3e8a6611,market activity,"{'data entry': {'name': 'Guillaume Bourgault', 'email': 'bourgault@ecoinvent.org'}, 'data generator': {'name': '[System]', 'email': 'support@ecoinvent.org'}}","[('EcoSpold01Categories', 'metals/extraction'), ('ISIC rev.4 ecoinvent', '2410:Manufacture of basic iron and steel'), ('CPC', '41122: Alloy steel in ingots or other primary forms and semi-finished products of alloy steel')]",683f869780ee789d92d3b2a737534a44,"This is a market activity. In the case of services or immobile infrastructures, markets are connecting suppliers and consumers at a global level. For specific connections at regional level, direct links between the local producing activities and the local consumers are preferred. Transport or losses are logically not relevant for this type of products.
This is the market for  'steel, chromium steel 18/8, hot rolled', in the Global geography.
This market contains no transport or losses, as they are irrelevant for the delivered product.",cutoff-3.9.1,f5eff8f9-7b0c-54d7-baa3-c8ef3e8a6611_c5246dbb-0abd-4bee-8dda-d52a1b202322.spold,c5246dbb-0abd-4bee-8dda-d52a1b202322,GLO,"market for steel, chromium steel 18/8, hot rolled",[],1.0,"steel, chromium steel 18/8, hot rolled",[],process,kilogram
3b11f419-2204-5b7c-8cf5-70650f0555ca,market activity,"{'data entry': {'name': 'Guillaume Bourgault', 'email': 'bourgault@ecoinvent.org'}, 'data generator': {'name': '[System]', 'email': 'support@ecoinvent.org'}}","[('EcoSpold01Categories', 'construction processes/buildings'), ('ISIC rev.4 ecoinvent', '2710:Manufacture of electric motors, generators, transformers and electricity di'), ('CPC', '482: Instruments and appliances for measuring, checking, testing, navigating and other purposes, except optical instr[…]')]",23810b0bbe04fca71b0f53fc97d56360,"This is a market activity. Each market represents the consumption mix of a product in a given geography, connecting suppliers with consumers of the same product in the same geographical area. Markets group the producers and also the imports of the product (if relevant) within the same geographical area. They also account for transport to the consumer and for the losses during that process, when relevant.
This is the market for  'electronics, for control units', in the Global geography.
In this market, expert judgement was used to develop product specific transport distance estimations.",cutoff-3.9.1,3b11f419-2204-5b7c-8cf5-70650f0555ca_245732f4-a5ce-4881-816b-a207ba8df4c8.spold,245732f4-a5ce-4881-816b-a207ba8df4c8,GLO,"market for electronics, for control units",[],1.0,"electronics, for control units",[],process,kilogram
c9407332-800f-5368-8b64-20c7e9bf3c6c,market activity,"{'data entry': {'name': 'Karin Treyer', 'email': 'karin.treyer@psi.ch'}, 'data generator': {'name': 'Karin Treyer', 'email': 'karin.treyer@psi.ch'}}","[('EcoSpold01Categories', 'natural gas/power plants'), ('ISIC rev.4 ecoinvent', '3510:Electric power generation, transmission and distribution'), ('CPC', '17100: Electrical energy')]",6287db0c56830869ff2451fb1aa0f5f3,"This is a market activity. Each market represents the consumption mix of a product in a given geography, connecting suppliers with consumers of the same product in the same geographical area. Markets group the producers and also the imports of the product (if relevant) within the same geographical area. They also account for transport to the consumer and for the losses during that process, when relevant.
This dataset describes the electricity available on the high voltage level in Germany. This is done by showing the transmission of 1kWh electricity at high voltage.
Technology:  Average technology used to transmit and distribute electricity. Includes underground and overhead lines, as well as air-, vacuum- and SF6-insulated high-to-medium voltage switching stations. Electricity production according to related technology datasets. 
Definition of the voltage levels: 
 - High voltage level above 24 kV (large scale industry)
 - Medium voltage level between 1 kV and 24 kV (medium to small scale industry, service sector
and public buildings)
 - Low voltage level below 1 kV (Households)
Time period:  The 'Start of Period' and 'End of Period' do not refer to the year for which this market is valid. See general comment for the year for which the shares are based on.",cutoff-3.9.1,c9407332-800f-5368-8b64-20c7e9bf3c6c_759b89bd-3aa6-42ad-b767-5bb9ef5d331d.spold,759b89bd-3aa6-42ad-b767-5bb9ef5d331d,DE,"market for electricity, medium voltage",[],1.0,"electricity, medium voltage",[],process,kilowatt hour
ba2e2140-2236-5235-8ecd-646909613f25,market activity,"{'data entry': {'name': 'Avraam Symeonidis', 'email': 'Symeonidis@ecoinvent.org'}, 'data generator': {'name': 'Avraam Symeonidis', 'email': 'Symeonidis@ecoinvent.org'}}","[('ISIC rev.4 ecoinvent', '2012:Manufacture of fertilizers and nitrogen compounds'), ('CPC', '34641: Fertilizers containing three nutrients: nitrogen, phosphorus and potassium')]",db78f7b919d1f546c0fc51aac8848660,"This is a market activity. Each market represents the consumption mix of a product in a given geography, connecting suppliers with consumers of the same product in the same geographical area. Markets group the producers and also the imports of the product (if relevant) within the same geographical area. They also account for transport to the consumer and for the losses during that process, when relevant.
This dataset is a consumption mix, representing the supply of ''NPK (15-15-15) fertiliser'' from activities that produce it, to activities that consume it within the geography of this dataset, Europe. 
If 1 kg of this 'NPK (15-15-15) fertiliser' is used as fertiliser, it is equivalent to circa 0.15 kg of Nitrogen as N and 0.344 kg of Phosphorus as P2O5 and 0.181 kg of Potassium as K2O.
The dataset considers transportation from the producer to the consumer of this product, transportation distances are based on default transport distances for markets (found in file 'Default Transport Assumptions' at https://www.ecoinvent.org/support/documents-and-files/documents-and-files.html).
'NPK (15-15-15) fertiliser' is an inorganic substance, mixture of nitrogen, phosphate and potassium fertiliser. It is solid in normal conditions of temperature and pressure. Based on EU regulations (REGULATION (EU) 2019/1009), if this substance would be used as fertiliser, it could be labelled as N-P-K of: (15-15-15).
Geography:  This activity delivers the product of ''NPK (15-15-15) fertiliser'' within the geography of Europe.",cutoff-3.9.1,ba2e2140-2236-5235-8ecd-646909613f25_aa0f0057-073d-55b7-918d-e4d6bed420f3.spold,aa0f0057-073d-55b7-918d-e4d6bed420f3,RER,market for NPK (15-15-15) fertiliser,[],1.0,NPK (15-15-15) fertiliser,[],process,kilogram
09eb1d66-9bb3-5ea5-aa28-64d726f1f389,market activity,"{'data entry': {'name': 'Emilia Moreno Ruiz', 'email': 'moreno@ecoinvent.org'}, 'data generator': {'name': 'Avraam Symeonidis', 'email': 'Symeonidis@ecoinvent.org'}}","[('ISIC rev.4 ecoinvent', '2012:Manufacture of fertilizers and nitrogen compounds'), ('CPC', '34233: Nitric acid, sulphonitric acids')]",28088b38d9c8076b638142a227539983,"This is a market activity. Each market represents the consumption mix of a product in a given geography, connecting suppliers with consumers of the same product in the same geographical area. Markets group the producers and also the imports of the product (if relevant) within the same geographical area. They also account for transport to the consumer and for the losses during that process, when relevant.
This dataset is a consumption mix, representing the supply of ''nitric acid, without water, in 50% solution state'' from activities that produce it, to activities that consume it within the geography of this dataset, Europe without Russia. 
If 1 kg of this 'nitric acid, without water, in 50% solution state' is used as fertiliser, it is equivalent to circa 0.222 kg of Nitrogen as N.
The dataset considers transportation from the producer to the consumer of this product, transportation distances are based on default transport distances for markets (found in file 'Default Transport Assumptions' at https://www.ecoinvent.org/support/documents-and-files/documents-and-files.html).
'Nitric acid, without water, in 50% solution state' is an inorganic substance with a CAS no. : 7697-37-2. It is called 'nitric acid' under IUPAC naming and its molecular formula is: HNO3. It is liquid in normal conditions of temperature and pressure. On a consumer level, 'nitric acid, without water, in 50% solution state' is used in the following products:  washing & cleaning products, fertilisers, polishes and waxes and air care products. On industrial sites, the substance is used for the manufacture of products in the following sectors: pH regulators and water treatment products, washing & cleaning products, non-metal-surface treatment products, metal surface treatment products, water treatment chemicals, semiconductors and laboratory chemicals. Based on EU regulations (REGULATION (EU) 2019/1009), if this substance would be used as fertiliser, it could be labelled as N-P-K of: (22-0-0).
[This dataset is meant to replace the following datasets:
 - market for nitric acid, without water, in 50% solution state, RER, 2016 - 2019 (5520876e-4c4b-5085-9820-5b8721d100fa)]
Geography:  This activity delivers the product of ''nitric acid, without water, in 50% solution state'' within the geography of Europe without Russia.",cutoff-3.9.1,09eb1d66-9bb3-5ea5-aa28-64d726f1f389_68db7412-ba35-488b-8a45-9a9f48448522.spold,68db7412-ba35-488b-8a45-9a9f48448522,RER w/o RU,"market for nitric acid, without water, in 50% solution state",[],1.0,"nitric acid, without water, in 50% solution state",[],process,kilogram
1bdf1014-47d4-57f2-bf3d-34623b81c851,market activity,"{'data entry': {'name': 'Avraam Symeonidis', 'email': 'Symeonidis@ecoinvent.org'}, 'data generator': {'name': 'Avraam Symeonidis', 'email': 'Symeonidis@ecoinvent.org'}}","[('ISIC rev.4 ecoinvent', '0891:Mining of chemical and fertilizer minerals'), ('CPC', '34629: Other phosphatic fertilizers, n.e.c.')]",bd271148459d2f12de53c6f9a5fddba1,"This is a market activity. Each market represents the consumption mix of a product in a given geography, connecting suppliers with consumers of the same product in the same geographical area. Markets group the producers and also the imports of the product (if relevant) within the same geographical area. They also account for transport to the consumer and for the losses during that process, when relevant.
This dataset is a consumption mix, representing the supply of ''phosphate rock, beneficiated'' from activities that produce it, to activities that consume it within the geography of this dataset, Europe. 
If 1 kg of this 'phosphate rock, beneficiated' is used as fertiliser, it is equivalent to circa 0.32 kg of Phosphorus as P2O5.
The dataset considers transportation from the producer to the consumer of this product, transportation distances are based on default transport distances for markets (found in file 'Default Transport Assumptions' at https://www.ecoinvent.org/support/documents-and-files/documents-and-files.html).
'Phosphate rock, beneficiated' is an inorganic substance. It is solid in normal conditions of temperature and pressure. Based on EU regulations (REGULATION (EU) 2019/1009), if this substance would be used as fertiliser, it could be labelled as N-P-K of: (0-14-0).
Geography:  This activity delivers the product of ''phosphate rock, beneficiated'' within the geography of Europe.",cutoff-3.9.1,1bdf1014-47d4-57f2-bf3d-34623b81c851_6dc5955e-e2a6-4fd5-845d-63df2e29ecaa.spold,6dc5955e-e2a6-4fd5-845d-63df2e29ecaa,RER,"market for phosphate rock, beneficiated",[],1.0,"phosphate rock, beneficiated",[],process,kilogram
