activity,activity type,authors,classifications,code,comment,database,filename,flow,location,name,parameters,production amount,reference product,synonyms,type,unit
f1c71288-7c16-567a-824f-90010fb3b06c,market activity,"{'data entry': {'name': 'Niels Jungbluth', 'email': 'ecoinvent@esu-services.ch'}, 'data generator': {'name': 'Niels Jungbluth', 'email': 'ecoinvent@esu-services.ch'}}","[('EcoSpold01Categories', 'oil/fuels'), ('ISIC rev.4 ecoinvent', '1920:Manufacture of refined petroleum products'), ('CPC', '33370: Fuel oils n.e.c.')]",014e700c9c9f2cef7cbf49c0b8eaf48a,"This is a market activity. Each market represents the consumption mix of a product in a given geography, connecting suppliers with consumers of the same product in the same geographical area. Markets group the producers and also the imports of the product (if relevant) within the same geographical area. They also account for transport to the consumer and for the losses during that process, when relevant.
This is the market for  'light fuel oil', in the geography of Switzerland.
Inventory for the distribution of petroleum product to the final consumer (household, car, power plant, etc.) including all necessary transports.
[This dataset was already contained in the ecoinvent database version 2. It was not individually updated during the transfer to ecoinvent version 3. Life Cycle Impact Assessment results may still have changed, as they are affected by changes in the supply chain, i.e. in other datasets. This dataset was generated following the ecoinvent quality guidelines for version 2. It may have been subject to central changes described in the ecoinvent version 3 change report (http://www.ecoinvent.org/database/ecoinvent-version-3/reports-of-changes/), and the results of the central updates were reviewed extensively. The changes added e.g. consistent water flows and other information throughout the database. The documentation of this dataset can be found in the ecoinvent reports of version 2, which are still available via the ecoinvent website. The change report linked above covers all central changes that were made during the conversion process.]
The transport distances in this market are taken from a model based on statistics on transport of goods in Switzerland (Valsasina, 2016, Default transport data per commodity group for Switzerland, ecoinvent, www.ecoinvent.org).
light fuel oil' is a fossil fuel with a calorific value of 42.6 MJ/kg. It is used as a liquid fuel and is sourced from petroleum refineries or waste polyethylene. Its main applications are in the following sectors: domestic heating and motor fuel.
Geography:  Surveys mainly for DE and CH.
Technology:  Distribution of petroleum products.
Time period:  Most information for the year 2000. Split up of NMVOC emissions published 1989.",cutoff-3.9.1,f1c71288-7c16-567a-824f-90010fb3b06c_b89dadb0-75e9-44fd-8d41-1ec8dcce23b6.spold,b89dadb0-75e9-44fd-8d41-1ec8dcce23b6,CH,market for light fuel oil,"[{'description': 'fraction, process water, to air', 'id': 'daadf2d4-7bbb-4f69-8ab5-58df4c1685eb', 'unit': 'dimensionless', 'comment': 'Literature value. In case when no industry/process specific data are available, default evaporation fraction value is used. This value is 15% and is based on literature (Statistics Canada, 2007 & Shaffer, K.H., 2008, Consumptive water use in the Great Lakes Basin, USGS & Shiklomanov, 2003, World Water Resources at the Beginning of the 21st Century) and has been approved by an expert.', 'amount': 0.15, 'pedigree': {'reliability': 4, 'completeness': 4, 'temporal correlation': 3, 'geographical correlation': 2, 'further technological correlation': 4}, 'uncertainty type': 2, 'loc': -1.9, 'scale': 0.30335622624235026, 'scale without pedigree': 0.2, 'name': 'fraction_PW_to_air'}, {'description': 'fraction, tap water, to air', 'id': '148c8010-cc60-48cd-9b40-fc7278e377f7', 'unit': 'dimensionless', 'comment': 'Calculated value. See comment in the other parametres present in this dataset. Tap water is considered to be always used as process water, thus process water fractions to air are applied to all tap water input flows to calculate the amount of water consumed in the processes.', 'amount': 0.15, 'pedigree': {'reliability': 4, 'completeness': 4, 'temporal correlation': 3, 'geographical correlation': 2, 'further technological correlation': 4}, 'uncertainty type': 2, 'loc': -1.9, 'scale': 0.30335622624235026, 'scale without pedigree': 0.2, 'name': 'fraction_TW_to_air'}]",1.0,light fuel oil,[],process,kilogram
f8e6cca7-bd74-5423-8523-cae2c44be8a8,market activity,"{'data entry': {'name': '[System]', 'email': 'support@ecoinvent.org'}, 'data generator': {'name': '[System]', 'email': 'support@ecoinvent.org'}}","[('ISIC rev.4 ecoinvent', '3530:Steam and air conditioning supply'), ('EcoSpold01Categories', 'hard coal/heating systems'), ('CPC', '17300: Steam and hot water')]",9dd857c4552aa90cb27ef98361a14b30,"This is a market activity. Each market represents the consumption mix of a product in a given geography, connecting suppliers with consumers of the same product in the same geographical area. Markets group the producers and also the imports of the product (if relevant) within the same geographical area. They also account for transport to the consumer and for the losses during that process, when relevant.
This is the market for  'heat, central or small-scale, other than natural gas', in the Global geography.
This market contains no transport or losses, as they are irrelevant for the delivered product.
This product represents heat measured in MJ. The heat is produced through various other means than natural gas. This includes burning of biomethane in gas turbine; biogas in co-gen gas engine; anthracite, coal, lignite briquettes and coke in stove; hardwood, logs, softwood, wood chips, wood pellets in furnaces and wood heaters; light fuel oil in boilers. Also contributing are heat from heat pumps and solar collectors. The dataset is targeted for central or small-scale heating.",cutoff-3.9.1,f8e6cca7-bd74-5423-8523-cae2c44be8a8_dd80f0f2-f4d5-40f0-9035-09c1a7f3f07b.spold,dd80f0f2-f4d5-40f0-9035-09c1a7f3f07b,RoW,"market for heat, central or small-scale, other than natural gas",[],1.0,"heat, central or small-scale, other than natural gas",[],process,megajoule
11fb8678-d8bc-5d3f-bfdd-08fd52eed3c1,market activity,"{'data entry': {'name': '[System]', 'email': 'support@ecoinvent.org'}, 'data generator': {'name': '[System]', 'email': 'support@ecoinvent.org'}}","[('ISIC rev.4 ecoinvent', '0610:Extraction of crude petroleum'), ('EcoSpold01Categories', 'oil/production'), ('CPC', '12020: Natural gas, liquefied or in the gaseous state')]",f36892589470efa9b2e856c9e41a6fd7,"This is a market activity. Each market represents the consumption mix of a product in a given geography, connecting suppliers with consumers of the same product in the same geographical area. Markets group the producers and also the imports of the product (if relevant) within the same geographical area. They also account for transport to the consumer and for the losses during that process, when relevant.
This is the market for  'natural gas, vented', in the Global geography.
No transport required.
'natural gas, vented' describes the emissions due to the venting of natural gas during crude oil production.",cutoff-3.9.1,11fb8678-d8bc-5d3f-bfdd-08fd52eed3c1_24915790-23b1-4900-86ac-3b025be19c06.spold,24915790-23b1-4900-86ac-3b025be19c06,GLO,"market for natural gas, vented",[],1.0,"natural gas, vented",[],process,cubic meter
a8b9a45a-1469-5fe3-b25f-62908e4d92d8,market activity,"{'data entry': {'name': 'Avraam Symeonidis', 'email': 'Symeonidis@ecoinvent.org'}, 'data generator': {'name': 'Avraam Symeonidis', 'email': 'Symeonidis@ecoinvent.org'}}","[('ISIC rev.4 ecoinvent', '2012:Manufacture of fertilizers and nitrogen compounds'), ('CPC', '34613: Ammonium nitrate')]",f6c5e25d872f1a17216f3bbf225dcbb7,"This is a market activity. Each market represents the consumption mix of a product in a given geography, connecting suppliers with consumers of the same product in the same geographical area. Markets group the producers and also the imports of the product (if relevant) within the same geographical area. They also account for transport to the consumer and for the losses during that process, when relevant.
This dataset is a consumption mix, representing the supply of ''ammonium nitrate'' from activities that produce it, to activities that consume it within the geography of this dataset, Europe. 
If 1 kg of this 'ammonium nitrate' is used as fertiliser, it is equivalent to circa 0.35 kg of Nitrogen as N.
The dataset considers transportation from the producer to the consumer of this product, transportation distances are based on default transport distances for markets (found in file 'Default Transport Assumptions' at https://www.ecoinvent.org/support/documents-and-files/documents-and-files.html).
'Ammonium nitrate' is an inorganic substance with a CAS no. : 6484-52-2. It is called 'ammomium nitrate' under IUPAC naming and its molecular formula is: H4N2O3. It is solid in normal conditions of temperature and pressure. On a consumer level, 'ammonium nitrate' is used in the following products: fertilisers, explosives and adhesives and sealants. On industrial sites, the substance is used for the manufacture of products in the following sectors: chemicals, wood and wood products, plastic products, fabricated metal products and food products. Based on EU regulations (REGULATION (EU) 2019/1009), if this substance would be used as fertiliser, it could be labelled as N-P-K of: (35-0-0).
Geography:  This activity delivers the product of ''ammonium nitrate'' within the geography of Europe.",cutoff-3.9.1,a8b9a45a-1469-5fe3-b25f-62908e4d92d8_a498d9fb-9402-4374-b2e2-3f85f5d98f43.spold,a498d9fb-9402-4374-b2e2-3f85f5d98f43,RER,market for ammonium nitrate,[],1.0,ammonium nitrate,[],process,kilogram
62f1922c-7cb0-5637-b1d0-51c45ed7b949,market activity,"{'data entry': {'name': 'Karin Treyer', 'email': 'karin.treyer@psi.ch'}, 'data generator': {'name': 'Karin Treyer', 'email': 'karin.treyer@psi.ch'}}","[('EcoSpold01Categories', 'natural gas/cogeneration'), ('ISIC rev.4 ecoinvent', '3530:Steam and air conditioning supply'), ('CPC', '17300: Steam and hot water')]",9b39f35d1fe2a46c79cd3aa1dad49e43,"This is a market activity. Each market represents the consumption mix of a product in a given geography, connecting suppliers with consumers of the same product in the same geographical area. Markets group the producers and also the imports of the product (if relevant) within the same geographical area. They also account for transport to the consumer and for the losses during that process, when relevant.
This is the market for  'heat, district or industrial, natural gas', in the geography of Switzerland.
No pure heat plants on district level producing heat with natural gas exist in Switzerland (reference year 2009), therefore this market is only supplied by heat from combined heat and power plants. ",cutoff-3.9.1,62f1922c-7cb0-5637-b1d0-51c45ed7b949_1125e767-7b5d-442e-81d6-9b0d3e1919ac.spold,1125e767-7b5d-442e-81d6-9b0d3e1919ac,CH,"market for heat, district or industrial, natural gas",[],1.0,"heat, district or industrial, natural gas",[],process,megajoule
