activity,activity type,authors,classifications,code,comment,database,filename,flow,location,name,parameters,production amount,reference product,synonyms,type,unit
2ba682a2-719f-51df-951f-eec02f61e0c5,market group,"{'data entry': {'name': '[System]', 'email': 'support@ecoinvent.org'}, 'data generator': {'name': '[System]', 'email': 'support@ecoinvent.org'}}","[('ISIC rev.4 ecoinvent', '3510:Electric power generation, transmission and distribution'), ('CPC', '17100: Electrical energy')]",d2cf377db3ed6bbbe4ea357e2d2def51,"This dataset is a market group. Market groups represent a 'market of markets'. Their purpose is to group a set of markets into larger, geographically relevant datasets.
Market groups are created for convenience and ease of use. They only group other markets and/or market groups contained within their geography.
Losses and relevant exchanges (transport, transport infrastructure, etc.) are not included in this dataset. They are present in the contained markets.  
This is the market group for 'electricity, medium voltage', in China.",cutoff-3.9.1,2ba682a2-719f-51df-951f-eec02f61e0c5_759b89bd-3aa6-42ad-b767-5bb9ef5d331d.spold,759b89bd-3aa6-42ad-b767-5bb9ef5d331d,CN,"market group for electricity, medium voltage",[],1.0,"electricity, medium voltage",[],process,kilowatt hour
7361f7fb-5cf2-598c-823a-a4b7e50c3d28,market activity,"{'data entry': {'name': 'Carl Vadenbo', 'email': 'vadenbo@ecoinvent.org'}, 'data generator': {'name': 'Maresa Bussa', 'email': 'bussa@esu-services.ch'}}","[('ISIC rev.4 ecoinvent', '3520:Manufacture of gas; distribution of gaseous fuels through mains'), ('CPC', '12020: Natural gas, liquefied or in the gaseous state')]",6a60dc6386928f379bff65ad8c801001,"This is a market activity. Each market represents the consumption mix of a product in a given geography, connecting suppliers with consumers of the same product in the same geographical area. Markets group the producers and the imports of the product (if relevant) within the same geographical area. They also account for transport (distribution) to the consumer and for the losses during that process, when relevant.
This is the market for ‘natural gas, high pressure"" [m3], in the geography of Switzerland. The consumption mix is calculated based on own production - if relevant - and trade statistics provided in BP (2020).It contains information on energy and transport requirement (excluding for any imports, which are modelled in separate datasets) and the losses and emissions occurring during the distribution.
The product ‘natural gas, high pressure"" is a fossil fuel, for which a generic gross calorific value (GCV) of 40MJ/m3, a net calorific value (NCV) of 36.0 MJ/m3 and a density of 0.735kg/m3 for natural gas are applied, in line with the global statistics (referring to standard cubic meters, Sm3, measured at 15°C and 1013 mbar), based on Meili et al. (2022). It is used as a gaseous fuel and is sourced from oil and gas production and evaporation of liquid natural gas. The initial overpressure of the gas is 1-5 bar (1000-5000 hPa). Natural gas supplied at high pressure is predominantly used by large consumers, e.g., power plants and industries. 
Reference(s): 
Bussa, M., N. Jungbluth, Ch. Meili (2022) Life cycle inventories for long-distance transport and distribution of natural gas. ESU-services Ltd. Schaffhausen, Switzerland. Available from: http://esu-services.ch/data/public-lci-reports/
BP (2020) BP Statistical Review of World Energy 2019. BP, London, UK. Retrieved from: https://www.bp.com/en/global/corporate/energy-economics/statistical-reviewof-world-energy.html.
Geography:  Switzerland
Technology:  This dataset refers only to the delivery of high pressure natural gas, which has 1-5 bar overpressure. The gas is supplied to consumers via onshore pipelines. The delivery at low pressure (0.1 bar overpressure), e.g., to households, is not considered within this activity. 
Time period:  Energy requirements are from 2019 and leakage data are from 2018.",cutoff-3.9.1,7361f7fb-5cf2-598c-823a-a4b7e50c3d28_a9007f10-7e39-4d50-8f4a-d6d03ce3d673.spold,a9007f10-7e39-4d50-8f4a-d6d03ce3d673,CH,"market for natural gas, high pressure",[],1.0,"natural gas, high pressure",[],process,cubic meter
4438999c-7021-5448-8097-8803c5cdfc11,market activity,"{'data entry': {'name': 'Carl Vadenbo', 'email': 'vadenbo@ecoinvent.org'}, 'data generator': {'name': 'Christoph Meili', 'email': 'meili@esu-services.ch'}}","[('ISIC rev.4 ecoinvent', '4661:Wholesale of solid, liquid and gaseous fuels and related products'), ('CPC', '12010: Petroleum oils and oils obtained from bituminous minerals, crude')]",ffa4308820ee99e0ed078d95d529d837,"This is a market activity. Each market represents the consumption mix of a product in a given geography, connecting suppliers with consumers of the same product in the same geographical area. Markets group the producers and the imports of the product (if relevant) within the same geographical area. They also account for transport (distribution) to the consumer and for the losses during that process, when relevant.
This is the market for crude ‘petroleum"" oil [kg], in the geography of Europe without Switzerland.The consumption mix is calculated based on international trade statistics for 2019. The modelling approach for transport from extraction site to the port of destination via pipelines or tanker freight ships is described in Meili et al. (2022, section 3.4). Further transport from seaport to refinery is described in section 3.6: For most European countries, distances for transport of crude oil from import to refineries are assumed to be on average about 100km in onshore pipelines. Exceptions are, e.g., transport from Kazakhstan, Russia and Azerbaijan to Europe. There, transport is assumed to be done completely in onshore pipelines which therefore are considerably longer. For countries with smaller production rates like the Netherlands, Germany, and the United Kingdom, it is assumed that the whole production is refined locally. The distance for transport in a local onshore pipeline is therefore set to a generic value of 10km.Crude ""petroleum"" oil is a fossil fuel with a net calorific value of 43.4 MJ/kg. The density of petroleum set to 858.1 kg/m3. Its main application is as the feedstock for petroleum refineries, for the production of various fuels and petrochemicals.
Reference(s): 
C. Meili, N. Jungbluth, M. Bussa (2022) Life cycle inventories of of long-distance transport of crude oil. ESU-services Ltd. Schaffhausen, Switzerland. Availble from: http://esu-services.ch/data/public-lci-reports/
Geography:  Europe without Switzerland",cutoff-3.9.1,4438999c-7021-5448-8097-8803c5cdfc11_e6aad2de-0b1b-49c3-a0c4-797ba34d87e5.spold,e6aad2de-0b1b-49c3-a0c4-797ba34d87e5,Europe without Switzerland,market for petroleum,[],1.0,petroleum,[],process,kilogram
4ed73d40-0034-5aae-9f22-a0b92e1f2008,market activity,"{'data entry': {'name': 'Avraam Symeonidis', 'email': 'Symeonidis@ecoinvent.org'}, 'data generator': {'name': 'Avraam Symeonidis', 'email': 'Symeonidis@ecoinvent.org'}}","[('ISIC rev.4 ecoinvent', '2012:Manufacture of fertilizers and nitrogen compounds'), ('CPC', '34651: Ammonia, anhydrous')]",bdacb58853d6014daecc0de37210bddd,"This is a market activity. Each market represents the consumption mix of a product in a given geography, connecting suppliers with consumers of the same product in the same geographical area. Markets group the producers and also the imports of the product (if relevant) within the same geographical area. They also account for transport to the consumer and for the losses during that process, when relevant.
This dataset is a consumption mix, representing the supply of ''ammonia, anhydrous, liquid'' from activities that produce it, to activities that consume it within the geography of this dataset, Europe. 
If 1 kg of this 'ammonia, anhydrous, liquid' is used as fertiliser, it is equivalent to circa 0.822 kg of Nitrogen as N.
The dataset considers transportation from the producer to the consumer of this product, transportation distances are based on default transport distances for markets (found in file 'Default Transport Assumptions' at https://www.ecoinvent.org/support/documents-and-files/documents-and-files.html).
'Ammonia, anhydrous, liquid' is an inorganic substance with a CAS no. : 7664-41-7. It is called 'ammonia' under IUPAC naming and its molecular formula is: H3N. It is gaseous in normal conditions of temperature and pressure and has a distinct pungent odor. On a consumer level, 'ammonia, anhydrous, liquid' is used in the following products: cosmetics and personal care products, heat transfer fluids, washing & cleaning products and coating products. On industrial sites, the substance is used for the manufacture of products in the following sectors: chemicals, textile, leather or fur, pulp, paper and paper products, plastic products and fabricated metal products. Based on EU regulations (REGULATION (EU) 2019/1009), if this substance would be used as fertiliser, it could be labelled as N-P-K of: (82-0-0).
Geography:  This activity delivers the product of ''ammonia, anhydrous, liquid'' within the geography of Europe.",cutoff-3.9.1,4ed73d40-0034-5aae-9f22-a0b92e1f2008_06b8d05b-e1e6-427b-929c-bb55e84e7c08.spold,06b8d05b-e1e6-427b-929c-bb55e84e7c08,RER,"market for ammonia, anhydrous, liquid",[],1.0,"ammonia, anhydrous, liquid",[],process,kilogram
f01cd604-0abb-5b1d-bc24-d1dbf699158d,ordinary transforming activity,"{'data entry': {'name': 'Tereza Levova', 'email': 'levova@ecoinvent.org'}, 'data generator': {'name': 'Tereza Levova', 'email': 'levova@ecoinvent.org'}}","[('ISIC rev.4 ecoinvent', '4923:Freight transport by road'), ('CPC', '6511: Road transport services of freight')]",cf361b5556d9a5efb113a584d4a44ba5,"This is a linking activity which transfers part of the production volume of the specific transport, freight, lorry of all sizes, EURO3 to the generic market for transport, freight, lorry, unspecified.
The transport, freight, lorry, unspecified is meant to be used by activities, where the size and EURO class of the transport supplied is unkown. 
[This dataset is meant to replace the following datasets:
 - size-specific lorry transport to generic market for lorry transport, RER, 2005 - 2005 (47efd230-3980-416d-95a1-7afb566aab36)]",cutoff-3.9.1,f01cd604-0abb-5b1d-bc24-d1dbf699158d_cfbce515-3f54-4411-ad9d-3d26b7faa15a.spold,cfbce515-3f54-4411-ad9d-3d26b7faa15a,RER,"transport, freight, lorry, all sizes, EURO3 to generic market for transport, freight, lorry, unspecified",[],1.0,"transport, freight, lorry, unspecified",[],process,ton kilometer
3996872f-2165-575c-ab13-be2f5a8b70d1,market activity,"{'data entry': {'name': 'Niels Jungbluth', 'email': 'ecoinvent@esu-services.ch'}, 'data generator': {'name': 'Niels Jungbluth', 'email': 'ecoinvent@esu-services.ch'}}","[('EcoSpold01Categories', 'oil/fuels'), ('ISIC rev.4 ecoinvent', '1920:Manufacture of refined petroleum products'), ('CPC', '33360: Gas oil')]",d1630ed7f72ee6daf71d7471fc42b36a,"This is a market activity. Each market represents the consumption mix of a product in a given geography, connecting suppliers with consumers of the same product in the same geographical area. Markets group the producers and also the imports of the product (if relevant) within the same geographical area. They also account for transport to the consumer and for the losses during that process, when relevant.
This is the market for  'diesel', in the geography of Switzerland.
Inventory for the distribution of petroleum product to the final consumer (household, car, power plant, etc.) including all necessary transports.
[This dataset was already contained in the ecoinvent database version 2. It was not individually updated during the transfer to ecoinvent version 3. Life Cycle Impact Assessment results may still have changed, as they are affected by changes in the supply chain, i.e. in other datasets. This dataset was generated following the ecoinvent quality guidelines for version 2. It may have been subject to central changes described in the ecoinvent version 3 change report (http://www.ecoinvent.org/database/ecoinvent-version-3/reports-of-changes/), and the results of the central updates were reviewed extensively. The changes added e.g. consistent water flows and other information throughout the database. The documentation of this dataset can be found in the ecoinvent reports of version 2, which are still available via the ecoinvent website. The change report linked above covers all central changes that were made during the conversion process.]
The transport distances in this market are taken from a model based on statistics on transport of goods in Switzerland (Valsasina, 2016, Default transport data per commodity group for Switzerland, ecoinvent, www.ecoinvent.org).
diesel' is a fossil fuel with a calorific value of 42.8 MJ/kg. It is used as a liquid fuel and is sourced from fractional distillation of crude oil. Its main applications are in the following sectors: automotive, railroad, aviation, agricultural and military vehicle fuel.
Geography:  Surveys mainly for DE and CH.
Technology:  Distribution of petroleum products.
Time period:  Most information for the year 2000. Split up of NMVOC emissions published 1989.",cutoff-3.9.1,3996872f-2165-575c-ab13-be2f5a8b70d1_291fc06d-1b3e-4077-aabb-346b588ed24b.spold,291fc06d-1b3e-4077-aabb-346b588ed24b,CH,market for diesel,"[{'description': 'fraction, process water, to air', 'id': 'daadf2d4-7bbb-4f69-8ab5-58df4c1685eb', 'unit': 'dimensionless', 'comment': 'Literature value. In case when no industry/process specific data are available, default evaporation fraction value is used. This value is 15% and is based on literature (Statistics Canada, 2007 & Shaffer, K.H., 2008, Consumptive water use in the Great Lakes Basin, USGS & Shiklomanov, 2003, World Water Resources at the Beginning of the 21st Century) and has been approved by an expert.', 'amount': 0.15, 'pedigree': {'reliability': 4, 'completeness': 4, 'temporal correlation': 3, 'geographical correlation': 2, 'further technological correlation': 4}, 'uncertainty type': 2, 'loc': -1.9, 'scale': 0.30335622624235026, 'scale without pedigree': 0.2, 'name': 'fraction_PW_to_air'}, {'description': 'fraction, tap water, to air', 'id': '148c8010-cc60-48cd-9b40-fc7278e377f7', 'unit': 'dimensionless', 'comment': 'Calculated value. See comment in the other parametres present in this dataset. Tap water is considered to be always used as process water, thus process water fractions to air are applied to all tap water input flows to calculate the amount of water consumed in the processes.', 'amount': 0.15, 'pedigree': {'reliability': 4, 'completeness': 4, 'temporal correlation': 3, 'geographical correlation': 2, 'further technological correlation': 4}, 'uncertainty type': 2, 'loc': -1.9, 'scale': 0.30335622624235026, 'scale without pedigree': 0.2, 'name': 'fraction_TW_to_air'}]",1.0,diesel,[],process,kilogram
1d09e548-2f57-5b78-bd3b-4fdbae392f2c,market group,"{'data entry': {'name': 'Johannes Müller', 'email': 'mueller@ecoinvent.org'}, 'data generator': {'name': 'Johannes Müller', 'email': 'mueller@ecoinvent.org'}}","[('ISIC rev.4 ecoinvent', '3510:Electric power generation, transmission and distribution'), ('CPC', '17100: Electrical energy')]",6f62652ec33ef049081d838e0f7d9255,"This dataset is a market group. Market groups represent a 'market of markets'. Their purpose is to group a set of markets into larger, geographically relevant datasets.
Market groups are created for convenience and ease of use. They only group other markets and/or market groups contained within their geography.
Losses and relevant exchanges (transport, transport infrastructure, etc.) are not included in this dataset. They are present in the contained markets.  
This is the market group for 'electricity, medium voltage', in China.",cutoff-3.9.1,1d09e548-2f57-5b78-bd3b-4fdbae392f2c_759b89bd-3aa6-42ad-b767-5bb9ef5d331d.spold,759b89bd-3aa6-42ad-b767-5bb9ef5d331d,CN-SGCC,"market group for electricity, medium voltage",[],1.0,"electricity, medium voltage",[],process,kilowatt hour
45fe907b-33fe-588d-a00c-4379dab22d3b,market group,"{'data entry': {'name': '[System]', 'email': 'support@ecoinvent.org'}, 'data generator': {'name': '[System]', 'email': 'support@ecoinvent.org'}}","[('ISIC rev.4 ecoinvent', '3510:Electric power generation, transmission and distribution'), ('CPC', '17100: Electrical energy')]",5cb69853f15e2cf372fcf87080a69dac,"This dataset is a market group. Market groups represent a 'market of markets'. Their purpose is to group a set of markets into larger, geographically relevant datasets.
Market groups are created for convenience and ease of use. They only group other markets and/or market groups contained within their geography.
Losses and relevant exchanges (transport, transport infrastructure, etc.) are not included in this dataset. They are present in the contained markets.  
This is the market group for 'electricity, medium voltage', in Asia.",cutoff-3.9.1,45fe907b-33fe-588d-a00c-4379dab22d3b_759b89bd-3aa6-42ad-b767-5bb9ef5d331d.spold,759b89bd-3aa6-42ad-b767-5bb9ef5d331d,RAS,"market group for electricity, medium voltage",[],1.0,"electricity, medium voltage",[],process,kilowatt hour
29f2329c-76d9-590b-ab5f-ec9341f881f4,market activity,"{'data entry': {'name': 'Johannes Müller', 'email': 'mueller@ecoinvent.org'}, 'data generator': {'name': 'Johannes Müller', 'email': 'mueller@ecoinvent.org'}}","[('ISIC rev.4 ecoinvent', '2410:Manufacture of basic iron and steel'), ('EcoSpold01Categories', 'metals/extraction'), ('CPC', '41111: Pig iron and spiegeleisen in pigs, blocks or other primary forms')]",a309624068522e73107aef09fc7aca59,"This is a market activity. Each market represents the consumption mix of a product in a given geography, connecting suppliers with consumers of the same product in the same geographical area. Markets group the producers and also the imports of the product (if relevant) within the same geographical area. They also account for transport to the consumer and for the losses during that process, when relevant.
This is the market for  'pig iron', in the Global geography.
This activity represents the global supply of pig iron (hot metal) to steelmaking plants.
Transport distances are based on the ecoinvent ""Default Transport Assumptions"" model, accessible on the ecoinvent website.
Geography:  Activity represents the supply of iron ore concentrate globally.",cutoff-3.9.1,29f2329c-76d9-590b-ab5f-ec9341f881f4_a636ed9e-f90a-48cb-a180-c75b1fc92cf1.spold,a636ed9e-f90a-48cb-a180-c75b1fc92cf1,RoW,market for pig iron,[],1.0,pig iron,[],process,kilogram
33ea1495-7e2d-529f-a723-1ee5c4343ad6,market activity,"{'data entry': {'name': 'Guillaume Bourgault', 'email': 'bourgault@ecoinvent.org'}, 'data generator': {'name': '[System]', 'email': 'support@ecoinvent.org'}}","[('ISIC rev.4 ecoinvent', '1050:Manufacture of dairy products'), ('EcoSpold01Categories', 'biomass/production'), ('CPC', '22130: Whey')]",82bcd67307aa7d775b264e32dd185e3d,"This is a market activity. Each market represents the consumption mix of a product in a given geography, connecting suppliers with consumers of the same product in the same geographical area. Markets group the producers and also the imports of the product (if relevant) within the same geographical area. They also account for transport to the consumer and for the losses during that process, when relevant.
This is the market for 'whey', in the Global geography. This is a constrained market for consequential system model, for attributional system models, this is a regular market. In the case of consequential system model, details about the marginal consumer can be found in the comment of the conditional exchange (by-product).
Transport from producers to consumers of this product in the geography covered by the market is included.
The product 'whey' is a by-product of cheese and tofu production. The process step of adding a coagulant (f.e. calcium sulfate) to the soybase (tofu production) or milk (cheese production) results in whey and curds. The curd is then pressed to remove the whey. In cheese production, ",cutoff-3.9.1,33ea1495-7e2d-529f-a723-1ee5c4343ad6_714ddb02-26ff-4e89-9648-a83aba628628.spold,714ddb02-26ff-4e89-9648-a83aba628628,GLO,market for whey,[],1.0,whey,[],process,kilogram
0e97db67-9266-5047-8b19-0374449de40d,market activity,"{'data entry': {'name': '[System]', 'email': 'support@ecoinvent.org'}, 'data generator': {'name': '[System]', 'email': 'support@ecoinvent.org'}}","[('EcoSpold01Categories', 'natural gas/power plants'), ('ISIC rev.4 ecoinvent', '3510:Electric power generation, transmission and distribution'), ('CPC', '17100: Electrical energy')]",c3bedcebac04b5b65dddf73fe3da7405,"This is a market activity. Each market represents the consumption mix of a product in a given geography, connecting suppliers with consumers of the same product in the same geographical area. Markets group the producers and also the imports of the product (if relevant) within the same geographical area. They also account for transport to the consumer and for the losses during that process, when relevant.
This is the market for  'sweet gas, burned in gas turbine', in the Global geography.
This market contains no transport or losses, as they are irrelevant for the delivered product.
'sweet gas, burned in gas turbine' describes the use of a fossil fuel. It is used as a gaseous fuel and is sourced from natural gas processing plants. This exchange provides the treatment of sweet gas (hydrogen sulfide poor) to produce electricity.",cutoff-3.9.1,0e97db67-9266-5047-8b19-0374449de40d_7f8a51d3-2d37-4535-a185-3c2351aea9e6.spold,7f8a51d3-2d37-4535-a185-3c2351aea9e6,GLO,"market for sweet gas, burned in gas turbine",[],1.0,"sweet gas, burned in gas turbine",[],process,megajoule
13c7696b-9af5-5c06-91b1-a08b70b87e0b,market activity,"{'data entry': {'name': 'Lucia Valsasina', 'email': 'valsasina@ecoinvent.org'}, 'data generator': {'name': 'Lucia Valsasina', 'email': 'valsasina@ecoinvent.org'}}","[('EcoSpold01Categories', 'transport systems/road'), ('ISIC rev.4 ecoinvent', '4923:Freight transport by road'), ('CPC', '6511: Road transport services of freight')]",d6655a43e0d3a5f786929ade5064e0fd,"This is a market activity. Each market represents the consumption mix of a product in a given geography, connecting suppliers with consumers of the same product in the same geographical area. Markets group the producers and also the imports of the product (if relevant) within the same geographical area. They also account for transport to the consumer and for the losses during that process, when relevant.
This is the market for 'transport, freight, lorry, unspecified', in the the geography of Europe. This is a generic market; the suppliers of this market make available this generic product by redirecting a part of the production of several more specific products.
No transport or losses have been considered for the generic product supplied in this market, as the transport modelled in the upstream niche markets for the more specific products do already account it.
This is delivering the service of transportation of 1 metric ton across the distance of 1 km. This service only considers the transportation of goods. The vehicle operates with diesel, and it provides a fleet average that includes different lorry classes as well as EURO classes. Specific transport activities are available in the database, this represents a generic product that can be used when no further information are available.  This service provides combines data for transport which is calculated for an average load factor, including empty return trips.",cutoff-3.9.1,13c7696b-9af5-5c06-91b1-a08b70b87e0b_cfbce515-3f54-4411-ad9d-3d26b7faa15a.spold,cfbce515-3f54-4411-ad9d-3d26b7faa15a,RER,"market for transport, freight, lorry, unspecified",[],1.0,"transport, freight, lorry, unspecified",[],process,ton kilometer
80205fa6-64db-55ab-9783-f3a5d45b90ac,market activity,"{'data entry': {'name': 'Guillaume Bourgault', 'email': 'bourgault@ecoinvent.org'}, 'data generator': {'name': '[System]', 'email': 'support@ecoinvent.org'}}","[('EcoSpold01Categories', 'metals/extraction'), ('ISIC rev.4 ecoinvent', '2410:Manufacture of basic iron and steel'), ('CPC', '41121: Non-alloy steel in ingots or other primary forms, and semi-finished products of non-alloy steel')]",d872e0d78319cb13e12b96de83e19dd7,"This is a market activity. Each market represents the consumption mix of a product in a given geography, connecting suppliers with consumers of the same product in the same geographical area. Markets group the producers and also the imports of the product (if relevant) within the same geographical area. They also account for transport to the consumer and for the losses during that process, when relevant.
This is the market for  'steel, unalloyed', in the Global geography.
Transport distances are based on the ecoinvent ""Default Transport Assumptions"" model, accessible on the ecoinvent website.
Geography:  Activity represents the supply of iron ore concentrate globally.",cutoff-3.9.1,80205fa6-64db-55ab-9783-f3a5d45b90ac_a2fd8c95-f2db-436a-9f24-f33b17f7975b.spold,a2fd8c95-f2db-436a-9f24-f33b17f7975b,GLO,"market for steel, unalloyed",[],1.0,"steel, unalloyed",[],process,kilogram
