activity,activity type,authors,classifications,code,comment,database,filename,flow,location,name,parameters,production amount,reference product,synonyms,type,unit
ddc06bf6-1393-5423-bb93-1b1a7eb292f1,market activity,"{'data entry': {'name': '[System]', 'email': 'support@ecoinvent.org'}, 'data generator': {'name': '[System]', 'email': 'support@ecoinvent.org'}}","[('EcoSpold01Categories', 'transport systems/ship'), ('ISIC rev.4 ecoinvent', '5012:Sea and coastal freight water transport'), ('CPC', '65212: Coastal and transoceanic water transport services of freight by tankers')]",90a69e85db9358f0f0db1d4fafbe847a,"This is a market activity. Each market represents the consumption mix of a product in a given geography, connecting suppliers with consumers of the same product in the same geographical area. Markets group the producers and also the imports of the product (if relevant) within the same geographical area. They also account for transport to the consumer and for the losses during that process, when relevant.
This is the market for  'transport, freight, sea, tanker for petroleum', in the Global geography.
This market contains no transport or losses, as they are irrelevant for the delivered product.
This is delivering the service of transportation of 1 metric ton across the distance of 1 km. This service only considers the transportation of liquid goods by a tanker for petroleum. The ship operates with heavy fuel oil and has a mass of 7,774,400 kg. The DWT (load capacity) of the container ship is 36,000 tonnes, and it is estimated to transport an average of 4,100 million tonne.kms per year for 25 years.  The transport node indirectly considers empty trips (if any) by taking into account the total amount of freight transported throughout the lifetime of the mobile infrastructure.",cutoff-3.9.1,ddc06bf6-1393-5423-bb93-1b1a7eb292f1_774bc814-70cf-4389-8bf8-e6435174c72e.spold,774bc814-70cf-4389-8bf8-e6435174c72e,GLO,"market for transport, freight, sea, tanker for petroleum",[],1.0,"transport, freight, sea, tanker for petroleum",[],process,ton kilometer
bd9f7aa1-6d90-5541-b741-3a1f7febdb70,market activity,"{'data entry': {'name': '[System]', 'email': 'support@ecoinvent.org'}, 'data generator': {'name': '[System]', 'email': 'support@ecoinvent.org'}}","[('ISIC rev.4 ecoinvent', '1040:Manufacture of vegetable and animal oils and fats'), ('CPC', '21652: Palm oil, refined')]",4b3025c58b8e3d16b64507fdcda4219b,"This is a market activity. Each market represents the consumption mix of a product in a given geography, connecting suppliers with consumers of the same product in the same geographical area. Markets group the producers and also the imports of the product (if relevant) within the same geographical area. They also account for transport to the consumer and for the losses during that process, when relevant.
This is the market for  'palm oil, refined', in the Global geography.
Transport from producers to consumers of this product in the geography covered by the market is included.
The product 'palm oil, refined' is produced by means of wet milling in a oil mill producing palm oil, palm kernel oil and palm kernel meal. The crude oil is further refined to become edible or used as it is to produce biodiesel.The palm fruit has a single seed, the palm kernel, protected by a wooden endocarp or shell and surrounded by a fleshy mesocarp or pulp. This fruit produces two types of oil: one extracted from the pulp (palm oil) and the other from the kernel (palm kernel oil).",cutoff-3.9.1,bd9f7aa1-6d90-5541-b741-3a1f7febdb70_a007939f-f418-4ec7-89ee-bd64967e2f83.spold,a007939f-f418-4ec7-89ee-bd64967e2f83,GLO,"market for palm oil, refined",[],1.0,"palm oil, refined",[],process,kilogram
4cd442f8-890d-54cf-b753-e08d82215db5,market activity,"{'data entry': {'name': 'Nikolia Stoikou', 'email': 'stoikou@ecoinvent.org'}, 'data generator': {'name': 'Nikolia Stoikou', 'email': 'stoikou@ecoinvent.org'}}","[('ISIC rev.4 ecoinvent', '3700:Sewerage'), ('CPC', '39990: Other wastes n.e.c.')]",0c4aea70344680b7e10e695a875ce8d6,"This is a market activity, representing a treatment mix. In the case of products needing treatment, market mixes are supplied by the activities treating the product in the geography defined by the market, and they supply the activities needing to treat the product, as they have generated it as a by-product in the Undefined processes (present as a negative input in system models). Transport to the treating facility or losses are also accounted in this type of markets, when relevant.
This is the market for 'wastewater from vegetable oil refinery', in Global geography. Transport from producers to consumers of this product in the geography covered by the market is included.
Geography:  The disposal mix is country-specific for Global geography.
Technology:  The dataset supplies a disposal mix (technology mix) of 'wastewater from vegetable oil refinery' to the respective waste producing activities.",cutoff-3.9.1,4cd442f8-890d-54cf-b753-e08d82215db5_029abc12-645e-4f5a-9ece-f50a76b0910e.spold,029abc12-645e-4f5a-9ece-f50a76b0910e,GLO,market for wastewater from vegetable oil refinery,[],-1.0,wastewater from vegetable oil refinery,[],process,cubic meter
11fb8678-d8bc-5d3f-bfdd-08fd52eed3c1,market activity,"{'data entry': {'name': '[System]', 'email': 'support@ecoinvent.org'}, 'data generator': {'name': '[System]', 'email': 'support@ecoinvent.org'}}","[('ISIC rev.4 ecoinvent', '0610:Extraction of crude petroleum'), ('EcoSpold01Categories', 'oil/production'), ('CPC', '12020: Natural gas, liquefied or in the gaseous state')]",f36892589470efa9b2e856c9e41a6fd7,"This is a market activity. Each market represents the consumption mix of a product in a given geography, connecting suppliers with consumers of the same product in the same geographical area. Markets group the producers and also the imports of the product (if relevant) within the same geographical area. They also account for transport to the consumer and for the losses during that process, when relevant.
This is the market for  'natural gas, vented', in the Global geography.
No transport required.
'natural gas, vented' describes the emissions due to the venting of natural gas during crude oil production.",cutoff-3.9.1,11fb8678-d8bc-5d3f-bfdd-08fd52eed3c1_24915790-23b1-4900-86ac-3b025be19c06.spold,24915790-23b1-4900-86ac-3b025be19c06,GLO,"market for natural gas, vented",[],1.0,"natural gas, vented",[],process,cubic meter
16402e8b-8dfb-5f27-8ca1-2f053bcd1b92,market activity,"{'data entry': {'name': 'Guillaume Bourgault', 'email': 'bourgault@ecoinvent.org'}, 'data generator': {'name': '[System]', 'email': 'support@ecoinvent.org'}}","[('ISIC rev.4 ecoinvent', '1040:Manufacture of vegetable and animal oils and fats'), ('EcoSpold01Categories', 'biomass/fuels'), ('CPC', '21651: Palm oil, crude')]",d7c1b629ad063c61d942cc502c38ecfa,"This is a market activity. Each market represents the consumption mix of a product in a given geography, connecting suppliers with consumers of the same product in the same geographical area. Markets group the producers and also the imports of the product (if relevant) within the same geographical area. They also account for transport to the consumer and for the losses during that process, when relevant.
This is the market for  'palm oil, crude', in the Global geography.
This product is generally considered to be used at the production site.  Therefore, the market does not contain any transport.
The product 'palm oil, crude' is produced by means of wet milling in a oil mill producing palm oil, palm kernel oil and palm kernel meal. The crude oil is further refined to become edible or used as it is to produce biodiesel.The palm fruit has a single seed, the palm kernel, protected by a wooden endocarp or shell and surrounded by a fleshy mesocarp or pulp. This fruit produces two types of oil: one extracted from the pulp (palm oil) and the other from the kernel (palm kernel oil).",cutoff-3.9.1,16402e8b-8dfb-5f27-8ca1-2f053bcd1b92_17e163ef-4e16-4368-83f3-9d6faaf6ae3b.spold,17e163ef-4e16-4368-83f3-9d6faaf6ae3b,GLO,"market for palm oil, crude",[],1.0,"palm oil, crude",[],process,kilogram
