activity,activity type,authors,classifications,code,comment,database,filename,flow,location,name,parameters,production amount,reference product,synonyms,type,unit
00eebd4a-4c72-58b0-b081-2e9dd0fa5058,market activity,"{'data entry': {'name': 'Guillaume Bourgault', 'email': 'bourgault@ecoinvent.org'}, 'data generator': {'name': '[System]', 'email': 'support@ecoinvent.org'}}","[('EcoSpold01Categories', 'waste management/hazardous waste incineration'), ('ISIC rev.4 ecoinvent', '3822:Treatment and disposal of hazardous waste'), ('CPC', '39990: Other wastes n.e.c.')]",abed76ac41dc9255636df9b228d901ad,"This is a market activity, representing a treatment mix. In the case of products needing treatment, market mixes are supplied by the activities treating the product in the geography defined by the market, and they supply the activities needing to treat the product, as they have generated it as a by-product in the Undefined processes (present as a negative input in system models). Transport to the treating facility or losses are also accounted in this type of markets, when relevant.
This is the market for  'waste mineral oil', in the Global geography.
In this market, expert judgement was used to develop product specific transport distance estimations.",cutoff-3.9.1,00eebd4a-4c72-58b0-b081-2e9dd0fa5058_1b30b018-ac39-41f4-a9e0-92057eef8bb8.spold,1b30b018-ac39-41f4-a9e0-92057eef8bb8,RoW,market for waste mineral oil,[],-1.0,waste mineral oil,[],process,kilogram
2ba682a2-719f-51df-951f-eec02f61e0c5,market group,"{'data entry': {'name': '[System]', 'email': 'support@ecoinvent.org'}, 'data generator': {'name': '[System]', 'email': 'support@ecoinvent.org'}}","[('ISIC rev.4 ecoinvent', '3510:Electric power generation, transmission and distribution'), ('CPC', '17100: Electrical energy')]",d2cf377db3ed6bbbe4ea357e2d2def51,"This dataset is a market group. Market groups represent a 'market of markets'. Their purpose is to group a set of markets into larger, geographically relevant datasets.
Market groups are created for convenience and ease of use. They only group other markets and/or market groups contained within their geography.
Losses and relevant exchanges (transport, transport infrastructure, etc.) are not included in this dataset. They are present in the contained markets.  
This is the market group for 'electricity, medium voltage', in China.",cutoff-3.9.1,2ba682a2-719f-51df-951f-eec02f61e0c5_759b89bd-3aa6-42ad-b767-5bb9ef5d331d.spold,759b89bd-3aa6-42ad-b767-5bb9ef5d331d,CN,"market group for electricity, medium voltage",[],1.0,"electricity, medium voltage",[],process,kilowatt hour
5c254cac-9510-57cb-8a21-850e98b1d1a9,ordinary transforming activity,"{'data entry': {'name': 'Tereza Levova', 'email': 'levova@ecoinvent.org'}, 'data generator': {'name': 'Tereza Levova', 'email': 'levova@ecoinvent.org'}}","[('ISIC rev.4 ecoinvent', '1040:Manufacture of vegetable and animal oils and fats'), ('CPC', '216: Vegetable oils')]",c434c3c8c929a73fd9362a18ba238460,"Vegetable oils are often traded on the same market, simply because most of the uses requiring vegetable oil do not require specific vegetable oil. The purpose of this activity is to link certain amount of specific vegetable oils and create generic vegetable oil which can be then traded on generic vegetable oil market.",cutoff-3.9.1,5c254cac-9510-57cb-8a21-850e98b1d1a9_d2184fe3-da8e-40d0-a15e-f35bc3624d26.spold,d2184fe3-da8e-40d0-a15e-f35bc3624d26,GLO,"soybean oil, refined, to generic market for vegetable oil, refined","[{'description': 'fraction', 'id': 'c284793b-4b01-4b90-a12d-99b46685630e', 'unit': 'dimensionless', 'comment': 'Based on data from ""soybean oil refinery operation"" data provider.', 'amount': 0.802, 'pedigree': {'reliability': 4, 'completeness': 1, 'temporal correlation': 1, 'geographical correlation': 1, 'further technological correlation': 1}, 'uncertainty type': 2, 'loc': -0.22, 'scale': 0.09273618495495704, 'scale without pedigree': 0.02449489742783178, 'name': 'fraction_of_crude_oil_PV_to_refinery'}, {'description': 'fraction_to_generic_market', 'id': '2e0401d2-4fd5-48ca-b088-3541e51ed495', 'unit': '% (obsolete)', 'comment': 'It is assumed that 90% of soybean oil, refined is traded on generic vegetable oil market, i.e. its buyers do not care what type of vegetable oil they are buying. Remaining 10% of the production volume (PV) is assumed to be used for uses, where specific type of vegetable oil is required and cannot be substituted by any other vegetable oil.', 'amount': 0.9, 'pedigree': {'reliability': 5, 'completeness': 1, 'temporal correlation': 1, 'geographical correlation': 1, 'further technological correlation': 1}, 'uncertainty type': 2, 'loc': -0.11, 'scale': 0.20149441679609886, 'scale without pedigree': 0.02449489742783178, 'name': 'fraction_to_generic_market'}]",1.0,"vegetable oil, refined",[],process,kilogram
46d1e548-981c-5bb2-8821-55fee9f66320,market activity,"{'data entry': {'name': 'Guillaume Bourgault', 'email': 'bourgault@ecoinvent.org'}, 'data generator': {'name': '[System]', 'email': 'support@ecoinvent.org'}}","[('EcoSpold01Categories', 'metals/extraction'), ('ISIC rev.4 ecoinvent', '2410:Manufacture of basic iron and steel'), ('CPC', '41122: Alloy steel in ingots or other primary forms and semi-finished products of alloy steel')]",a81ce0e882f1b0ef617462fc8e7472e4,"This is a market activity. Each market represents the consumption mix of a product in a given geography, connecting suppliers with consumers of the same product in the same geographical area. Markets group the producers and also the imports of the product (if relevant) within the same geographical area. They also account for transport to the consumer and for the losses during that process, when relevant.
This is the market for  'steel, low-alloyed', in the Global geography.
Transport distances are based on the ecoinvent ""Default Transport Assumptions"" model, accessible on the ecoinvent website.
Geography:  Activity represents the supply of iron ore concentrate globally.",cutoff-3.9.1,46d1e548-981c-5bb2-8821-55fee9f66320_817c3650-4fed-4ef2-b9b6-404a198834e6.spold,817c3650-4fed-4ef2-b9b6-404a198834e6,GLO,"market for steel, low-alloyed",[],1.0,"steel, low-alloyed",[],process,kilogram
f5eff8f9-7b0c-54d7-baa3-c8ef3e8a6611,market activity,"{'data entry': {'name': 'Guillaume Bourgault', 'email': 'bourgault@ecoinvent.org'}, 'data generator': {'name': '[System]', 'email': 'support@ecoinvent.org'}}","[('EcoSpold01Categories', 'metals/extraction'), ('ISIC rev.4 ecoinvent', '2410:Manufacture of basic iron and steel'), ('CPC', '41122: Alloy steel in ingots or other primary forms and semi-finished products of alloy steel')]",683f869780ee789d92d3b2a737534a44,"This is a market activity. In the case of services or immobile infrastructures, markets are connecting suppliers and consumers at a global level. For specific connections at regional level, direct links between the local producing activities and the local consumers are preferred. Transport or losses are logically not relevant for this type of products.
This is the market for  'steel, chromium steel 18/8, hot rolled', in the Global geography.
This market contains no transport or losses, as they are irrelevant for the delivered product.",cutoff-3.9.1,f5eff8f9-7b0c-54d7-baa3-c8ef3e8a6611_c5246dbb-0abd-4bee-8dda-d52a1b202322.spold,c5246dbb-0abd-4bee-8dda-d52a1b202322,GLO,"market for steel, chromium steel 18/8, hot rolled",[],1.0,"steel, chromium steel 18/8, hot rolled",[],process,kilogram
81b2462c-4a3c-5754-b16a-374037ae03ff,market activity,"{'data entry': {'name': '[System]', 'email': 'support@ecoinvent.org'}, 'data generator': {'name': '[System]', 'email': 'support@ecoinvent.org'}}","[('ISIC rev.4 ecoinvent', '0111:Growing of cereals (except rice), leguminous crops and oil seeds'), ('EcoSpold01Categories', 'agricultural production/plant production'), ('CPC', '01412: Soya beans, other')]",8811d20c7cbaece9abf30ba053be05b7,"This is a market activity. Each market represents the consumption mix of a product in a given geography, connecting suppliers with consumers of the same product in the same geographical area. Markets group the producers and also the imports of the product (if relevant) within the same geographical area. They also account for transport to the consumer and for the losses during that process, when relevant.
This is the market for  'soybean', in the Global geography.
Transport from producers to consumers of this product in the geography covered by the market is included.
The product 'soybean' is a seed. It is an annual crop. The ecoinvent database also contains this product from organic and Swiss integrated production.",cutoff-3.9.1,81b2462c-4a3c-5754-b16a-374037ae03ff_deb4f70c-bf2a-4cd3-bc3b-c71af8820da3.spold,deb4f70c-bf2a-4cd3-bc3b-c71af8820da3,RoW,market for soybean,[],1.0,soybean,[],process,kilogram
ce77012c-4b9e-57a7-b874-0cd7b8865c8d,market activity,"{'data entry': {'name': '[System]', 'email': 'support@ecoinvent.org'}, 'data generator': {'name': '[System]', 'email': 'support@ecoinvent.org'}}","[('ISIC rev.4 ecoinvent', '2821:Manufacture of agricultural and forestry machinery'), ('EcoSpold01Categories', 'agricultural means of production/machinery'), ('CPC', '441: Agricultural or forestry machinery and parts thereof')]",aa02bec0e3ac913536e68d54bc8b82d0,"This is a market activity. Each market represents the consumption mix of a product in a given geography, connecting suppliers with consumers of the same product in the same geographical area. Markets group the producers and also the imports of the product (if relevant) within the same geographical area. They also account for transport to the consumer and for the losses during that process, when relevant.
This is the market for  'forestry harvester', in the Global geography.
Transport from producers to consumers of this product in the geography covered by the market is included.
This is a mobile infrastructure, representing the product of a forestry harvester, a heavy forestry vehicle that is used to fell, delimb and buck trees. It has a lifetime of 10 year and a lifetime capacity of 17,600 hour. The process includes all input materials, their end-of-life and the energy required for the production and maintenance of the forest machinery.",cutoff-3.9.1,ce77012c-4b9e-57a7-b874-0cd7b8865c8d_d156e9e5-9799-4f88-82cd-60d88ac4c285.spold,d156e9e5-9799-4f88-82cd-60d88ac4c285,GLO,market for forestry harvester,[],1.0,forestry harvester,[],process,unit
a599fa9c-4811-53b6-b3ca-4ee3e547eae9,market activity,"{'data entry': {'name': 'Axel Liebich', 'email': 'axel.liebich@ifeu.de'}, 'data generator': {'name': 'Niels Jungbluth', 'email': 'jungbluth@esu-services.ch'}}","[('ISIC rev.4 ecoinvent', '1920:Manufacture of refined petroleum products'), ('CPC', '33360: Gas oil')]",56a241fe774f817007ba5219a55ac496,"This is a market activity. Each market represents the consumption mix of a product in a given geography, connecting suppliers with consumers of the same product in the same geographical area. Markets group the producers and also the imports of the product (if relevant) within the same geographical area. They also account for transport to the consumer and for the losses during that process, when relevant.
This is the market for  'diesel, low-sulfur', in the geography of India.
Inventory for regional market of refined petroleum product, encompassing the distribution to the final consumer (household, road vehicle, power plant, etc.) including all necessary transports. This regional market activity was created as a copy of the corresponding datasets for Europe without Switzerland in ecoinvent v3.4 (2017). The type and amount of all exchanges have been left unmodified, but the uncertainty information has been adjusted accordingly.
diesel, low-sulfur' is a fossil fuel with a calorific value of 42.8 MJ/kg. It is used as a liquid fuel and is sourced from fractional distillation of crude oil. Its main applications are in the following sectors: automotive, railroad, aviation, agricultural and military vehicle fuel.
Geography:  Comment found in the corresponding dataset for Europe without Switzerland in ecoinvent v3.4 (2017): Surveys mainly for DE and CH.
Technology:  Comment found in the corresponding dataset for Europe without Switzerland in ecoinvent v3.4 (2017): Distribution of petroleum products.
Time period:  Comment found in the corresponding dataset for Europe without Switzerland in ecoinvent v3.4 (2017): Most information for the year 2000. Split up of NMVOC emissions published 1989.",cutoff-3.9.1,a599fa9c-4811-53b6-b3ca-4ee3e547eae9_b80eb2d5-1256-41bb-a61d-83252d0dfd4d.spold,b80eb2d5-1256-41bb-a61d-83252d0dfd4d,IN,"market for diesel, low-sulfur","[{'description': 'fraction, process water, to air', 'id': 'daadf2d4-7bbb-4f69-8ab5-58df4c1685eb', 'unit': 'dimensionless', 'comment': 'Comment found in the corresponding dataset for Europe without Switzerland in ecoinvent v3.4 (2017): Literature value. In case when no industry/process specific data are available, default evaporation fraction value is used. This value is 15% and is based on literature (Statistics Canada, 2007 & Shaffer, K.H., 2008, Consumptive water use in the Great Lakes Basin, USGS & Shiklomanov, 2003, World Water Resources at the Beginning of the 21st Century) and has been approved by an expert.', 'amount': 0.15, 'pedigree': {'reliability': 4, 'completeness': 4, 'temporal correlation': 4, 'geographical correlation': 5, 'further technological correlation': 4}, 'uncertainty type': 2, 'loc': -1.89711998488588, 'scale': 0.31622776601683794, 'scale without pedigree': 0.2, 'name': 'fraction_PW_to_air'}, {'description': 'fraction, tap water, to air', 'id': '148c8010-cc60-48cd-9b40-fc7278e377f7', 'unit': 'dimensionless', 'comment': 'Comment found in the corresponding dataset for Europe without Switzerland in ecoinvent v3.4 (2017): Calculated value. See comment in the other parametres present in this dataset. Tap water is considered to be always used as process water, thus process water fractions to air are applied to all tap water input flows to calculate the amount of water consumed in the processes.', 'amount': 0.15, 'pedigree': {'reliability': 4, 'completeness': 4, 'temporal correlation': 4, 'geographical correlation': 5, 'further technological correlation': 4}, 'uncertainty type': 2, 'loc': -1.89711998488588, 'scale': 0.31622776601683794, 'scale without pedigree': 0.2, 'name': 'fraction_TW_to_air'}]",1.0,"diesel, low-sulfur",[],process,kilogram
1d09e548-2f57-5b78-bd3b-4fdbae392f2c,market group,"{'data entry': {'name': 'Johannes Müller', 'email': 'mueller@ecoinvent.org'}, 'data generator': {'name': 'Johannes Müller', 'email': 'mueller@ecoinvent.org'}}","[('ISIC rev.4 ecoinvent', '3510:Electric power generation, transmission and distribution'), ('CPC', '17100: Electrical energy')]",6f62652ec33ef049081d838e0f7d9255,"This dataset is a market group. Market groups represent a 'market of markets'. Their purpose is to group a set of markets into larger, geographically relevant datasets.
Market groups are created for convenience and ease of use. They only group other markets and/or market groups contained within their geography.
Losses and relevant exchanges (transport, transport infrastructure, etc.) are not included in this dataset. They are present in the contained markets.  
This is the market group for 'electricity, medium voltage', in China.",cutoff-3.9.1,1d09e548-2f57-5b78-bd3b-4fdbae392f2c_759b89bd-3aa6-42ad-b767-5bb9ef5d331d.spold,759b89bd-3aa6-42ad-b767-5bb9ef5d331d,CN-SGCC,"market group for electricity, medium voltage",[],1.0,"electricity, medium voltage",[],process,kilowatt hour
9a1fcb92-cc84-589c-bb0a-e082620a301f,ordinary transforming activity,"{'data entry': {'name': 'Tereza Levova', 'email': 'levova@ecoinvent.org'}, 'data generator': {'name': 'Tereza Levova', 'email': 'levova@ecoinvent.org'}}","[('ISIC rev.4 ecoinvent', '1040:Manufacture of vegetable and animal oils and fats'), ('CPC', '216: Vegetable oils')]",ee11dce1d37279f383da6094c2e8b989,"Vegetable oils are often traded on the same market, simply because most of the uses requiring vegetable oil do not require a specific vegetable oil. The purpose of this activity is to link certain amount of a specific vegetable oils and create generic vegetable oil which can be then traded on generic vegetable oil market.",cutoff-3.9.1,9a1fcb92-cc84-589c-bb0a-e082620a301f_d2184fe3-da8e-40d0-a15e-f35bc3624d26.spold,d2184fe3-da8e-40d0-a15e-f35bc3624d26,GLO,"palm oil, refined, to generic market for vegetable oil, refined","[{'description': 'fraction', 'id': 'c284793b-4b01-4b90-a12d-99b46685630e', 'unit': 'dimensionless', 'comment': 'According to literature (USDA, http://usda.mannlib.cornell.edu/MannUsda/viewDocumentInfo.do?documentID=1290 and http://lipidlibrary.aocs.org/market/nonfood.htm) 19.8% of vegetable oil, crude produced is further processed to be used for non-food products. The remaining 80.2 % is refined into vegetable oil, refined and used during food production. ', 'amount': 0.802, 'pedigree': {'reliability': 4, 'completeness': 1, 'temporal correlation': 1, 'geographical correlation': 1, 'further technological correlation': 1}, 'uncertainty type': 2, 'loc': -0.22, 'scale': 0.09273618495495704, 'scale without pedigree': 0.02449489742783178, 'name': 'fraction_of_crude_oil_PV_to_refinery'}, {'description': 'fraction_to_generic_market', 'id': '2e0401d2-4fd5-48ca-b088-3541e51ed495', 'unit': '% (obsolete)', 'comment': 'It is assumed that 90% of palm oil, refined is traded on generic vegetable oil market, i.e. its buyers do not care what type of vegetable oil they are buying. Remaining 10% of the production volume (PV) is assumed to be used for uses, where specific type of vegetable oil is required and cannot be substituted by any other vegetable oil.', 'amount': 0.9, 'pedigree': {'reliability': 5, 'completeness': 1, 'temporal correlation': 1, 'geographical correlation': 1, 'further technological correlation': 1}, 'uncertainty type': 2, 'loc': -0.11, 'scale': 0.20149441679609886, 'scale without pedigree': 0.02449489742783178, 'name': 'fraction_to_generic_market'}]",1.0,"vegetable oil, refined",[],process,kilogram
7f6ec89c-a6e9-5632-a963-3a22cf2eb66a,market activity,"{'data entry': {'name': 'Florentine Brunner', 'email': 'Brunner@ecoinvent.org'}, 'data generator': {'name': 'Florentine Brunner', 'email': 'Brunner@ecoinvent.org'}}","[('EcoSpold01Categories', 'hard coal/fuels'), ('ISIC rev.4 ecoinvent', '0510:Mining of hard coal'), ('CPC', '11010: Hard coal')]",38bf19c9c5f3abbf3cfbf26ffb77fe49,"This is a market activity. Each market represents the consumption mix of a product in a given geography, connecting suppliers with consumers of the same product in the same geographical area. Markets group the producers and also the imports of the product (if relevant) within the same geographical area. They also account for transport to the consumer and for the losses during that process, when relevant.
This is the market for  'hard coal', in the geography of China.
This dataset covers the average transport distance specific to the domestic market of hard coal in China. In China coal is transported mainly by railway (60%), water (30%), and road (10%). Two major transport corridors are distinguished: the North–south coal traffic accounting for 75% and the east–west coal traffic accounting for 25% of the total coal transported (Wang and Ducruet, 2014).
Dust from transport and load/unload operations is included. Average coal losses are considered. Average emissions to water due to leaching from coal heaps at storage is estimated from the literature.
Geography:  Transport distances are geography specific, losses and related emissions are generic values applicable worldwide.
Technology:  Not specified",cutoff-3.9.1,7f6ec89c-a6e9-5632-a963-3a22cf2eb66a_0d3eda5a-4601-4573-9549-0701c459ab88.spold,0d3eda5a-4601-4573-9549-0701c459ab88,CN,market for hard coal,[],1.0,hard coal,[],process,kilogram
45fe907b-33fe-588d-a00c-4379dab22d3b,market group,"{'data entry': {'name': '[System]', 'email': 'support@ecoinvent.org'}, 'data generator': {'name': '[System]', 'email': 'support@ecoinvent.org'}}","[('ISIC rev.4 ecoinvent', '3510:Electric power generation, transmission and distribution'), ('CPC', '17100: Electrical energy')]",5cb69853f15e2cf372fcf87080a69dac,"This dataset is a market group. Market groups represent a 'market of markets'. Their purpose is to group a set of markets into larger, geographically relevant datasets.
Market groups are created for convenience and ease of use. They only group other markets and/or market groups contained within their geography.
Losses and relevant exchanges (transport, transport infrastructure, etc.) are not included in this dataset. They are present in the contained markets.  
This is the market group for 'electricity, medium voltage', in Asia.",cutoff-3.9.1,45fe907b-33fe-588d-a00c-4379dab22d3b_759b89bd-3aa6-42ad-b767-5bb9ef5d331d.spold,759b89bd-3aa6-42ad-b767-5bb9ef5d331d,RAS,"market group for electricity, medium voltage",[],1.0,"electricity, medium voltage",[],process,kilowatt hour
29f2329c-76d9-590b-ab5f-ec9341f881f4,market activity,"{'data entry': {'name': 'Johannes Müller', 'email': 'mueller@ecoinvent.org'}, 'data generator': {'name': 'Johannes Müller', 'email': 'mueller@ecoinvent.org'}}","[('ISIC rev.4 ecoinvent', '2410:Manufacture of basic iron and steel'), ('EcoSpold01Categories', 'metals/extraction'), ('CPC', '41111: Pig iron and spiegeleisen in pigs, blocks or other primary forms')]",a309624068522e73107aef09fc7aca59,"This is a market activity. Each market represents the consumption mix of a product in a given geography, connecting suppliers with consumers of the same product in the same geographical area. Markets group the producers and also the imports of the product (if relevant) within the same geographical area. They also account for transport to the consumer and for the losses during that process, when relevant.
This is the market for  'pig iron', in the Global geography.
This activity represents the global supply of pig iron (hot metal) to steelmaking plants.
Transport distances are based on the ecoinvent ""Default Transport Assumptions"" model, accessible on the ecoinvent website.
Geography:  Activity represents the supply of iron ore concentrate globally.",cutoff-3.9.1,29f2329c-76d9-590b-ab5f-ec9341f881f4_a636ed9e-f90a-48cb-a180-c75b1fc92cf1.spold,a636ed9e-f90a-48cb-a180-c75b1fc92cf1,RoW,market for pig iron,[],1.0,pig iron,[],process,kilogram
0e97db67-9266-5047-8b19-0374449de40d,market activity,"{'data entry': {'name': '[System]', 'email': 'support@ecoinvent.org'}, 'data generator': {'name': '[System]', 'email': 'support@ecoinvent.org'}}","[('EcoSpold01Categories', 'natural gas/power plants'), ('ISIC rev.4 ecoinvent', '3510:Electric power generation, transmission and distribution'), ('CPC', '17100: Electrical energy')]",c3bedcebac04b5b65dddf73fe3da7405,"This is a market activity. Each market represents the consumption mix of a product in a given geography, connecting suppliers with consumers of the same product in the same geographical area. Markets group the producers and also the imports of the product (if relevant) within the same geographical area. They also account for transport to the consumer and for the losses during that process, when relevant.
This is the market for  'sweet gas, burned in gas turbine', in the Global geography.
This market contains no transport or losses, as they are irrelevant for the delivered product.
'sweet gas, burned in gas turbine' describes the use of a fossil fuel. It is used as a gaseous fuel and is sourced from natural gas processing plants. This exchange provides the treatment of sweet gas (hydrogen sulfide poor) to produce electricity.",cutoff-3.9.1,0e97db67-9266-5047-8b19-0374449de40d_7f8a51d3-2d37-4535-a185-3c2351aea9e6.spold,7f8a51d3-2d37-4535-a185-3c2351aea9e6,GLO,"market for sweet gas, burned in gas turbine",[],1.0,"sweet gas, burned in gas turbine",[],process,megajoule
6ebfa75b-7c00-5e8c-a1b6-c09c56d35dec,market group,"{'data entry': {'name': '[System]', 'email': 'support@ecoinvent.org'}, 'data generator': {'name': '[System]', 'email': 'support@ecoinvent.org'}}","[('ISIC rev.4 ecoinvent', '3510:Electric power generation, transmission and distribution'), ('CPC', '17100: Electrical energy')]",f1e17b3ea94b57770f72b4dadfc1f208,"This dataset is a market group. Market groups represent a 'market of markets'. Their purpose is to group a set of markets into larger, geographically relevant datasets.
Market groups are created for convenience and ease of use. They only group other markets and/or market groups contained within their geography.
Losses and relevant exchanges (transport, transport infrastructure, etc.) are not included in this dataset. They are present in the contained markets.  
This is the market group for 'electricity, medium voltage', in the Global geography.",cutoff-3.9.1,6ebfa75b-7c00-5e8c-a1b6-c09c56d35dec_759b89bd-3aa6-42ad-b767-5bb9ef5d331d.spold,759b89bd-3aa6-42ad-b767-5bb9ef5d331d,GLO,"market group for electricity, medium voltage",[],1.0,"electricity, medium voltage",[],process,kilowatt hour
