activity,activity type,authors,classifications,code,comment,database,filename,flow,location,name,parameters,production amount,reference product,synonyms,type,unit
29f2329c-76d9-590b-ab5f-ec9341f881f4,market activity,"{'data entry': {'name': 'Johannes Müller', 'email': 'mueller@ecoinvent.org'}, 'data generator': {'name': 'Johannes Müller', 'email': 'mueller@ecoinvent.org'}}","[('ISIC rev.4 ecoinvent', '2410:Manufacture of basic iron and steel'), ('EcoSpold01Categories', 'metals/extraction'), ('CPC', '41111: Pig iron and spiegeleisen in pigs, blocks or other primary forms')]",a309624068522e73107aef09fc7aca59,"This is a market activity. Each market represents the consumption mix of a product in a given geography, connecting suppliers with consumers of the same product in the same geographical area. Markets group the producers and also the imports of the product (if relevant) within the same geographical area. They also account for transport to the consumer and for the losses during that process, when relevant.
This is the market for  'pig iron', in the Global geography.
This activity represents the global supply of pig iron (hot metal) to steelmaking plants.
Transport distances are based on the ecoinvent ""Default Transport Assumptions"" model, accessible on the ecoinvent website.
Geography:  Activity represents the supply of iron ore concentrate globally.",cutoff-3.9.1,29f2329c-76d9-590b-ab5f-ec9341f881f4_a636ed9e-f90a-48cb-a180-c75b1fc92cf1.spold,a636ed9e-f90a-48cb-a180-c75b1fc92cf1,RoW,market for pig iron,[],1.0,pig iron,[],process,kilogram
