activity,activity type,authors,classifications,code,comment,database,filename,flow,location,name,parameters,production amount,reference product,synonyms,type,unit
904b979f-a553-5ae9-9c90-91f08b7d2ab2,market activity,"{'data entry': {'name': 'Guillaume Bourgault', 'email': 'bourgault@ecoinvent.org'}, 'data generator': {'name': '[System]', 'email': 'support@ecoinvent.org'}}","[('ISIC rev.4 ecoinvent', '0161:Support activities for crop production'), ('CPC', '7: Financial and related services; real estate services; and rental and leasing services')]",c374aa17f9ec5685054cac4859db16ce,"This is a market activity. Each market represents the consumption mix of a product in a given geography, connecting suppliers with consumers of the same product in the same geographical area. Markets group the producers and also the imports of the product (if relevant) within the same geographical area. They also account for transport to the consumer and for the losses during that process, when relevant.
This market represents the mix of land tenure 'land tenure, arable land, measured as carbon net primary productivity, annual crop', in United States. This is land that is made accessible for cultivation after deforestation, transformation from primary or secondary forest, or change from annual to perennial crops (or vice versa), and is used by activities modelling land use change only.",cutoff-3.9.1,904b979f-a553-5ae9-9c90-91f08b7d2ab2_4c2bb0f0-422d-4fb3-bcfe-a36ef1b55874.spold,4c2bb0f0-422d-4fb3-bcfe-a36ef1b55874,US,"market for land tenure, arable land, measured as carbon net primary productivity, annual crop",[],1.0,"land tenure, arable land, measured as carbon net primary productivity, annual crop",[],process,kilogram
79d6450d-f9ad-5619-89c3-05c8d7622af3,market activity,"{'data entry': {'name': '[System]', 'email': 'support@ecoinvent.org'}, 'data generator': {'name': '[System]', 'email': 'support@ecoinvent.org'}}","[('ISIC rev.4 ecoinvent', '4312:Site preparation'), ('EcoSpold01Categories', 'construction processes/machinery'), ('CPC', '543: Site preparation services')]",5efd4061851b2bd322f17830fee57dff,"This is a market activity. Each market represents the consumption mix of a product in a given geography, connecting suppliers with consumers of the same product in the same geographical area. Markets group the producers and also the imports of the product (if relevant) within the same geographical area. They also account for transport to the consumer and for the losses during that process, when relevant.
This is the market for  'diesel, burned in building machine', in the Global geography.
This market contains no transport or losses, as they are irrelevant for the delivered product.
diesel, burned in building machine' describes the use of a fossil fuel. It is used as a liquid fuel and is sourced from distillation of heavy oil. This exchange provides the service of burning 1 MJ of diesel in a builiding machinery. The services also includes (air) emissions and the production and provision of fuel. 1 MJ equals 0.0234 kg of diesel (LHV of diesel ca 42.8 MJ/kg).",cutoff-3.9.1,79d6450d-f9ad-5619-89c3-05c8d7622af3_b0f4c2fb-5081-474a-8ffa-1457da8345db.spold,b0f4c2fb-5081-474a-8ffa-1457da8345db,GLO,"market for diesel, burned in building machine",[],1.0,"diesel, burned in building machine",[],process,megajoule
