activity,activity type,authors,classifications,code,comment,database,filename,flow,location,name,parameters,production amount,reference product,synonyms,type,unit
71badb83-ce3e-57ed-85b8-ed9d244fdd3a,market group,"{'data entry': {'name': '[System]', 'email': 'support@ecoinvent.org'}, 'data generator': {'name': '[System]', 'email': 'support@ecoinvent.org'}}","[('ISIC rev.4 ecoinvent', '3510:Electric power generation, transmission and distribution'), ('CPC', '17100: Electrical energy')]",476b68dc744251f288055e5ce8264feb,"This dataset is a market group. Market groups represent a 'market of markets'. Their purpose is to group a set of markets into larger, geographically relevant datasets.
Market groups are created for convenience and ease of use. They only group other markets and/or market groups contained within their geography.
Losses and relevant exchanges (transport, transport infrastructure, etc.) are not included in this dataset. They are present in the contained markets.  
This is the market group for 'electricity, medium voltage', in Europe without Switzerland.",cutoff-3.9.1,71badb83-ce3e-57ed-85b8-ed9d244fdd3a_759b89bd-3aa6-42ad-b767-5bb9ef5d331d.spold,759b89bd-3aa6-42ad-b767-5bb9ef5d331d,Europe without Switzerland,"market group for electricity, medium voltage",[],1.0,"electricity, medium voltage",[],process,kilowatt hour
8c5db50e-d7b3-5570-977f-7be1811f6be0,market activity,"{'data entry': {'name': 'Frank Werner', 'email': 'frank@frankwerner.ch'}, 'data generator': {'name': 'Frank Werner', 'email': 'frank@frankwerner.ch'}}","[('ISIC rev.4 ecoinvent', '1610:Sawmilling and planing of wood'), ('CPC', '31101: Wood, sawn or chipped lengthwise, sliced or peeled, of a thickness exceeding 6 mm, of coniferous wood ')]",0d859e6ffeef905ce00ebc95b6d46a02,"This is a market activity. Each market represents the consumption mix of a product in a given geography, connecting suppliers with consumers of the same product in the same geographical area. Markets group the producers and also the imports of the product (if relevant) within the same geographical area. They also account for transport to the consumer and for the losses during that process, when relevant.
This dataset represents the market for planed softwood beam that has been kiln dried to 10% moisture content in Europe without Switzerland. Transport distance based on eurostat transport statistics.",cutoff-3.9.1,8c5db50e-d7b3-5570-977f-7be1811f6be0_50998c77-fa60-4504-b53d-65f3c47eb96c.spold,50998c77-fa60-4504-b53d-65f3c47eb96c,Europe without Switzerland,"market for sawnwood, beam, softwood, dried (u=10%), planed",[],1.0,"sawnwood, beam, softwood, dried (u=10%), planed",[],process,cubic meter
13c7696b-9af5-5c06-91b1-a08b70b87e0b,market activity,"{'data entry': {'name': 'Lucia Valsasina', 'email': 'valsasina@ecoinvent.org'}, 'data generator': {'name': 'Lucia Valsasina', 'email': 'valsasina@ecoinvent.org'}}","[('EcoSpold01Categories', 'transport systems/road'), ('ISIC rev.4 ecoinvent', '4923:Freight transport by road'), ('CPC', '6511: Road transport services of freight')]",d6655a43e0d3a5f786929ade5064e0fd,"This is a market activity. Each market represents the consumption mix of a product in a given geography, connecting suppliers with consumers of the same product in the same geographical area. Markets group the producers and also the imports of the product (if relevant) within the same geographical area. They also account for transport to the consumer and for the losses during that process, when relevant.
This is the market for 'transport, freight, lorry, unspecified', in the the geography of Europe. This is a generic market; the suppliers of this market make available this generic product by redirecting a part of the production of several more specific products.
No transport or losses have been considered for the generic product supplied in this market, as the transport modelled in the upstream niche markets for the more specific products do already account it.
This is delivering the service of transportation of 1 metric ton across the distance of 1 km. This service only considers the transportation of goods. The vehicle operates with diesel, and it provides a fleet average that includes different lorry classes as well as EURO classes. Specific transport activities are available in the database, this represents a generic product that can be used when no further information are available.  This service provides combines data for transport which is calculated for an average load factor, including empty return trips.",cutoff-3.9.1,13c7696b-9af5-5c06-91b1-a08b70b87e0b_cfbce515-3f54-4411-ad9d-3d26b7faa15a.spold,cfbce515-3f54-4411-ad9d-3d26b7faa15a,RER,"market for transport, freight, lorry, unspecified",[],1.0,"transport, freight, lorry, unspecified",[],process,ton kilometer
c5a68148-cc41-573d-8f5f-ee5e5f7e90be,market activity,"{'data entry': {'name': 'Frank Werner', 'email': 'frank@frankwerner.ch'}, 'data generator': {'name': 'Frank Werner', 'email': 'frank@frankwerner.ch'}}","[('ISIC rev.4 ecoinvent', '0220:Logging'), ('CPC', '031: Wood in the rough')]",aac7bdaca2c5c7df6bd081fec31aa911,"This is a market activity. Each market represents the consumption mix of a product in a given geography, connecting suppliers with consumers of the same product in the same geographical area. Markets group the producers and also the imports of the product (if relevant) within the same geographical area. They also account for transport to the consumer and for the losses during that process, when relevant.
This dataset represents the market for sawlog and veneer log, softwood in Europe without Switzerland. Transport distances are based on expert judgment.",cutoff-3.9.1,c5a68148-cc41-573d-8f5f-ee5e5f7e90be_42a1bdfc-883d-41f0-b83a-1c5527e34de7.spold,42a1bdfc-883d-41f0-b83a-1c5527e34de7,Europe without Switzerland,"market for sawlog and veneer log, softwood, measured as solid wood under bark",[],1.0,"sawlog and veneer log, softwood, measured as solid wood under bark",[],process,cubic meter
