names,mu,mu_star,sigma,mu_star_conf,trajectories,reference_product,number of variables,runtime,number of runs,score,mu_star_relative,mu_star_conf_relative
"'market for light fuel oil' (kilogram, RoW, None)",,0.004610234053417547,,0.001962373404704221,10,_zinc_sulfide_production___kilogram__RoW__None_,315,656.0997312068939,2380,0.17625818121810827,2.615614220886959,1.113351670340856
other,,0.006387479331279851,,0.00230908474041182,10,_zinc_sulfide_production___kilogram__RoW__None_,315,656.0997312068939,2380,0.17625818121810827,3.623933531559453,1.3100581910319808
"'market for electricity, high voltage' (kilowatt hour, IN-Southern grid, None)",,3.628775809335075e-05,,3.1371840625182096e-05,10,_zinc_sulfide_production___kilogram__RoW__None_,315,656.0997312068939,2380,0.17625818121810827,0.02058784326637693,0.017798799697337987
"'market group for electricity, medium voltage' (kilowatt hour, Canada without Quebec, None)",,0.008725434214360867,,0.006145703608430094,10,_zinc_sulfide_production___kilogram__RoW__None_,315,656.0997312068939,2380,0.17625818121810827,4.950371185076339,3.486762183722512
"'market group for heavy fuel oil' (kilogram, RER, None)",0.00010399308195538568,0.00010399308195538568,3.056730270006424e-05,1.830444374317481e-05,10,_zinc_sulfide_production___kilogram__RoW__None_,315,656.0997312068939,2380,0.17625818121810827,0.05900042836973386,0.0103850179416774
"'market for brazing solder, cadmium free' (kilogram, GLO, None)",-1.0258417939057462e-06,1.0258417939057462e-06,6.192851778768882e-07,3.772176812746884e-07,10,_zinc_sulfide_production___kilogram__RoW__None_,315,656.0997312068939,2380,0.17625818121810827,0.0005820108813197909,0.00021401428215573468
"'market for electricity, medium voltage' (kilowatt hour, TW, None)",0.00037431268216942746,0.00037431268216942746,0.0004764414122968311,0.00025110351983664945,10,_zinc_sulfide_production___kilogram__RoW__None_,315,656.0997312068939,2380,0.17625818121810827,0.2123661322172838,0.14246346927064046
"'market for electricity, high voltage' (kilowatt hour, PH, None)",,0.0003018315392107021,,0.00046067372099018914,10,_zinc_sulfide_production___kilogram__RoW__None_,315,656.0997312068939,2380,0.17625818121810827,0.17124398829306245,0.2613630288287922
"'market for copper concentrate, sulfide ore' (kilogram, GLO, None)",,0.00026460813644323816,,0.0002159680567502435,10,_zinc_sulfide_production___kilogram__RoW__None_,315,656.0997312068939,2380,0.17625818121810827,0.15012530744079475,0.12252938005924206
"'market for chemical, organic' (kilogram, GLO, None)",,0.0016192887275014126,,0.0006602566227934167,10,_zinc_sulfide_production___kilogram__RoW__None_,315,656.0997312068939,2380,0.17625818121810827,0.9187027327245854,0.37459629858337823
"'market for heat, district or industrial, other than natural gas' (megajoule, RoW, None)",,0.0001514141978973503,,5.911749610863966e-05,10,_zinc_sulfide_production___kilogram__RoW__None_,315,656.0997312068939,2380,0.17625818121810827,0.08590477721427574,0.03354028488214429
"'market for synthetic rubber' (kilogram, GLO, None)",-0.00010453420301460362,0.00010453420301460362,3.803744066050675e-05,2.3543966438787577e-05,10,_zinc_sulfide_production___kilogram__RoW__None_,315,656.0997312068939,2380,0.17625818121810827,0.059307433159797106,0.013357658791255436
"'transport, freight, lorry, all sizes, EURO6 to generic market for transport, freight, lorry, unspecified' (ton kilometer, RoW, None)",,0.008077632775467941,,0.006820248350664239,10,_zinc_sulfide_production___kilogram__RoW__None_,315,656.0997312068939,2380,0.17625818121810827,4.582841329488351,3.869464840457315
"'market for copper oxide' (kilogram, GLO, None)",-2.99146391043309e-06,2.99146391043309e-06,5.004597142774765e-06,2.810724236806345e-06,10,_zinc_sulfide_production___kilogram__RoW__None_,315,656.0997312068939,2380,0.17625818121810827,0.0016972057068552998,0.0015946631341487933
"'transport, freight, lorry, all sizes, EURO5 to generic market for transport, freight, lorry, unspecified' (ton kilometer, BR, None)",,0.00016225425441986768,,0.00016169364558546635,10,_zinc_sulfide_production___kilogram__RoW__None_,315,656.0997312068939,2380,0.17625818121810827,0.09205487841672914,0.09173681724616276
"'market for electricity, high voltage' (kilowatt hour, BD, None)",,0.001405507177432501,,0.0011191230646192504,10,_zinc_sulfide_production___kilogram__RoW__None_,315,656.0997312068939,2380,0.17625818121810827,0.7974138662495759,0.6349339683894768
"'market for electricity, high voltage' (kilowatt hour, US-NPCC, None)",,0.0001631896757053803,,6.000928305333399e-05,10,_zinc_sulfide_production___kilogram__RoW__None_,315,656.0997312068939,2380,0.17625818121810827,0.09258558926319765,0.034046239804934965
"'market for electricity, medium voltage' (kilowatt hour, PL, None)",0.0009684986720619619,0.0009684986720619619,0.0015784357052713038,0.0009377259007114243,10,_zinc_sulfide_production___kilogram__RoW__None_,315,656.0997312068939,2380,0.17625818121810827,0.5494772868803783,0.5320183688671156
"'market group for heat, district or industrial, natural gas' (megajoule, GLO, None)",,0.0003181827049723564,,0.00021978769604480707,10,_zinc_sulfide_production___kilogram__RoW__None_,315,656.0997312068939,2380,0.17625818121810827,0.18052081484865973,0.12469645069855441
"'market for sodium hypochlorite, without water, in 15% solution state' (kilogram, RoW, None)",0.00035011592733803776,0.00035011592733803776,0.00035251232378489254,0.00018742440915941685,10,_zinc_sulfide_production___kilogram__RoW__None_,315,656.0997312068939,2380,0.17625818121810827,0.19863811422449185,0.10633515441050144
"'market group for transport, freight train' (ton kilometer, GLO, None)",,0.0008534099426517838,,0.0003974123673593239,10,_zinc_sulfide_production___kilogram__RoW__None_,315,656.0997312068939,2380,0.17625818121810827,0.4841817479074877,0.22547172824139802
"'market for electricity, high voltage' (kilowatt hour, IN-Western grid, None)",,0.00014596429383012614,,0.00012948298254120442,10,_zinc_sulfide_production___kilogram__RoW__None_,315,656.0997312068939,2380,0.17625818121810827,0.08281277658794438,0.07346211202586816
"'market for electricity, medium voltage' (kilowatt hour, CZ, None)",-0.00016220911461303707,0.00016220911461303707,0.00019129972549194107,0.00011175791458918703,10,_zinc_sulfide_production___kilogram__RoW__None_,315,656.0997312068939,2380,0.17625818121810827,0.09202926836758496,0.0634058026792491
"'market for polyethylene, high density, granulate' (kilogram, GLO, None)",,9.010811580373382e-05,,5.4551650426940436e-05,10,_zinc_sulfide_production___kilogram__RoW__None_,315,656.0997312068939,2380,0.17625818121810827,0.05112279905590922,0.03094985438402785
"'market group for electricity, low voltage' (kilowatt hour, RAS, None)",,0.00016173835608403533,,9.860890539883932e-05,10,_zinc_sulfide_production___kilogram__RoW__None_,315,656.0997312068939,2380,0.17625818121810827,0.09176218372745741,0.05594571821708354
"'market for electricity, low voltage' (kilowatt hour, CN-NECG, None)",,3.0972919329269593e-06,,5.021565108933144e-06,10,_zinc_sulfide_production___kilogram__RoW__None_,315,656.0997312068939,2380,0.17625818121810827,0.0017572471879159232,0.0028489827106063675
"'market for natural gas, high pressure' (cubic meter, PL, None)",,0.00017761391097364244,,6.995756512343219e-05,10,_zinc_sulfide_production___kilogram__RoW__None_,315,656.0997312068939,2380,0.17625818121810827,0.10076917266827833,0.0396903931720844
"'market for electricity, high voltage' (kilowatt hour, KZ, None)",,0.0005528867896886059,,0.00036761537919449797,10,_zinc_sulfide_production___kilogram__RoW__None_,315,656.0997312068939,2380,0.17625818121810827,0.31368007196468445,0.20856642038056514
"'market for coke' (megajoule, GLO, None)",,6.277780233728755e-05,,2.0838337138127663e-05,10,_zinc_sulfide_production___kilogram__RoW__None_,315,656.0997312068939,2380,0.17625818121810827,0.035616957978026574,0.011822621221957097
"'market for oxygen, liquid' (kilogram, RoW, None)",-0.0005615060184935086,0.0005615060184935086,0.00016032946072747396,9.627395693721333e-05,10,_zinc_sulfide_production___kilogram__RoW__None_,315,656.0997312068939,2380,0.17625818121810827,0.31857018755837535,0.05462098625542972
"'market group for electricity, high voltage' (kilowatt hour, US, None)",,2.6921385471064683e-05,,2.4931035818128048e-05,10,_zinc_sulfide_production___kilogram__RoW__None_,315,656.0997312068939,2380,0.17625818121810827,0.015273835963251648,0.014144611981033369
"'market for electricity, high voltage' (kilowatt hour, CN-CSG, None)",,0.001631078082348178,,0.0010922366322736923,10,_zinc_sulfide_production___kilogram__RoW__None_,315,656.0997312068939,2380,0.17625818121810827,0.9253914179052051,0.6196799630662926
"'market for electricity, high voltage' (kilowatt hour, IT, None)",,0.00011515536899707193,,8.386519632692577e-05,10,_zinc_sulfide_production___kilogram__RoW__None_,315,656.0997312068939,2380,0.17625818121810827,0.06533334691260345,0.04758088149289816
"'market for electricity, high voltage' (kilowatt hour, MX, None)",,0.009568393749826726,,0.0051150622287273,10,_zinc_sulfide_production___kilogram__RoW__None_,315,656.0997312068939,2380,0.17625818121810827,5.428623899157594,2.902028259555077
"'market for electricity, medium voltage' (kilowatt hour, AT, None)",6.41761842664186e-05,6.41761842664186e-05,8.7979084668736e-05,4.630395928110085e-05,10,_zinc_sulfide_production___kilogram__RoW__None_,315,656.0997312068939,2380,0.17625818121810827,0.03641032933785052,0.026270530514440435
"'market group for electricity, high voltage' (kilowatt hour, CN, None)",-2.005181553436028e-05,2.186560431918852e-05,2.078435790881801e-05,1.147493944728701e-05,10,_zinc_sulfide_production___kilogram__RoW__None_,315,656.0997312068939,2380,0.17625818121810827,0.012405440796039549,0.0065103017448520616
"'market for transport, freight, lorry, unspecified' (ton kilometer, BR, None)",,0.00147383104109119,,0.001595487754631678,10,_zinc_sulfide_production___kilogram__RoW__None_,315,656.0997312068939,2380,0.17625818121810827,0.8361773796289309,0.9051992614500903
"'market for gold' (kilogram, GLO, None)",,0.00015346595511470036,,5.6826679882124016e-05,10,_zinc_sulfide_production___kilogram__RoW__None_,315,656.0997312068939,2380,0.17625818121810827,0.08706884075060096,0.03224059132427142
"'market for electricity, high voltage' (kilowatt hour, TW, None)",,0.0005067100280456169,,0.0007279135454560402,10,_zinc_sulfide_production___kilogram__RoW__None_,315,656.0997312068939,2380,0.17625818121810827,0.28748170697313363,0.41298142328797416
"'market for natural gas, high pressure' (cubic meter, MY, None)",1.4826381305302339e-05,1.4826381305302339e-05,1.1019358210655635e-05,6.812842345047665e-06,10,_zinc_sulfide_production___kilogram__RoW__None_,315,656.0997312068939,2380,0.17625818121810827,0.008411740778690798,0.0038652630464949636
"'market for diesel, low-sulfur' (kilogram, RoW, None)",,0.005210550469883388,,0.002068191097244983,10,_zinc_sulfide_production___kilogram__RoW__None_,315,656.0997312068939,2380,0.17625818121810827,2.956203470314756,1.1733872907072203
"'transport, freight, lorry, all sizes, EURO4 to generic market for transport, freight, lorry, unspecified' (ton kilometer, RoW, None)",,0.006353107542447306,,0.0053008367938576295,10,_zinc_sulfide_production___kilogram__RoW__None_,315,656.0997312068939,2380,0.17625818121810827,3.6044327125932045,3.0074273756962135
"'market for electricity, high voltage' (kilowatt hour, BY, None)",,0.00019928742082102804,,0.00020084299858358302,10,_zinc_sulfide_production___kilogram__RoW__None_,315,656.0997312068939,2380,0.17625818121810827,0.11306562875196276,0.11394818509732187
"'market for sulfur' (kilogram, GLO, None)",,0.005014365256884845,,0.002479337169459428,10,_zinc_sulfide_production___kilogram__RoW__None_,315,656.0997312068939,2380,0.17625818121810827,2.8448978777784433,1.4066508302337504
"'market for electricity, medium voltage' (kilowatt hour, IT, None)",0.00016114291483264458,0.00016114291483264458,0.00024102273797458264,0.00012896301506518684,10,_zinc_sulfide_production___kilogram__RoW__None_,315,656.0997312068939,2380,0.17625818121810827,0.09142436040074674,0.07316710871173879
"'market for electricity, medium voltage' (kilowatt hour, CA-ON, None)",0.0003913806630278363,0.0003913806630278363,0.00048499522692259346,0.0002883453470971761,10,_zinc_sulfide_production___kilogram__RoW__None_,315,656.0997312068939,2380,0.17625818121810827,0.22204964349627987,0.1635926032507774
"'market for electricity, high voltage' (kilowatt hour, DE, None)",,0.000659929449546502,,0.00037745616029601016,10,_zinc_sulfide_production___kilogram__RoW__None_,315,656.0997312068939,2380,0.17625818121810827,0.37441067698859404,0.21414958312143947
"'market for natural gas, high pressure' (cubic meter, CN, None)",-2.178461974298232e-05,2.178461974298232e-05,7.503067709837563e-06,4.095028424733811e-06,10,_zinc_sulfide_production___kilogram__RoW__None_,315,656.0997312068939,2380,0.17625818121810827,0.012359494233079167,0.002323312538705068
"'market for heavy fuel oil' (kilogram, RoW, None)",,0.00881530130011981,,0.004818466996966084,10,_zinc_sulfide_production___kilogram__RoW__None_,315,656.0997312068939,2380,0.17625818121810827,5.001357235844523,2.733755087943145
"'market for electricity, high voltage' (kilowatt hour, MA, None)",,0.000138559030139037,,0.00010039103573334648,10,_zinc_sulfide_production___kilogram__RoW__None_,315,656.0997312068939,2380,0.17625818121810827,0.07861140355668315,0.05695680906245082
"'market for electricity, high voltage' (kilowatt hour, US-WECC, None)",,0.0003517275662153713,,0.00034549714460883055,10,_zinc_sulfide_production___kilogram__RoW__None_,315,656.0997312068939,2380,0.17625818121810827,0.19955247681815735,0.19601764991623274
"'market for hydrogen, liquid' (kilogram, RoW, None)",,0.022274567534935535,,0.009630792993871285,10,_zinc_sulfide_production___kilogram__RoW__None_,315,656.0997312068939,2380,0.17625818121810827,12.637465892929065,5.464026082258157
"'market group for electricity, high voltage' (kilowatt hour, RAS, None)",,2.6587538618674098e-05,,1.4390895135017156e-05,10,_zinc_sulfide_production___kilogram__RoW__None_,315,656.0997312068939,2380,0.17625818121810827,0.015084428101396163,0.008164667895448972
"'market for electricity, high voltage' (kilowatt hour, GB, None)",,0.0006551669522994375,,0.0004631456340131846,10,_zinc_sulfide_production___kilogram__RoW__None_,315,656.0997312068939,2380,0.17625818121810827,0.37170867631313537,0.262765467572862
"'market for transport, freight, lorry, unspecified' (ton kilometer, RER, None)",,0.0009325946784794148,,0.0010221621643856941,10,_zinc_sulfide_production___kilogram__RoW__None_,315,656.0997312068939,2380,0.17625818121810827,0.5291071722369518,0.5799232451632038
"'market group for heat, district or industrial, natural gas' (megajoule, RER, None)",-0.00014312272583028168,0.00024071536947241763,0.00027531559436343845,0.00010783759429741945,10,_zinc_sulfide_production___kilogram__RoW__None_,315,656.0997312068939,2380,0.17625818121810827,0.1365697568242507,0.06118161072136408
"'market group for electricity, medium voltage' (kilowatt hour, RAF, None)",,0.0011184353269420122,,0.0005797739537095887,10,_zinc_sulfide_production___kilogram__RoW__None_,315,656.0997312068939,2380,0.17625818121810827,0.6345437807269892,0.32893449240359257
"'market for electricity, high voltage' (kilowatt hour, CN-NECG, None)",,0.00021700195558344162,,0.0001642375482954972,10,_zinc_sulfide_production___kilogram__RoW__None_,315,656.0997312068939,2380,0.17625818121810827,0.12311596209818795,0.09318009930685923
"'market for electricity, high voltage' (kilowatt hour, AT, None)",,0.0001437801705269575,,9.522392091839922e-05,10,_zinc_sulfide_production___kilogram__RoW__None_,315,656.0997312068939,2380,0.17625818121810827,0.08157361521224295,0.054025248791467834
"'market group for electricity, medium voltage' (kilowatt hour, CN, None)",0.001064729107894629,0.0011977735216469824,0.0013403085685536973,0.0007655013751901716,10,_zinc_sulfide_production___kilogram__RoW__None_,315,656.0997312068939,2380,0.17625818121810827,0.6795562698816312,0.43430686161620635
"'market for transport, freight, lorry, unspecified' (ton kilometer, ZA, None)",,4.6398949903962704e-05,,4.195605005372915e-05,10,_zinc_sulfide_production___kilogram__RoW__None_,315,656.0997312068939,2380,0.17625818121810827,0.026324423401684238,0.02380374616586518
"'market for electricity, high voltage' (kilowatt hour, IL, None)",,0.0009588912224822194,,0.0012824725721480858,10,_zinc_sulfide_production___kilogram__RoW__None_,315,656.0997312068939,2380,0.17625818121810827,0.5440265046736483,0.7276102381659708
"'market group for electricity, medium voltage' (kilowatt hour, CA, None)",-0.010135404817642543,0.010135404817642543,0.005672513162099066,0.003369576240675491,10,_zinc_sulfide_production___kilogram__RoW__None_,315,656.0997312068939,2380,0.17625818121810827,5.75031737397802,1.9117275677013001
"'market for electricity, high voltage' (kilowatt hour, BR-North-eastern grid, None)",,2.79246392077298e-05,,2.137585701409476e-05,10,_zinc_sulfide_production___kilogram__RoW__None_,315,656.0997312068939,2380,0.17625818121810827,0.015843031520434696,0.012127582882319375
"'market for hydrogen cyanide' (kilogram, RoW, None)",-0.004723091541074302,0.004723091541074302,0.005448314822111321,0.002755268334892725,10,_zinc_sulfide_production___kilogram__RoW__None_,315,656.0997312068939,2380,0.17625818121810827,2.679643865852546,1.563200253089674
"'market for copper sulfate' (kilogram, GLO, None)",0.0017466683486821975,0.0017466683486821975,0.001390225380507704,0.0008279107446426856,10,_zinc_sulfide_production___kilogram__RoW__None_,315,656.0997312068939,2380,0.17625818121810827,0.9909715036267207,0.469714789362429
"'market for natural gas, high pressure' (cubic meter, ES, None)",,3.3274775296986137e-05,,1.4308327797814733e-05,10,_zinc_sulfide_production___kilogram__RoW__None_,315,656.0997312068939,2380,0.17625818121810827,0.01887842882924721,0.008117823353747812
"'market for electricity, high voltage' (kilowatt hour, ES, None)",,0.0022729561734716537,,0.001569207107988116,10,_zinc_sulfide_production___kilogram__RoW__None_,315,656.0997312068939,2380,0.17625818121810827,1.2895606647949098,0.8902889483730245
"'market for heat, district or industrial, natural gas' (megajoule, RoW, None)",,0.0035415498753581494,,0.002190061344552087,10,_zinc_sulfide_production___kilogram__RoW__None_,315,656.0997312068939,2380,0.17625818121810827,2.009296732147546,1.242530320815024
"'market for electricity, high voltage' (kilowatt hour, BG, None)",,0.00034541637140829916,,0.00019369279000422708,10,_zinc_sulfide_production___kilogram__RoW__None_,315,656.0997312068939,2380,0.17625818121810827,0.19597182327716658,0.1098915174692201
"'market for electricity, high voltage' (kilowatt hour, VE, None)",,0.00018591977604277694,,0.00011577768547324793,10,_zinc_sulfide_production___kilogram__RoW__None_,315,656.0997312068939,2380,0.17625818121810827,0.10548150148713555,0.06568641788603301
"'market for electricity, high voltage' (kilowatt hour, HN, None)",,0.00029706863618286853,,0.00015429993882877066,10,_zinc_sulfide_production___kilogram__RoW__None_,315,656.0997312068939,2380,0.17625818121810827,0.16854175739806654,0.08754200103644229
"'market group for electricity, low voltage' (kilowatt hour, RNA, None)",4.272117801904507e-05,5.350030756020585e-05,4.4811370096616224e-05,1.5053144900344063e-05,10,_zinc_sulfide_production___kilogram__RoW__None_,315,656.0997312068939,2380,0.17625818121810827,0.030353375480484862,0.008540395002554097
"'market for transport, freight train' (ton kilometer, CN, None)",,0.0020316868926305402,,0.0006954985240931615,10,_zinc_sulfide_production___kilogram__RoW__None_,315,656.0997312068939,2380,0.17625818121810827,1.1526766466042546,0.3945907754673392
"'market for electricity, high voltage' (kilowatt hour, CN-ECGC, None)",,0.0003708507136620576,,0.00039107164739646553,10,_zinc_sulfide_production___kilogram__RoW__None_,315,656.0997312068939,2380,0.17625818121810827,0.210401985938544,0.22187432361652437
"'market for electricity, high voltage' (kilowatt hour, GR, None)",,0.0004822504245198229,,0.00046661523695701155,10,_zinc_sulfide_production___kilogram__RoW__None_,315,656.0997312068939,2380,0.17625818121810827,0.273604561891552,0.26473394524569893
"'market for electricity, high voltage' (kilowatt hour, RU, None)",,0.000666449260011203,,0.00037414226030195365,10,_zinc_sulfide_production___kilogram__RoW__None_,315,656.0997312068939,2380,0.17625818121810827,0.37810968852930266,0.21226944344726698
"'market for natural gas, high pressure' (cubic meter, DE, None)",,0.00033653863173357105,,0.00015034243307441425,10,_zinc_sulfide_production___kilogram__RoW__None_,315,656.0997312068939,2380,0.17625818121810827,0.19093504165751374,0.08529671192304832
"'market for diesel, low-sulfur' (kilogram, IN, None)",0.000872379230006557,0.000872379230006557,0.0003217137603591594,0.0001802042401667044,10,_zinc_sulfide_production___kilogram__RoW__None_,315,656.0997312068939,2380,0.17625818121810827,0.49494396457378814,0.10223879477328382
"'market for transport, freight train' (ton kilometer, IN, None)",8.463281963966632e-05,8.463281963966632e-05,4.855592659131688e-05,2.698370819144671e-05,10,_zinc_sulfide_production___kilogram__RoW__None_,315,656.0997312068939,2380,0.17625818121810827,0.04801639223483113,0.015309194730686624
"'market for electricity, high voltage' (kilowatt hour, US-RFC, None)",,0.0004210258483336283,,0.0005522319907698994,10,_zinc_sulfide_production___kilogram__RoW__None_,315,656.0997312068939,2380,0.17625818121810827,0.23886882607317705,0.3133085720920651
"'market for electricity, high voltage' (kilowatt hour, UA, None)",,0.00011536779616009646,,0.00010970934561268504,10,_zinc_sulfide_production___kilogram__RoW__None_,315,656.0997312068939,2380,0.17625818121810827,0.06545386736819675,0.06224354798993796
"'market for electricity, high voltage' (kilowatt hour, CA-AB, None)",,0.0005072911552711347,,0.000523551469925277,10,_zinc_sulfide_production___kilogram__RoW__None_,315,656.0997312068939,2380,0.17625818121810827,0.2878114092436902,0.2970366914642194
"'market group for electricity, medium voltage' (kilowatt hour, RER, None)",-0.011080483698963844,0.011080483698963844,0.00403853408160563,0.0023512045376145314,10,_zinc_sulfide_production___kilogram__RoW__None_,315,656.0997312068939,2380,0.17625818121810827,6.286507453093738,1.3339548390693228
"'market for electricity, high voltage' (kilowatt hour, IN-Northern grid, None)",,0.0001847558394203932,,0.00019204765385756243,10,_zinc_sulfide_production___kilogram__RoW__None_,315,656.0997312068939,2380,0.17625818121810827,0.10482114256686312,0.10895815021483496
"'market group for electricity, medium voltage' (kilowatt hour, US, None)",,0.00516309214040843,,0.0024706305573022275,10,_zinc_sulfide_production___kilogram__RoW__None_,315,656.0997312068939,2380,0.17625818121810827,2.9292780083889736,1.4017111377343554
"'market for electricity, medium voltage' (kilowatt hour, ES, None)",-0.0049564042589531915,0.0049564042589531915,0.0037976707216552845,0.0021815649570612397,10,_zinc_sulfide_production___kilogram__RoW__None_,315,656.0997312068939,2380,0.17625818121810827,2.812013731617914,1.2377098991857247
"'market for transport, freight, lorry, unspecified' (ton kilometer, RoW, None)",,0.017933644968853902,,0.009197058412659477,10,_zinc_sulfide_production___kilogram__RoW__None_,315,656.0997312068939,2380,0.17625818121810827,10.174645423500744,5.217946962290904
"'market for electricity, high voltage' (kilowatt hour, HK, None)",,0.001170123395499173,,0.0010436343373786648,10,_zinc_sulfide_production___kilogram__RoW__None_,315,656.0997312068939,2380,0.17625818121810827,0.6638689832225262,0.5921054728729067
"'market for electricity, high voltage' (kilowatt hour, US-PR, None)",,0.0004453251695472157,,0.00022997886038848012,10,_zinc_sulfide_production___kilogram__RoW__None_,315,656.0997312068939,2380,0.17625818121810827,0.2526550350568716,0.13047840321459797
"'market for electricity, high voltage' (kilowatt hour, PT, None)",,0.0005331531672468652,,0.00032821215871005533,10,_zinc_sulfide_production___kilogram__RoW__None_,315,656.0997312068939,2380,0.17625818121810827,0.3024842101298675,0.18621102092498826
"'transport, freight, lorry, all sizes, EURO4 to generic market for transport, freight, lorry, unspecified' (ton kilometer, RER, None)",,0.0012697736860496072,,0.0011231422581207066,10,_zinc_sulfide_production___kilogram__RoW__None_,315,656.0997312068939,2380,0.17625818121810827,0.7204055308379378,0.6372142560184991
"'market for electricity, high voltage' (kilowatt hour, US-SERC, None)",,0.00011582399697780822,,0.00011649701055785699,10,_zinc_sulfide_production___kilogram__RoW__None_,315,656.0997312068939,2380,0.17625818121810827,0.0657126926973582,0.0660945266499144
"'market for electricity, medium voltage' (kilowatt hour, FR, None)",-0.0003405366612906191,0.0003405366612906191,0.0004551088903759933,0.00027561728634006936,10,_zinc_sulfide_production___kilogram__RoW__None_,315,656.0997312068939,2380,0.17625818121810827,0.19320332193217554,0.15637134369326694
"'market for electricity, high voltage' (kilowatt hour, IN-Eastern grid, None)",,0.0003133520426410818,,0.00043578000794319176,10,_zinc_sulfide_production___kilogram__RoW__None_,315,656.0997312068939,2380,0.17625818121810827,0.1777801407432706,0.2472395919052074
"'market for natural gas, high pressure' (cubic meter, AE, None)",-1.2612874250633039e-05,1.2612874250633039e-05,2.9192744670581805e-06,1.6072591938463178e-06,10,_zinc_sulfide_production___kilogram__RoW__None_,315,656.0997312068939,2380,0.17625818121810827,0.007155908544764461,0.0009118777822048652
"'market for electricity, high voltage' (kilowatt hour, VN, None)",,0.0013707081791541546,,0.0011677599610917264,10,_zinc_sulfide_production___kilogram__RoW__None_,315,656.0997312068939,2380,0.17625818121810827,0.7776706701960067,0.662528089772297
