names,mu,mu_star,sigma,mu_star_conf,trajectories,reference_product,number of variables,runtime,number of runs,score,mu_star_relative,mu_star_conf_relative
"'market for electricity, high voltage' (kilowatt hour, US-WECC, None)",,0.001564887936564007,,0.00024239424079916847,300,_iron_nickel_chromium_alloy_production___kilogram__RER__None_,281,23113.35569047928,84600,7.940533700372602,0.019707591398932998,0.00305261900453611
"'market group for electricity, high voltage' (kilowatt hour, Europe without Switzerland, None)",,0.0045947882167763,,0.0013207926057756333,300,_iron_nickel_chromium_alloy_production___kilogram__RER__None_,281,23113.35569047928,84600,7.940533700372602,0.05786497973757978,0.016633549527201887
"'market for electricity, high voltage' (kilowatt hour, CN-CSG, None)",,0.03952155507027121,,0.005707711089690659,300,_iron_nickel_chromium_alloy_production___kilogram__RER__None_,281,23113.35569047928,84600,7.940533700372602,0.49771912772584415,0.0718806985155523
"'market for electricity, medium voltage' (kilowatt hour, BE, None)",-0.006299980074365578,0.006299980074365578,0.011938752037502985,0.0014446916263636163,300,_iron_nickel_chromium_alloy_production___kilogram__RER__None_,281,23113.35569047928,84600,7.940533700372602,0.07933950427122999,0.018193885711936784
"'market group for electricity, high voltage' (kilowatt hour, BR, None)",,0.004662812450810717,,0.0007523178696824438,300,_iron_nickel_chromium_alloy_production___kilogram__RER__None_,281,23113.35569047928,84600,7.940533700372602,0.05872165054336233,0.009474399304509492
"'market for lime, hydrated, loose weight' (kilogram, RoW, None)",0.0002442576808142198,0.0002442576808142198,0.0001621891443008515,1.6242873814511815e-05,300,_iron_nickel_chromium_alloy_production___kilogram__RER__None_,281,23113.35569047928,84600,7.940533700372602,0.0030760864449546786,0.00020455644957151475
"'market for pitch' (kilogram, RoW, None)",0.0013259442501323466,0.0013259442501323466,0.0010515466285483017,0.00011564544203812164,300,_iron_nickel_chromium_alloy_production___kilogram__RER__None_,281,23113.35569047928,84600,7.940533700372602,0.016698427337070904,0.0014563938193813734
"'market for aluminium, wrought alloy' (kilogram, GLO, None)",,0.053533081732400685,,0.00784167464734006,300,_iron_nickel_chromium_alloy_production___kilogram__RER__None_,281,23113.35569047928,84600,7.940533700372602,0.6741748571621665,0.09875500744958865
"'market for electricity, high voltage' (kilowatt hour, MX, None)",,0.00793306758084915,,0.0009622756612631435,300,_iron_nickel_chromium_alloy_production___kilogram__RER__None_,281,23113.35569047928,84600,7.940533700372602,0.09990597458804185,0.012118526254954243
"'market for sand' (kilogram, RoW, None)",,0.0013883257083393361,,0.0001850635151952329,300,_iron_nickel_chromium_alloy_production___kilogram__RER__None_,281,23113.35569047928,84600,7.940533700372602,0.017484035213831912,0.0023306180941785938
"'market for electricity, high voltage' (kilowatt hour, BD, None)",,0.004958490791798379,,0.0006999403181614873,300,_iron_nickel_chromium_alloy_production___kilogram__RER__None_,281,23113.35569047928,84600,7.940533700372602,0.06244530882811701,0.008814776746412439
"'market for petroleum' (kilogram, RNA, None)",,0.030801400711058212,,0.0032757079855716504,300,_iron_nickel_chromium_alloy_production___kilogram__RER__None_,281,23113.35569047928,84600,7.940533700372602,0.3879008876898651,0.04125299519121669
"'market for transport, freight train' (ton kilometer, CN, None)",,0.06487510137546698,,0.00824769915268482,300,_iron_nickel_chromium_alloy_production___kilogram__RER__None_,281,23113.35569047928,84600,7.940533700372602,0.8170118511356834,0.10386832250706025
"'market group for concrete, medium strength' (cubic meter, GLO, None)",,0.0004205869938345346,,5.628121472377414e-05,300,_iron_nickel_chromium_alloy_production___kilogram__RER__None_,281,23113.35569047928,84600,7.940533700372602,0.005296709386357732,0.0007087837776084648
"'market for electricity, high voltage' (kilowatt hour, CN-SWG, None)",,0.014462173208184027,,0.004563680402565525,300,_iron_nickel_chromium_alloy_production___kilogram__RER__None_,281,23113.35569047928,84600,7.940533700372602,0.18213099715835732,0.05747321999718203
"'market for electricity, medium voltage' (kilowatt hour, FR, None)",-0.006007520719046092,0.006007520719046092,0.011788443917034456,0.0012936870696490747,300,_iron_nickel_chromium_alloy_production___kilogram__RER__None_,281,23113.35569047928,84600,7.940533700372602,0.07565638464281305,0.01629219292386316
"'market for natural gas, high pressure' (cubic meter, IR, None)",-0.00021513319120558774,0.00021516869800551763,0.00014619163389024308,1.7034453644821855e-05,300,_iron_nickel_chromium_alloy_production___kilogram__RER__None_,281,23113.35569047928,84600,7.940533700372602,0.0027097510838021005,0.00021452529877207788
"'market for transport, freight, lorry, unspecified' (ton kilometer, RoW, None)",,0.08457691040368383,,0.011433268980944615,300,_iron_nickel_chromium_alloy_production___kilogram__RER__None_,281,23113.35569047928,84600,7.940533700372602,1.0651287885059304,0.14398615272432028
"'market for natural gas, high pressure' (cubic meter, AE, None)",-0.00021765666564530102,0.00021765666564530102,0.00012900759089398643,1.4767330023674991e-05,300,_iron_nickel_chromium_alloy_production___kilogram__RER__None_,281,23113.35569047928,84600,7.940533700372602,0.002741083582770862,0.0001859740236727671
"'market for iron scrap, sorted, pressed' (kilogram, RER, None)",,0.018031539580234887,,0.001345376445237423,300,_iron_nickel_chromium_alloy_production___kilogram__RER__None_,281,23113.35569047928,84600,7.940533700372602,0.2270822121111176,0.01694314886132015
"'market for electricity, medium voltage' (kilowatt hour, TW, None)",0.00688478864643873,0.00688478864643873,0.006263833233069808,0.0007284022772134995,300,_iron_nickel_chromium_alloy_production___kilogram__RER__None_,281,23113.35569047928,84600,7.940533700372602,0.0867043564857066,0.009173215613697602
"'market for magnesium oxide' (kilogram, GLO, None)",-0.0038265907930518234,0.0038265907930518234,0.0015470244673146314,0.0001670284795212059,300,_iron_nickel_chromium_alloy_production___kilogram__RER__None_,281,23113.35569047928,84600,7.940533700372602,0.04819059949172263,0.002103491853618961
"'market group for diesel' (kilogram, RER, None)",0.0020504336961794213,0.0038110375576482967,0.00938709249223587,0.000911494823387857,300,_iron_nickel_chromium_alloy_production___kilogram__RER__None_,281,23113.35569047928,84600,7.940533700372602,0.047994728080676334,0.01147901208888624
"'market for aluminium oxide, metallurgical' (kilogram, RoW, None)",,0.0038410229874155885,,0.0006703780942146896,300,_iron_nickel_chromium_alloy_production___kilogram__RER__None_,281,23113.35569047928,84600,7.940533700372602,0.048372352946948034,0.008442481570013774
"'market for silica sand' (kilogram, GLO, None)",,0.006557341103410797,,0.0009327580390734328,300,_iron_nickel_chromium_alloy_production___kilogram__RER__None_,281,23113.35569047928,84600,7.940533700372602,0.08258060919888924,0.011746792775776066
"'market for building, hall, steel construction' (square meter, GLO, None)",-0.00024014035380325992,0.00024053182594083912,0.00018415596440324392,1.9738325631837036e-05,300,_iron_nickel_chromium_alloy_production___kilogram__RER__None_,281,23113.35569047928,84600,7.940533700372602,0.003029164474543473,0.0002485768133055192
"'market for natural gas, high pressure' (cubic meter, NG, None)",-0.0001686143096457503,0.00016867492263043012,0.00011955031632802876,1.390614405128827e-05,300,_iron_nickel_chromium_alloy_production___kilogram__RER__None_,281,23113.35569047928,84600,7.940533700372602,0.0021242265192138814,0.00017512858173041612
"'market for hard coal' (kilogram, CN, None)",,0.1321910317768048,,0.03971320696629843,300,_iron_nickel_chromium_alloy_production___kilogram__RER__None_,281,23113.35569047928,84600,7.940533700372602,1.664762555829237,0.500132717331518
"'market group for heat, district or industrial, other than natural gas' (megajoule, RER, None)",0.05019757891409158,0.05019757891409158,0.05586723690876917,0.007451574594967063,300,_iron_nickel_chromium_alloy_production___kilogram__RER__None_,281,23113.35569047928,84600,7.940533700372602,0.6321688290515801,0.09384223877316213
"'market group for electricity, high voltage' (kilowatt hour, RER, None)",-0.020238640004677094,0.020238640004677094,0.04287140290843648,0.00501971901548556,300,_iron_nickel_chromium_alloy_production___kilogram__RER__None_,281,23113.35569047928,84600,7.940533700372602,0.25487757836387515,0.06321639331686249
"'market for electricity, high voltage' (kilowatt hour, KW, None)",,0.0053671060580075805,,0.0006875893871438595,300,_iron_nickel_chromium_alloy_production___kilogram__RER__None_,281,23113.35569047928,84600,7.940533700372602,0.06759125092253854,0.008659233914108255
"'market for electricity, high voltage' (kilowatt hour, DE, None)",,0.0073386030123403214,,0.001129221955552247,300,_iron_nickel_chromium_alloy_production___kilogram__RER__None_,281,23113.35569047928,84600,7.940533700372602,0.09241951850158339,0.014220983099653105
"'market for goods wagon' (unit, GLO, None)",-0.0004587646173432544,0.0004590265906359844,0.00037215417978165465,4.1009727893421854e-05,300,_iron_nickel_chromium_alloy_production___kilogram__RER__None_,281,23113.35569047928,84600,7.940533700372602,0.005780802751513353,0.0005164605987566995
"'market group for electricity, medium voltage' (kilowatt hour, RLA, None)",,0.012954285075923893,,0.0012730815800097565,300,_iron_nickel_chromium_alloy_production___kilogram__RER__None_,281,23113.35569047928,84600,7.940533700372602,0.16314123917534692,0.01603269538356116
"'market for electricity, high voltage, aluminium industry' (kilowatt hour, IAI Area, Asia, without China and GCC, None)",0.003553278796579311,0.003553278796579311,0.008821016516616792,0.0010415478354919342,300,_iron_nickel_chromium_alloy_production___kilogram__RER__None_,281,23113.35569047928,84600,7.940533700372602,0.044748614270254616,0.013116849254642172
"'market for ammonium nitrate' (kilogram, RER, None)",-0.0003541233403709336,0.002950474478435241,0.006171305227897907,0.0006230071245521857,300,_iron_nickel_chromium_alloy_production___kilogram__RER__None_,281,23113.35569047928,84600,7.940533700372602,0.03715713061323312,0.007845909960975945
"'market for hard coal' (kilogram, RNA, None)",,0.1008368147018594,,0.023185593562960165,300,_iron_nickel_chromium_alloy_production___kilogram__RER__None_,281,23113.35569047928,84600,7.940533700372602,1.2698997133798164,0.29199036787504856
"'market for natural gas, high pressure' (cubic meter, US, None)",,0.005631731563542148,,0.0006223302243621117,300,_iron_nickel_chromium_alloy_production___kilogram__RER__None_,281,23113.35569047928,84600,7.940533700372602,0.07092384184803453,0.007837385342661658
"'market group for electricity, low voltage' (kilowatt hour, CN, None)",0.0003615286733872233,0.0004215837196943251,0.00048096815149652227,4.491664411603779e-05,300,_iron_nickel_chromium_alloy_production___kilogram__RER__None_,281,23113.35569047928,84600,7.940533700372602,0.005309261765044113,0.0005656627855370744
"'market for electricity, high voltage' (kilowatt hour, KZ, None)",,0.4526262923691176,,0.05268011804758097,300,_iron_nickel_chromium_alloy_production___kilogram__RER__None_,281,23113.35569047928,84600,7.940533700372602,5.70019987885548,0.6634329635186739
"'market group for electricity, medium voltage' (kilowatt hour, RAF, None)",,0.006348523476857206,,0.0006124073561762938,300,_iron_nickel_chromium_alloy_production___kilogram__RER__None_,281,23113.35569047928,84600,7.940533700372602,0.07995084104434072,0.00771242059142142
"'market for electricity, high voltage' (kilowatt hour, TR, None)",,0.006927122351139333,,0.0008584986391164202,300,_iron_nickel_chromium_alloy_production___kilogram__RER__None_,281,23113.35569047928,84600,7.940533700372602,0.08723749073458734,0.010811598709997743
"'market for n-olefins' (kilogram, GLO, None)",0.0019318272457423443,0.0019318272457423443,0.0025217943394156964,0.0002548647890904276,300,_iron_nickel_chromium_alloy_production___kilogram__RER__None_,281,23113.35569047928,84600,7.940533700372602,0.024328682663379356,0.003209668250365442
"'market for electricity, medium voltage' (kilowatt hour, US-WECC, None)",0.001960460269038421,0.001960460269038421,0.0019516706872645861,0.0002066207994125929,300,_iron_nickel_chromium_alloy_production___kilogram__RER__None_,281,23113.35569047928,84600,7.940533700372602,0.02468927584737067,0.002602102166040771
"'market for transport, freight train' (ton kilometer, RoW, None)",,0.05941566328857903,,0.005437247640994037,300,_iron_nickel_chromium_alloy_production___kilogram__RER__None_,281,23113.35569047928,84600,7.940533700372602,0.7482578064720133,0.06847458679935958
"'market for copper concentrate, sulfide ore' (kilogram, GLO, None)",,0.001453144168370284,,0.00024379159186559675,300,_iron_nickel_chromium_alloy_production___kilogram__RER__None_,281,23113.35569047928,84600,7.940533700372602,0.0183003337458551,0.003070216701607312
"'market for natural gas, high pressure' (cubic meter, PL, None)",,0.0035053152846343865,,0.0004001383773384948,300,_iron_nickel_chromium_alloy_production___kilogram__RER__None_,281,23113.35569047928,84600,7.940533700372602,0.044144580413655356,0.005039187445545615
"'market for conveyor belt' (meter, GLO, None)",-7.67771778063395e-06,1.4463865860668953e-05,1.8401832831766857e-05,1.5287831163804093e-06,300,_iron_nickel_chromium_alloy_production___kilogram__RER__None_,281,23113.35569047928,84600,7.940533700372602,0.00018215231376689768,1.925290130446361e-05
"'market for electricity, high voltage' (kilowatt hour, IN-Eastern grid, None)",,0.007173818105629356,,0.001337186581595449,300,_iron_nickel_chromium_alloy_production___kilogram__RER__None_,281,23113.35569047928,84600,7.940533700372602,0.09034428133329037,0.01684000889679119
"'market for hydrogen, liquid' (kilogram, RoW, None)",,0.011147988065069283,,0.0013375118500421038,300,_iron_nickel_chromium_alloy_production___kilogram__RER__None_,281,23113.35569047928,84600,7.940533700372602,0.14039343557658063,0.01684410520138391
"'market for electricity, high voltage' (kilowatt hour, US-MRO, None)",,0.003546783405189097,,0.000881568401747484,300,_iron_nickel_chromium_alloy_production___kilogram__RER__None_,281,23113.35569047928,84600,7.940533700372602,0.04466681383170338,0.011102130348066116
"'market for diesel, low-sulfur' (kilogram, ZA, None)",,0.008134307540254196,,0.0007107661433036416,300,_iron_nickel_chromium_alloy_production___kilogram__RER__None_,281,23113.35569047928,84600,7.940533700372602,0.1024403125431292,0.008951112987157143
"'market for aluminium, primary, ingot' (kilogram, IAI Area, EU27 & EFTA, None)",,0.004943723393241812,,0.0019197188178750278,300,_iron_nickel_chromium_alloy_production___kilogram__RER__None_,281,23113.35569047928,84600,7.940533700372602,0.0622593339413676,0.02417619382164384
"'market group for electricity, high voltage' (kilowatt hour, CN, None)",-0.0010353255965192762,0.001227210189088286,0.0020823474358369625,0.00021024980826891425,300,_iron_nickel_chromium_alloy_production___kilogram__RER__None_,281,23113.35569047928,84600,7.940533700372602,0.015455008887257798,0.0026478044952954294
"'market for transport, freight, lorry, unspecified' (ton kilometer, BR, None)",,0.002421122427750922,,0.0002997973938361266,300,_iron_nickel_chromium_alloy_production___kilogram__RER__None_,281,23113.35569047928,84600,7.940533700372602,0.030490676308537207,0.00377553203787875
"'market group for electricity, medium voltage' (kilowatt hour, RME, None)",,0.009843055893043955,,0.0011352910345515772,300,_iron_nickel_chromium_alloy_production___kilogram__RER__None_,281,23113.35569047928,84600,7.940533700372602,0.12395962619719225,0.014297414725389363
"'market for nickel-rich materials' (kilogram, GLO, None)",-0.30370524640860397,0.30370524640860397,0.5838342625088089,0.060451490339692826,300,_iron_nickel_chromium_alloy_production___kilogram__RER__None_,281,23113.35569047928,84600,7.940533700372602,3.8247460166859173,0.7613026103882186
"'market for electricity, high voltage' (kilowatt hour, US-NPCC, None)",,0.004256459109470757,,0.0014784868802092154,300,_iron_nickel_chromium_alloy_production___kilogram__RER__None_,281,23113.35569047928,84600,7.940533700372602,0.05360419425297605,0.018619490024201255
"'market for titanium dioxide' (kilogram, RoW, None)",-0.0006546697053185124,0.0006618247678321463,0.0005138566559479032,5.7218508615339434e-05,300,_iron_nickel_chromium_alloy_production___kilogram__RER__None_,281,23113.35569047928,84600,7.940533700372602,0.008334764296776308,0.0007205876931503296
"'market for electricity, high voltage' (kilowatt hour, BR-South-eastern/Mid-western grid, None)",,0.002493704249624415,,0.0004465221716348187,300,_iron_nickel_chromium_alloy_production___kilogram__RER__None_,281,23113.35569047928,84600,7.940533700372602,0.03140474360693665,0.005623326951107405
"'market for electricity, high voltage' (kilowatt hour, CN-ECGC, None)",,0.0075800927067885505,,0.0019783394638685724,300,_iron_nickel_chromium_alloy_production___kilogram__RER__None_,281,23113.35569047928,84600,7.940533700372602,0.0954607460003962,0.0249144394888185
"'market for electricity, high voltage' (kilowatt hour, NL, None)",,0.006089566449540353,,0.0010911495158832797,300,_iron_nickel_chromium_alloy_production___kilogram__RER__None_,281,23113.35569047928,84600,7.940533700372602,0.07668963673379545,0.013741513568944095
"'market for electricity, high voltage' (kilowatt hour, ZA, None)",,1.4589329211832038,,0.33390313789830806,300,_iron_nickel_chromium_alloy_production___kilogram__RER__None_,281,23113.35569047928,84600,7.940533700372602,18.373235052383755,4.20504654344128
"'market for naphtha' (kilogram, RER, None)",0.0009682236809399055,0.0013287088881247045,0.0017568594305643695,0.00015864133269612824,300,_iron_nickel_chromium_alloy_production___kilogram__RER__None_,281,23113.35569047928,84600,7.940533700372602,0.016733244115094633,0.001997867381240182
"'market for electricity, high voltage' (kilowatt hour, IQ, None)",,0.007033410125100108,,0.001223696145294542,300,_iron_nickel_chromium_alloy_production___kilogram__RER__None_,281,23113.35569047928,84600,7.940533700372602,0.08857603771356165,0.01541075438338762
"'market for transport, freight, lorry, unspecified' (ton kilometer, RER, None)",,0.027755944423956014,,0.0035880924650916503,300,_iron_nickel_chromium_alloy_production___kilogram__RER__None_,281,23113.35569047928,84600,7.940533700372602,0.34954759303714805,0.04518704410162357
"'market for electricity, high voltage' (kilowatt hour, IN-Northern grid, None)",,0.005257870527258266,,0.0008647914056021384,300,_iron_nickel_chromium_alloy_production___kilogram__RER__None_,281,23113.35569047928,84600,7.940533700372602,0.0662155810384829,0.01089084736913287
"'market for natural gas, high pressure' (cubic meter, RU, None)",-0.0005502123813842422,0.0005502123813842422,0.0005540953299752393,6.302185484779713e-05,300,_iron_nickel_chromium_alloy_production___kilogram__RER__None_,281,23113.35569047928,84600,7.940533700372602,0.006929161214420941,0.0007936727835414878
"'market for hard coal' (kilogram, Europe, without Russia and Turkey, None)",,0.019264333020284057,,0.0028278674643079545,300,_iron_nickel_chromium_alloy_production___kilogram__RER__None_,281,23113.35569047928,84600,7.940533700372602,0.24260753429432705,0.03561306545648511
"'transport, freight, lorry, all sizes, EURO3 to generic market for transport, freight, lorry, unspecified' (ton kilometer, RoW, None)",,0.03269856473388551,,0.00683682306549263,300,_iron_nickel_chromium_alloy_production___kilogram__RER__None_,281,23113.35569047928,84600,7.940533700372602,0.41179303517534543,0.08610029657290943
"'market for electricity, high voltage' (kilowatt hour, RU, None)",,0.11033642298296527,,0.012256303488428974,300,_iron_nickel_chromium_alloy_production___kilogram__RER__None_,281,23113.35569047928,84600,7.940533700372602,1.3895340936313618,0.15435112992283956
"'market for oxygen, liquid' (kilogram, RoW, None)",-0.008359259123472998,0.008359259123472998,0.005106867870992099,0.0005736672389919378,300,_iron_nickel_chromium_alloy_production___kilogram__RER__None_,281,23113.35569047928,84600,7.940533700372602,0.10527326548693759,0.007224542589184139
"'market for electricity, high voltage' (kilowatt hour, IN-Western grid, None)",,0.004675219137325854,,0.000867819920154767,300,_iron_nickel_chromium_alloy_production___kilogram__RER__None_,281,23113.35569047928,84600,7.940533700372602,0.05887789553876554,0.010928987306156076
"'market group for heat, district or industrial, natural gas' (megajoule, RER, None)",-0.005835667154051123,0.005994454530629784,0.009111163397399593,0.000978826790312974,300,_iron_nickel_chromium_alloy_production___kilogram__RER__None_,281,23113.35569047928,84600,7.940533700372602,0.07549183413639438,0.0123269647513371
"'market for electricity, high voltage' (kilowatt hour, ID, None)",,0.01252723872081674,,0.0014233671812089416,300,_iron_nickel_chromium_alloy_production___kilogram__RER__None_,281,23113.35569047928,84600,7.940533700372602,0.15776318309975704,0.017925333924873985
"'market for iron ore concentrate' (kilogram, GLO, None)",,0.002401148473645112,,0.0003011051192456313,300,_iron_nickel_chromium_alloy_production___kilogram__RER__None_,281,23113.35569047928,84600,7.940533700372602,0.030239132081669024,0.003792001024207003
"'market group for natural gas, high pressure' (cubic meter, GLO, None)",,0.002716648488683762,,0.00040537564379322763,300,_iron_nickel_chromium_alloy_production___kilogram__RER__None_,281,23113.35569047928,84600,7.940533700372602,0.03421241683737563,0.005105143546890378
"'market for electricity, high voltage' (kilowatt hour, HK, None)",,0.004849579250881816,,0.0007311109933809134,300,_iron_nickel_chromium_alloy_production___kilogram__RER__None_,281,23113.35569047928,84600,7.940533700372602,0.06107371914628678,0.009207328133959141
"'transport, freight, lorry, all sizes, EURO4 to generic market for transport, freight, lorry, unspecified' (ton kilometer, RER, None)",,0.015013106214725838,,0.0026675579991175696,300,_iron_nickel_chromium_alloy_production___kilogram__RER__None_,281,23113.35569047928,84600,7.940533700372602,0.18906923364636513,0.03359419026195175
"'market group for electricity, medium voltage' (kilowatt hour, CN, None)",0.04085838716970069,0.04999451540383822,0.06106110957656334,0.006364845863595308,300,_iron_nickel_chromium_alloy_production___kilogram__RER__None_,281,23113.35569047928,84600,7.940533700372602,0.6296115260047607,0.08015639884881598
"'market for electricity, high voltage' (kilowatt hour, DZ, None)",,0.00129821932289813,,0.00023197394970666616,300,_iron_nickel_chromium_alloy_production___kilogram__RER__None_,281,23113.35569047928,84600,7.940533700372602,0.016349270362484732,0.002921389902240211
"'market for electricity, medium voltage' (kilowatt hour, US-RFC, None)",-0.007114192947753072,0.007114192947753072,0.013376612352318606,0.0014345434495573659,300,_iron_nickel_chromium_alloy_production___kilogram__RER__None_,281,23113.35569047928,84600,7.940533700372602,0.08959338523327777,0.018066083511364624
"'market for electricity, high voltage' (kilowatt hour, AU, None)",,0.03934084420257821,,0.0058108246795436375,300,_iron_nickel_chromium_alloy_production___kilogram__RER__None_,281,23113.35569047928,84600,7.940533700372602,0.4954433251852099,0.0731792710516545
"'market for waste reinforced concrete' (kilogram, RoW, None)",,0.002148732410885971,,0.0002553614451678796,300,_iron_nickel_chromium_alloy_production___kilogram__RER__None_,281,23113.35569047928,84600,7.940533700372602,0.02706030214046121,0.003215922944271328
"'market for wood chips, dry, measured as dry mass' (kilogram, RoW, None)",,0.000532876614181538,,6.550540495681276e-05,300,_iron_nickel_chromium_alloy_production___kilogram__RER__None_,281,23113.35569047928,84600,7.940533700372602,0.006710841289629352,0.0008249496498420374
"'market group for transport, freight train' (ton kilometer, GLO, None)",,0.018472247556326437,,0.0018124447301956178,300,_iron_nickel_chromium_alloy_production___kilogram__RER__None_,281,23113.35569047928,84600,7.940533700372602,0.2326323173398237,0.022825225590448292
"'market for cast iron' (kilogram, GLO, None)",0.0013671626458144192,0.0014414388992614658,0.0011563193853722554,0.00011955650827938171,300,_iron_nickel_chromium_alloy_production___kilogram__RER__None_,281,23113.35569047928,84600,7.940533700372602,0.018152922129073358,0.0015056482698860864
"'market for electronics, for control units' (kilogram, GLO, None)",-2.155811440133448e-05,2.1871949806007263e-05,1.9023938060438606e-05,2.044950578552522e-06,300,_iron_nickel_chromium_alloy_production___kilogram__RER__None_,281,23113.35569047928,84600,7.940533700372602,0.0002754468481757208,2.575331401787974e-05
"'market for sulfuric acid' (kilogram, RER, None)",-0.0006990102460706556,0.0008157175079879231,0.0009161865204817887,8.982874560651318e-05,300,_iron_nickel_chromium_alloy_production___kilogram__RER__None_,281,23113.35569047928,84600,7.940533700372602,0.010272829746313479,0.0011312683630106382
"'market for electricity, high voltage' (kilowatt hour, AE, None)",,0.004570225262240796,,0.000699568492343282,300,_iron_nickel_chromium_alloy_production___kilogram__RER__None_,281,23113.35569047928,84600,7.940533700372602,0.0575556434201185,0.008810094116349578
"'market for spent nuclear fuel' (kilogram, GLO, None)",,0.0020534725207866566,,0.0003129751846092763,300,_iron_nickel_chromium_alloy_production___kilogram__RER__None_,281,23113.35569047928,84600,7.940533700372602,0.02586063605133115,0.003941488021070803
