names,mu_star,mu_star_conf,reference_product,score,mu_star_local_relative,mu_star_local_relative_conf
"'market for electricity, high voltage' (kilowatt hour, IR, None)",0.1349627136497844,0.04157114331392762,_market_for_photovoltaics__electric_installation_for_3kWp_module__at_building___unit__GLO__None_,209.37829053826175,0.06445879049963937,0.019854562384217633
"'market for hydrogen cyanide' (kilogram, RoW, None)",1.4005693651903286,1.0925403407077082e-05,_market_for_photovoltaics__electric_installation_for_3kWp_module__at_building___unit__GLO__None_,209.37829053826175,0.6689181393112906,5.218021113359208e-06
"'market for electricity, high voltage' (kilowatt hour, BD, None)",0.25008691186939275,0.0800599006304064,_market_for_photovoltaics__electric_installation_for_3kWp_module__at_building___unit__GLO__None_,209.37829053826175,0.1194426180605825,0.03823696354793587
"'market for bisphenol A, powder' (kilogram, GLO, None)",0.008248190569145209,2.1497124255175557e-07,_market_for_photovoltaics__electric_installation_for_3kWp_module__at_building___unit__GLO__None_,209.37829053826175,0.003939372390490473,1.026712186822787e-07
"'market for carbon monoxide' (kilogram, RoW, None)",0.024143128254033287,5.877521403798396e-07,_market_for_photovoltaics__electric_installation_for_3kWp_module__at_building___unit__GLO__None_,209.37829053826175,0.011530865111166515,2.807130284944388e-07
"'market for electricity, high voltage' (kilowatt hour, IQ, None)",0.11311619038871897,0.02248034252569318,_market_for_photovoltaics__electric_installation_for_3kWp_module__at_building___unit__GLO__None_,209.37829053826175,0.05402479411687055,0.010736711274077923
"'market group for electricity, medium voltage' (kilowatt hour, CN, None)",0.2605996280867828,1.2920182936324285e-05,_market_for_photovoltaics__electric_installation_for_3kWp_module__at_building___unit__GLO__None_,209.37829053826175,0.12446353794218262,6.17073666190968e-06
"'market for electricity, medium voltage' (kilowatt hour, IT, None)",0.21954592150130736,5.267057159190654e-06,_market_for_photovoltaics__electric_installation_for_3kWp_module__at_building___unit__GLO__None_,209.37829053826175,0.10485610563392558,2.5155698547592035e-06
"'market for electricity, high voltage' (kilowatt hour, BY, None)",0.15597564517838552,0.07320392666193432,_market_for_photovoltaics__electric_installation_for_3kWp_module__at_building___unit__GLO__None_,209.37829053826175,0.07449465977461621,0.03496251997938489
"'market for electricity, high voltage' (kilowatt hour, RU, None)",1.322207283508958,0.7862395792262479,_market_for_photovoltaics__electric_installation_for_3kWp_module__at_building___unit__GLO__None_,209.37829053826175,0.6314920616219942,0.3755115094334819
"'market group for electricity, medium voltage' (kilowatt hour, US, None)",0.5541884257034638,0.19718926149429128,_market_for_photovoltaics__electric_installation_for_3kWp_module__at_building___unit__GLO__None_,209.37829053826175,0.2646828495345804,0.09417846567920896
"'market group for heat, district or industrial, natural gas' (megajoule, GLO, None)",0.34879546810936973,0.2462890616343712,_market_for_photovoltaics__electric_installation_for_3kWp_module__at_building___unit__GLO__None_,209.37829053826175,0.1665862622207391,0.11762874794766001
"'market for aluminium oxide, metallurgical' (kilogram, RoW, None)",2.4648717269840645,1.2007846339325297,_market_for_photovoltaics__electric_installation_for_3kWp_module__at_building___unit__GLO__None_,209.37829053826175,1.177233666703203,0.5735000657640285
"'market for cast iron' (kilogram, GLO, None)",0.027600362687113033,4.036604610623873e-07,_market_for_photovoltaics__electric_installation_for_3kWp_module__at_building___unit__GLO__None_,209.37829053826175,0.013182055606700709,1.9279002614104465e-07
"'market for electricity, high voltage' (kilowatt hour, JP, None)",0.16428108478077802,0.04060902338150536,_market_for_photovoltaics__electric_installation_for_3kWp_module__at_building___unit__GLO__None_,209.37829053826175,0.078461374557243,0.01939504963819756
"'market for electricity, medium voltage' (kilowatt hour, US-NPCC, None)",0.15891052450074739,4.331432765491294e-06,_market_for_photovoltaics__electric_installation_for_3kWp_module__at_building___unit__GLO__None_,209.37829053826175,0.0758963711530103,2.0687114955214374e-06
"'market for electricity, high voltage' (kilowatt hour, BR-North-eastern grid, None)",0.03211675686004013,0.019117132121883547,_market_for_photovoltaics__electric_installation_for_3kWp_module__at_building___unit__GLO__None_,209.37829053826175,0.01533910549058147,0.009130427071850643
"'market for steel, chromium steel 18/8' (kilogram, GLO, None)",0.060508465966454136,4.124870968014637e-07,_market_for_photovoltaics__electric_installation_for_3kWp_module__at_building___unit__GLO__None_,209.37829053826175,0.028899111656180435,1.9700566650967374e-07
"'market for electricity, high voltage' (kilowatt hour, US-WECC, None)",0.15496940946158588,0.06827564075067737,_market_for_photovoltaics__electric_installation_for_3kWp_module__at_building___unit__GLO__None_,209.37829053826175,0.07401407713435638,0.032608748774840476
"'market for electricity, medium voltage' (kilowatt hour, US-MRO, None)",0.27874068650711764,8.36331397066655e-06,_market_for_photovoltaics__electric_installation_for_3kWp_module__at_building___unit__GLO__None_,209.37829053826175,0.13312778788600368,3.99435583754479e-06
"'market for electricity, high voltage' (kilowatt hour, LY, None)",0.02223954425991508,0.007351982444997056,_market_for_photovoltaics__electric_installation_for_3kWp_module__at_building___unit__GLO__None_,209.37829053826175,0.010621704954578865,0.0035113394163725662
"'market group for electricity, high voltage' (kilowatt hour, IN, None)",0.03585489846965828,0.014540421684902672,_market_for_photovoltaics__electric_installation_for_3kWp_module__at_building___unit__GLO__None_,209.37829053826175,0.0171244584992474,0.006944569872799471
"'market for electricity, medium voltage' (kilowatt hour, ES, None)",1.2091047778927133,4.588487896925277e-05,_market_for_photovoltaics__electric_installation_for_3kWp_module__at_building___unit__GLO__None_,209.37829053826175,0.5774738034131393,2.1914821661450034e-05
"'market for electricity, high voltage' (kilowatt hour, ZM, None)",0.13916545583775958,0.0530397764726957,_market_for_photovoltaics__electric_installation_for_3kWp_module__at_building___unit__GLO__None_,209.37829053826175,0.06646603880469093,0.025332032435809396
"'market for titanium dioxide' (kilogram, RoW, None)",0.01680697137288405,2.446618560778852e-07,_market_for_photovoltaics__electric_installation_for_3kWp_module__at_building___unit__GLO__None_,209.37829053826175,0.00802708405426242,1.1685158735842086e-07
"'market for ferronickel' (kilogram, GLO, None)",0.02406529050638113,8.42346186161229e-06,_market_for_photovoltaics__electric_installation_for_3kWp_module__at_building___unit__GLO__None_,209.37829053826175,0.011493689457734609,4.023082736972193e-06
"'market for heat, district or industrial, other than natural gas' (megajoule, RoW, None)",0.18826032272998106,0.0695750829904972,_market_for_photovoltaics__electric_installation_for_3kWp_module__at_building___unit__GLO__None_,209.37829053826175,0.08991396493208946,0.03322936815065029
"'market for phenol' (kilogram, RoW, None)",0.12669253381804707,0.004407188659626769,_market_for_photovoltaics__electric_installation_for_3kWp_module__at_building___unit__GLO__None_,209.37829053826175,0.06050891593982868,0.0021048928464822863
"'market group for electricity, medium voltage' (kilowatt hour, RNA, None)",0.927433641221846,4.59082348856352e-05,_market_for_photovoltaics__electric_installation_for_3kWp_module__at_building___unit__GLO__None_,209.37829053826175,0.4429464195345348,2.1925976550680616e-05
"'market group for electricity, high voltage' (kilowatt hour, RAF, None)",0.09958613879151419,0.0604893055862621,_market_for_photovoltaics__electric_installation_for_3kWp_module__at_building___unit__GLO__None_,209.37829053826175,0.0475627814782048,0.028889960573638507
"'market for ammonium nitrate' (kilogram, RER, None)",0.011075101422423472,6.122605368744507e-08,_market_for_photovoltaics__electric_installation_for_3kWp_module__at_building___unit__GLO__None_,209.37829053826175,0.005289517549289385,2.924183473370017e-08
"'market for natural gas, high pressure' (cubic meter, RU, None)",0.00013136583740163131,2.0614979582935013e-14,_market_for_photovoltaics__electric_installation_for_3kWp_module__at_building___unit__GLO__None_,209.37829053826175,6.274090645401727e-05,9.845805661102117e-15
"'market for electricity, high voltage' (kilowatt hour, US-SERC, None)",0.17179145679879326,0.0880153569423227,_market_for_photovoltaics__electric_installation_for_3kWp_module__at_building___unit__GLO__None_,209.37829053826175,0.08204836153603046,0.0420365247591124
"'market for cumene' (kilogram, GLO, None)",0.026046180978808307,5.240450999196778e-07,_market_for_photovoltaics__electric_installation_for_3kWp_module__at_building___unit__GLO__None_,209.37829053826175,0.012439771531160073,2.5028626347673513e-07
"'market for electricity, high voltage' (kilowatt hour, VE, None)",0.07207822908532222,0.026329347944084997,_market_for_photovoltaics__electric_installation_for_3kWp_module__at_building___unit__GLO__None_,209.37829053826175,0.03442488182515305,0.012575013329413718
"'market group for electricity, medium voltage' (kilowatt hour, RAS, None)",1.1788848897709368,0.44123532223944667,_market_for_photovoltaics__electric_installation_for_3kWp_module__at_building___unit__GLO__None_,209.37829053826175,0.5630406508431721,0.2107359464561181
"'market group for electricity, high voltage' (kilowatt hour, BR, None)",0.04477064753334048,0.014418862423279189,_market_for_photovoltaics__electric_installation_for_3kWp_module__at_building___unit__GLO__None_,209.37829053826175,0.02138265978686033,0.006886512630422058
"'market group for electricity, high voltage' (kilowatt hour, Europe without Switzerland, None)",0.07110603571954499,0.02311600307161508,_market_for_photovoltaics__electric_installation_for_3kWp_module__at_building___unit__GLO__None_,209.37829053826175,0.033960557962694364,0.01104030556949784
"'market for electricity, high voltage, aluminium industry' (kilowatt hour, CN, None)",1.9736000233073754,7.483955303440229e-06,_market_for_photovoltaics__electric_installation_for_3kWp_module__at_building___unit__GLO__None_,209.37829053826175,0.9426001225980589,3.5743702387677162e-06
"'market for electricity, high voltage' (kilowatt hour, RO, None)",0.11591604822083212,0.06375496559978391,_market_for_photovoltaics__electric_installation_for_3kWp_module__at_building___unit__GLO__None_,209.37829053826175,0.055362018632800734,0.030449654276899996
"'market for polyvinylchloride, emulsion polymerised' (kilogram, GLO, None)",0.08590610777433483,2.36253638513745e-08,_market_for_photovoltaics__electric_installation_for_3kWp_module__at_building___unit__GLO__None_,209.37829053826175,0.041029138003510615,1.128357853655186e-08
"'market for aluminium, primary, ingot' (kilogram, RoW, None)",2.499851623292994,1.060256748964898,_market_for_photovoltaics__electric_installation_for_3kWp_module__at_building___unit__GLO__None_,209.37829053826175,1.1939402202904945,0.506383324765538
"'market group for electricity, low voltage' (kilowatt hour, CN, None)",0.020022714845998733,2.573141364762324e-09,_market_for_photovoltaics__electric_installation_for_3kWp_module__at_building___unit__GLO__None_,209.37829053826175,0.009562937396482271,1.2289437258024171e-09
"'market for heat, district or industrial, natural gas' (megajoule, RoW, None)",0.2366494748279948,0.13511663996553872,_market_for_photovoltaics__electric_installation_for_3kWp_module__at_building___unit__GLO__None_,209.37829053826175,0.11302483854444763,0.06453230639059379
"'market for electricity, high voltage' (kilowatt hour, UA, None)",0.22371638785747905,0.07811797318008633,_market_for_photovoltaics__electric_installation_for_3kWp_module__at_building___unit__GLO__None_,209.37829053826175,0.10684793885858819,0.03730949038664114
"'market for electricity, high voltage' (kilowatt hour, US-MRO, None)",0.10876604949183388,0.054875110926872396,_market_for_photovoltaics__electric_installation_for_3kWp_module__at_building___unit__GLO__None_,209.37829053826175,0.05194714753483862,0.0262085963094844
"'market group for electricity, high voltage' (kilowatt hour, CN, None)",0.04889387957656481,1.609867023174566e-07,_market_for_photovoltaics__electric_installation_for_3kWp_module__at_building___unit__GLO__None_,209.37829053826175,0.02335193369420979,7.688796288459424e-08
"'market for electricity, high voltage' (kilowatt hour, ID, None)",0.3699974113264687,0.16120969955988446,_market_for_photovoltaics__electric_installation_for_3kWp_module__at_building___unit__GLO__None_,209.37829053826175,0.17671240431627053,0.07699446735640676
"'market for electricity, high voltage' (kilowatt hour, SA, None)",0.09818675000386037,0.01563654074988014,_market_for_photovoltaics__electric_installation_for_3kWp_module__at_building___unit__GLO__None_,209.37829053826175,0.046894427187959935,0.0074680811987156434
"'market for aluminium, wrought alloy' (kilogram, GLO, None)",1.0342656292737018,0.5161386926942608,_market_for_photovoltaics__electric_installation_for_3kWp_module__at_building___unit__GLO__None_,209.37829053826175,0.493969850749498,0.24651012832676736
"'market for pig iron' (kilogram, RoW, None)",0.3424023604378788,0.06913390101506763,_market_for_photovoltaics__electric_installation_for_3kWp_module__at_building___unit__GLO__None_,209.37829053826175,0.1635328856480984,0.03301865768286713
"'market for electricity, high voltage' (kilowatt hour, HK, None)",0.21672556961773354,0.08172672489810491,_market_for_photovoltaics__electric_installation_for_3kWp_module__at_building___unit__GLO__None_,209.37829053826175,0.10350909306814172,0.03903304620932999
"'market for electricity, high voltage' (kilowatt hour, KW, None)",0.053068319890304846,0.02605730198531794,_market_for_photovoltaics__electric_installation_for_3kWp_module__at_building___unit__GLO__None_,209.37829053826175,0.025345664898628616,0.012445082973182567
"'market group for electricity, medium voltage' (kilowatt hour, BR, None)",0.06554497683311666,0.020812978568566825,_market_for_photovoltaics__electric_installation_for_3kWp_module__at_building___unit__GLO__None_,209.37829053826175,0.03130457157932474,0.009940370854619938
"'market for oxygen, liquid' (kilogram, RoW, None)",0.6933606740426029,1.389855345362065e-05,_market_for_photovoltaics__electric_installation_for_3kWp_module__at_building___unit__GLO__None_,209.37829053826175,0.33115213246804986,6.638010759325037e-06
"'market for electricity, high voltage' (kilowatt hour, GB, None)",0.5804456748563978,0.726114382708036,_market_for_photovoltaics__electric_installation_for_3kWp_module__at_building___unit__GLO__None_,209.37829053826175,0.27722342816163514,0.34679544896530046
"'market for copper, cathode' (kilogram, GLO, None)",49.71443532503043,24.93612954927561,_market_for_photovoltaics__electric_installation_for_3kWp_module__at_building___unit__GLO__None_,209.37829053826175,23.743834758238997,11.90960604615252
"'market for polyvinylchloride, suspension polymerised' (kilogram, GLO, None)",0.4521316537708827,4.880284899722374e-07,_market_for_photovoltaics__electric_installation_for_3kWp_module__at_building___unit__GLO__None_,209.37829053826175,0.21594008271275875,2.3308457085862737e-07
"'market for steel, low-alloyed' (kilogram, GLO, None)",1.2789970235084824,0.6313263285511758,_market_for_photovoltaics__electric_installation_for_3kWp_module__at_building___unit__GLO__None_,209.37829053826175,0.6108546498400027,0.30152425398458743
"'market for acetone, liquid' (kilogram, RoW, None)",0.11340034516137791,0.03450396027347232,_market_for_photovoltaics__electric_installation_for_3kWp_module__at_building___unit__GLO__None_,209.37829053826175,0.054160507696310166,0.016479244426330374
"'market group for electricity, medium voltage' (kilowatt hour, GLO, None)",0.49945478252756026,0.15256215848462001,_market_for_photovoltaics__electric_installation_for_3kWp_module__at_building___unit__GLO__None_,209.37829053826175,0.2385418188502642,0.07286436339336759
"'market for aluminium, primary, ingot' (kilogram, IAI Area, EU27 & EFTA, None)",0.5180165941574529,0.22111961961327117,_market_for_photovoltaics__electric_installation_for_3kWp_module__at_building___unit__GLO__None_,209.37829053826175,0.24740702239270151,0.10560771083039472
"'market group for heat, district or industrial, other than natural gas' (megajoule, RER, None)",1.1662804688320834,5.093631263929657e-05,_market_for_photovoltaics__electric_installation_for_3kWp_module__at_building___unit__GLO__None_,209.37829053826175,0.5570207235114271,2.43274087816609e-05
"'market for electricity, high voltage' (kilowatt hour, AT, None)",0.14744895503866495,0.07537581555655158,_market_for_photovoltaics__electric_installation_for_3kWp_module__at_building___unit__GLO__None_,209.37829053826175,0.07042227475427791,0.03599982374618605
"'market for electricity, high voltage' (kilowatt hour, FR, None)",0.1412580307376913,0.07643713404422167,_market_for_photovoltaics__electric_installation_for_3kWp_module__at_building___unit__GLO__None_,209.37829053826175,0.06746546185593097,0.03650671416206522
"'market for electricity, high voltage' (kilowatt hour, MY, None)",0.213111977643932,0.07148514568107596,_market_for_photovoltaics__electric_installation_for_3kWp_module__at_building___unit__GLO__None_,209.37829053826175,0.10178322551782795,0.034141622561395774
"'market for steel, low-alloyed, hot rolled' (kilogram, GLO, None)",0.016435198146139383,2.219355613307655e-07,_market_for_photovoltaics__electric_installation_for_3kWp_module__at_building___unit__GLO__None_,209.37829053826175,0.00784952351262798,1.059974082127722e-07
"'market for electricity, high voltage' (kilowatt hour, CA-AB, None)",0.10916659109395542,0.04637994799538354,_market_for_photovoltaics__electric_installation_for_3kWp_module__at_building___unit__GLO__None_,209.37829053826175,0.05213844798011967,0.02215126882359758
"'market for electricity, high voltage' (kilowatt hour, PL, None)",0.35727405849344945,0.21379043925131386,_market_for_photovoltaics__electric_installation_for_3kWp_module__at_building___unit__GLO__None_,209.37829053826175,0.17063567458449627,0.10210726178999241
"'market group for electricity, high voltage' (kilowatt hour, RME, None)",0.045852281415133686,0.010029705155490825,_market_for_photovoltaics__electric_installation_for_3kWp_module__at_building___unit__GLO__None_,209.37829053826175,0.02189925292505655,0.004790231656637773
"'market group for electricity, medium voltage' (kilowatt hour, RER, None)",7.38015576886402,0.0019382321583847624,_market_for_photovoltaics__electric_installation_for_3kWp_module__at_building___unit__GLO__None_,209.37829053826175,3.5247951207794253,0.0009257082734805164
"'market for electricity, high voltage' (kilowatt hour, ZA, None)",7.8064207234305965,3.023834058594557,_market_for_photovoltaics__electric_installation_for_3kWp_module__at_building___unit__GLO__None_,209.37829053826175,3.7283811532523963,1.4441965548677465
"'market for electricity, high voltage' (kilowatt hour, IL, None)",0.11544000143392452,0.04699788859815855,_market_for_photovoltaics__electric_installation_for_3kWp_module__at_building___unit__GLO__None_,209.37829053826175,0.055134656576455825,0.022446399995595608
"'market for electricity, high voltage, aluminium industry' (kilowatt hour, RoW, None)",0.604128399853677,7.042650872785652e-07,_market_for_photovoltaics__electric_installation_for_3kWp_module__at_building___unit__GLO__None_,209.37829053826175,0.28853440263582564,3.3636012858260865e-07
"'market for hydrochloric acid, without water, in 30% solution state' (kilogram, RoW, None)",0.08253459065801537,0.024631786569166092,_market_for_photovoltaics__electric_installation_for_3kWp_module__at_building___unit__GLO__None_,209.37829053826175,0.039418886478554474,0.011764250489314643
"'market for electricity, high voltage' (kilowatt hour, CN-NECG, None)",0.07675643283113658,0.02831587193540912,_market_for_photovoltaics__electric_installation_for_3kWp_module__at_building___unit__GLO__None_,209.37829053826175,0.03665921267855137,0.013523785996444881
"'market for zinc' (kilogram, GLO, None)",0.0917395612424187,0.014697527258671142,_market_for_photovoltaics__electric_installation_for_3kWp_module__at_building___unit__GLO__None_,209.37829053826175,0.04381522124694882,0.007019604191479115
"'market for ethylene dichloride' (kilogram, RoW, None)",0.15643743802884275,2.1302594155096153e-06,_market_for_photovoltaics__electric_installation_for_3kWp_module__at_building___unit__GLO__None_,209.37829053826175,0.07471521408770668,1.0174213429831839e-06
"'market for styrene' (kilogram, GLO, None)",0.0006315975568170984,2.0216208816366906e-07,_market_for_photovoltaics__electric_installation_for_3kWp_module__at_building___unit__GLO__None_,209.37829053826175,0.00030165379380709024,9.655350974733743e-08
"'market for wire drawing, copper' (kilogram, GLO, None)",1.005715335336393,1.31332814061738e-07,_market_for_photovoltaics__electric_installation_for_3kWp_module__at_building___unit__GLO__None_,209.37829053826175,0.4803341037654564,6.272513436044997e-08
"'market for electricity, high voltage' (kilowatt hour, ES, None)",0.49430084378428485,0.20470574739230613,_market_for_photovoltaics__electric_installation_for_3kWp_module__at_building___unit__GLO__None_,209.37829053826175,0.2360802748525432,0.09776837267419482
"'market for electricity, high voltage' (kilowatt hour, CN-NWG, None)",0.09032252822707103,0.038629270245907114,_market_for_photovoltaics__electric_installation_for_3kWp_module__at_building___unit__GLO__None_,209.37829053826175,0.04313843999531819,0.018449510761884842
"'market group for electricity, high voltage' (kilowatt hour, CA, None)",0.22337675594680917,6.274952606983693e-06,_market_for_photovoltaics__electric_installation_for_3kWp_module__at_building___unit__GLO__None_,209.37829053826175,0.1066857291520342,2.996945189901151e-06
"'market group for natural gas, high pressure' (cubic meter, Europe without Switzerland, None)",0.08977815003742368,0.04385512682440514,_market_for_photovoltaics__electric_installation_for_3kWp_module__at_building___unit__GLO__None_,209.37829053826175,0.0428784425580252,0.020945403036610934
"'market for heat, district or industrial, other than natural gas' (megajoule, Europe without Switzerland, None)",0.1424794596032101,0.04988841078477564,_market_for_photovoltaics__electric_installation_for_3kWp_module__at_building___unit__GLO__None_,209.37829053826175,0.0680488216982426,0.023826926209266686
"'market group for electricity, medium voltage' (kilowatt hour, Europe without Switzerland, None)",0.846259526224479,0.40423752054651735,_market_for_photovoltaics__electric_installation_for_3kWp_module__at_building___unit__GLO__None_,209.37829053826175,0.4041773022642162,0.19306563230950013
"'market for electricity, high voltage' (kilowatt hour, DZ, None)",0.044380222171339766,0.02161503576676302,_market_for_photovoltaics__electric_installation_for_3kWp_module__at_building___unit__GLO__None_,209.37829053826175,0.021196190902719084,0.010323436929012988
"'market for electricity, high voltage' (kilowatt hour, US-PR, None)",0.34101413354518967,0.10520609343731928,_market_for_photovoltaics__electric_installation_for_3kWp_module__at_building___unit__GLO__None_,209.37829053826175,0.16286986232838346,0.0502468967374122
"'market for electricity, high voltage' (kilowatt hour, KZ, None)",0.5961008557870769,0.2402402896573775,_market_for_photovoltaics__electric_installation_for_3kWp_module__at_building___unit__GLO__None_,209.37829053826175,0.28470041199335594,0.11473982762958707
"'market group for electricity, medium voltage' (kilowatt hour, RLA, None)",0.26760839053988406,0.09158956636166721,_market_for_photovoltaics__electric_installation_for_3kWp_module__at_building___unit__GLO__None_,209.37829053826175,0.1278109539684972,0.04374358302678479
"'market for electricity, high voltage' (kilowatt hour, HU, None)",0.08622927839771254,0.034187902849739674,_market_for_photovoltaics__electric_installation_for_3kWp_module__at_building___unit__GLO__None_,209.37829053826175,0.041183485726260155,0.01632829399927314
"'market group for electricity, high voltage' (kilowatt hour, CN-SGCC, None)",0.02171021921318328,0.006246995468743285,_market_for_photovoltaics__electric_installation_for_3kWp_module__at_building___unit__GLO__None_,209.37829053826175,0.010368896965091974,0.0029835927367081595
"'market for sodium hydroxide, without water, in 50% solution state' (kilogram, GLO, None)",0.33928751561801107,0.19267373236867133,_market_for_photovoltaics__electric_installation_for_3kWp_module__at_building___unit__GLO__None_,209.37829053826175,0.1620452219500807,0.09202182894575794
"'market for chlorine, gaseous' (kilogram, RER, None)",0.21749582177343996,0.06866200905750487,_market_for_photovoltaics__electric_installation_for_3kWp_module__at_building___unit__GLO__None_,209.37829053826175,0.10387696891320966,0.03279327999144094
"'market for electricity, high voltage' (kilowatt hour, CA-SK, None)",0.08507503561730513,0.024761778933029575,_market_for_photovoltaics__electric_installation_for_3kWp_module__at_building___unit__GLO__None_,209.37829053826175,0.040632214256118654,0.011826335418716494
"'market for electricity, high voltage' (kilowatt hour, AR, None)",0.038842484429645205,0.018146939756800446,_market_for_photovoltaics__electric_installation_for_3kWp_module__at_building___unit__GLO__None_,209.37829053826175,0.01855134280148645,0.008667058896196442
"'market for ammonia, anhydrous, liquid' (kilogram, RoW, None)",0.3935885253740352,6.430501284064728e-06,_market_for_photovoltaics__electric_installation_for_3kWp_module__at_building___unit__GLO__None_,209.37829053826175,0.18797962499465096,3.071235927819183e-06
