names,mu_star,mu_star_conf,reference_product,score,mu_star_local_relative,mu_star_local_relative_conf
"'market for electricity, high voltage' (kilowatt hour, CN-CCG, None)",0.07087077670606728,0.022773281512941716,_market_for_photovoltaics__electric_installation_for_3kWp_module__at_building___unit__GLO__None_,209.37829053826175,0.03384819721465649,0.010876620233357065
"'market for natural gas, high pressure' (cubic meter, IR, None)",7.850470308170542e-05,2.281686775709407e-14,_market_for_photovoltaics__electric_installation_for_3kWp_module__at_building___unit__GLO__None_,209.37829053826175,3.749419430251748e-05,1.0897437216837206e-14
"'market for electricity, high voltage' (kilowatt hour, AE, None)",0.08528303915537663,0.030742371226285387,_market_for_photovoltaics__electric_installation_for_3kWp_module__at_building___unit__GLO__None_,209.37829053826175,0.04073155766824451,0.01468269281750943
"'market for sulfuric acid' (kilogram, RoW, None)",0.328942275658315,0.11085896196607382,_market_for_photovoltaics__electric_installation_for_3kWp_module__at_building___unit__GLO__None_,209.37829053826175,0.15710428947178942,0.052946731813065154
"'market for reinforcing steel' (kilogram, GLO, None)",0.5357495009161098,0.12543728623291245,_market_for_photovoltaics__electric_installation_for_3kWp_module__at_building___unit__GLO__None_,209.37829053826175,0.2558763372930524,0.05990940412706734
"'market for polyethylene, low density, granulate' (kilogram, GLO, None)",0.09104487409882012,2.37159891784091e-07,_market_for_photovoltaics__electric_installation_for_3kWp_module__at_building___unit__GLO__None_,209.37829053826175,0.043483435586738915,1.1326861594600347e-07
"'market for sodium chlorate, powder' (kilogram, RoW, None)",0.09887909225964649,3.348693849693834e-06,_market_for_photovoltaics__electric_installation_for_3kWp_module__at_building___unit__GLO__None_,209.37829053826175,0.04722509291935275,1.5993510316113192e-06
