names,mu_star,mu_star_conf,reference_product,score,mu_star_local_relative,mu_star_local_relative_conf
"'market for anode, silicon coated graphite, for Li-ion battery' (kilogram, CN, None)",0.0008187415352953308,1.6152942692437258e-10,_market_for_battery__Li_ion__NCA__rechargeable__prismatic___kilogram__GLO__None_,17.277417211415685,0.004738795881796296,9.349165152858929e-10
"'market for ethylene carbonate' (kilogram, GLO, None)",0.00501206966549077,1.6855744537588967e-09,_market_for_battery__Li_ion__NCA__rechargeable__prismatic___kilogram__GLO__None_,17.277417211415685,0.029009368727746832,9.755939983003879e-09
"'market for electricity, high voltage' (kilowatt hour, FI, None)",0.00836789313828232,0.004711440035940013,_market_for_battery__Li_ion__NCA__rechargeable__prismatic___kilogram__GLO__None_,17.277417211415685,0.04843254657735192,0.02726935385242089
"'market group for electricity, high voltage' (kilowatt hour, CN-SGCC, None)",0.001356289586110382,0.0005700199232964234,_market_for_battery__Li_ion__NCA__rechargeable__prismatic___kilogram__GLO__None_,17.277417211415685,0.00785007139385534,0.0032992195321867607
"'market group for electricity, high voltage' (kilowatt hour, GLO, None)",0.02320184600662794,0.011416752437315488,_market_for_battery__Li_ion__NCA__rechargeable__prismatic___kilogram__GLO__None_,17.277417211415685,0.13429001408438418,0.06607904582967478
"'market for tantalum concentrate, 30% Ta2O5' (kilogram, GLO, None)",0.016328414611257447,0.003250903035644179,_market_for_battery__Li_ion__NCA__rechargeable__prismatic___kilogram__GLO__None_,17.277417211415685,0.09450726582251423,0.0188159086272236
"'market for electricity, high voltage, aluminium industry' (kilowatt hour, IAI Area, EU27 & EFTA, None)",0.045143819040175524,0.018535495623471124,_market_for_battery__Li_ion__NCA__rechargeable__prismatic___kilogram__GLO__None_,17.277417211415685,0.261288006695513,0.10728163472966429
"'market for cast iron' (kilogram, GLO, None)",0.0025330283637670092,3.727138265628988e-08,_market_for_battery__Li_ion__NCA__rechargeable__prismatic___kilogram__GLO__None_,17.277417211415685,0.014660920279758972,2.1572311532573057e-07
"'market for electricity, high voltage' (kilowatt hour, FR, None)",0.011366959851211167,0.0049507348926268345,_market_for_battery__Li_ion__NCA__rechargeable__prismatic___kilogram__GLO__None_,17.277417211415685,0.06579085121415422,0.028654369064814514
"'market for electricity, medium voltage' (kilowatt hour, AT, None)",0.012449009732478977,4.173722200806525e-07,_market_for_battery__Li_ion__NCA__rechargeable__prismatic___kilogram__GLO__None_,17.277417211415685,0.07205365003429771,2.415709564534233e-06
"'market for methanol' (kilogram, GLO, None)",0.06107639975766634,4.738159769468416e-07,_market_for_battery__Li_ion__NCA__rechargeable__prismatic___kilogram__GLO__None_,17.277417211415685,0.3535042246783936,2.7424005055210322e-06
"'market for electricity, high voltage' (kilowatt hour, CA-AB, None)",0.014333754309748507,0.0059624204763789965,_market_for_battery__Li_ion__NCA__rechargeable__prismatic___kilogram__GLO__None_,17.277417211415685,0.08296236720079773,0.03450990621699784
"'market for heat, district or industrial, other than natural gas' (megajoule, RoW, None)",0.023743399273169614,0.00807703124859602,_market_for_battery__Li_ion__NCA__rechargeable__prismatic___kilogram__GLO__None_,17.277417211415685,0.13742447139310654,0.04674906642446126
"'market group for electricity, high voltage' (kilowatt hour, IN, None)",0.0014134462304430605,0.0004834263805273638,_market_for_battery__Li_ion__NCA__rechargeable__prismatic___kilogram__GLO__None_,17.277417211415685,0.008180888457732885,0.002798024580942284
"'market for steel, unalloyed' (kilogram, GLO, None)",0.03414552201547298,2.0618392774007728e-06,_market_for_battery__Li_ion__NCA__rechargeable__prismatic___kilogram__GLO__None_,17.277417211415685,0.19763093984274488,1.1933723959843121e-05
"'market group for electricity, high voltage' (kilowatt hour, RME, None)",0.004145024934220398,0.0014980514185425576,_market_for_battery__Li_ion__NCA__rechargeable__prismatic___kilogram__GLO__None_,17.277417211415685,0.023990998674742085,0.008670575006736262
"'market for battery, Li-ion, NCA, rechargeable, prismatic' (kilogram, GLO, None)",0.2710948604334528,5.214036178273994e-08,_market_for_battery__Li_ion__NCA__rechargeable__prismatic___kilogram__GLO__None_,17.277417211415685,1.5690705220357397,3.0178331138689706e-07
"'market for battery separator' (kilogram, GLO, None)",0.012938994054572018,2.637780721874409e-11,_market_for_battery__Li_ion__NCA__rechargeable__prismatic___kilogram__GLO__None_,17.277417211415685,0.07488963133924238,1.5267216677105834e-10
"'market for electricity, medium voltage' (kilowatt hour, US-NPCC, None)",0.024502143384274967,6.990157990149807e-07,_market_for_battery__Li_ion__NCA__rechargeable__prismatic___kilogram__GLO__None_,17.277417211415685,0.14181600805521843,4.045835036923927e-06
"'market for electricity, medium voltage' (kilowatt hour, US-WECC, None)",0.03058988990827789,8.369563358254799e-07,_market_for_battery__Li_ion__NCA__rechargeable__prismatic___kilogram__GLO__None_,17.277417211415685,0.17705128917108207,4.844221364709992e-06
"'market for electricity, low voltage' (kilowatt hour, CN-NECG, None)",7.533443371947614e-05,3.4481015209109936e-05,_market_for_battery__Li_ion__NCA__rechargeable__prismatic___kilogram__GLO__None_,17.277417211415685,0.00043602832991554153,0.00019957274161514917
"'market for aluminium, primary, ingot' (kilogram, IAI Area, North America, None)",0.07660872631645299,0.044302980068075315,_market_for_battery__Li_ion__NCA__rechargeable__prismatic___kilogram__GLO__None_,17.277417211415685,0.44340381076076235,0.2564213130120112
"'market for electricity, high voltage' (kilowatt hour, CN-ECGC, None)",0.072061633714256,0.04686723162413134,_market_for_battery__Li_ion__NCA__rechargeable__prismatic___kilogram__GLO__None_,17.277417211415685,0.41708568377131516,0.27126295007314416
"'market for electricity, high voltage' (kilowatt hour, US-WECC, None)",0.017223936313743318,0.00609326028893828,_market_for_battery__Li_ion__NCA__rechargeable__prismatic___kilogram__GLO__None_,17.277417211415685,0.09969045779807278,0.03526719424771597
"'market group for electricity, low voltage' (kilowatt hour, RNA, None)",0.005960357113182368,1.0486045872396652e-07,_market_for_battery__Li_ion__NCA__rechargeable__prismatic___kilogram__GLO__None_,17.277417211415685,0.034497963672742646,6.069220731364999e-07
"'market for electricity, medium voltage' (kilowatt hour, IT, None)",0.01671338920539629,4.0927550368178133e-07,_market_for_battery__Li_ion__NCA__rechargeable__prismatic___kilogram__GLO__None_,17.277417211415685,0.09673546109862576,2.368846562386427e-06
"'market for electricity, high voltage' (kilowatt hour, BR-North-eastern grid, None)",0.008499872762129625,0.004092547595772308,_market_for_battery__Li_ion__NCA__rechargeable__prismatic___kilogram__GLO__None_,17.277417211415685,0.04919643172425978,0.02368726497539369
"'market for acetic acid, without water, in 98% solution state' (kilogram, GLO, None)",0.0027662846229998374,0.0011532119968604565,_market_for_battery__Li_ion__NCA__rechargeable__prismatic___kilogram__GLO__None_,17.277417211415685,0.01601098468104407,0.006674678181056462
"'market for electricity, high voltage' (kilowatt hour, CN-NWG, None)",0.06286235710494786,0.03541266538742946,_market_for_battery__Li_ion__NCA__rechargeable__prismatic___kilogram__GLO__None_,17.277417211415685,0.3638411710253365,0.20496504167319232
"'market for natural gas, high pressure' (cubic meter, QA, None)",0.0017735239190894703,1.6767097297470012e-09,_market_for_battery__Li_ion__NCA__rechargeable__prismatic___kilogram__GLO__None_,17.277417211415685,0.010264982881339766,9.704631827951407e-09
"'market for nickel sulfate' (kilogram, GLO, None)",0.4411892265779974,6.237796726273383e-09,_market_for_battery__Li_ion__NCA__rechargeable__prismatic___kilogram__GLO__None_,17.277417211415685,2.5535600673374437,3.61037570022439e-08
"'market group for electricity, medium voltage' (kilowatt hour, RAS, None)",0.09615168549103315,0.052745853219383854,_market_for_battery__Li_ion__NCA__rechargeable__prismatic___kilogram__GLO__None_,17.277417211415685,0.5565165459308523,0.30528783656699077
"'market for electricity, high voltage' (kilowatt hour, IN-Northern grid, None)",0.021098848011656044,0.009521096084955646,_market_for_battery__Li_ion__NCA__rechargeable__prismatic___kilogram__GLO__None_,17.277417211415685,0.1221180674951545,0.05510717237681096
"'market for natural gas, high pressure' (cubic meter, PL, None)",0.008656734954665346,0.0035458621814896786,_market_for_battery__Li_ion__NCA__rechargeable__prismatic___kilogram__GLO__None_,17.277417211415685,0.05010433474365366,0.020523103297793988
"'market for pig iron' (kilogram, RoW, None)",0.029133693352093815,0.005845482047738365,_market_for_battery__Li_ion__NCA__rechargeable__prismatic___kilogram__GLO__None_,17.277417211415685,0.16862296601163482,0.03383307803596991
"'market for ammonia, anhydrous, liquid' (kilogram, RER, None)",0.01607176758661417,0.006806612526234642,_market_for_battery__Li_ion__NCA__rechargeable__prismatic___kilogram__GLO__None_,17.277417211415685,0.09302181796012365,0.03939600718640584
"'market for aluminium, primary, ingot' (kilogram, RoW, None)",0.04331138758919417,0.02246889756180454,_market_for_battery__Li_ion__NCA__rechargeable__prismatic___kilogram__GLO__None_,17.277417211415685,0.2506820727844501,0.1300477802142712
"'market for electricity, high voltage' (kilowatt hour, IN-Southern grid, None)",0.009075763312463795,0.004124029801639236,_market_for_battery__Li_ion__NCA__rechargeable__prismatic___kilogram__GLO__None_,17.277417211415685,0.052529629871223914,0.02386948090200873
"'market for electricity, high voltage' (kilowatt hour, CN-CSG, None)",0.41601030448330656,0.14852338114845473,_market_for_battery__Li_ion__NCA__rechargeable__prismatic___kilogram__GLO__None_,17.277417211415685,2.4078269303379245,0.8596387951453824
"'market for electricity, high voltage' (kilowatt hour, CN-SWG, None)",0.07749473836316989,0.03628956845926037,_market_for_battery__Li_ion__NCA__rechargeable__prismatic___kilogram__GLO__None_,17.277417211415685,0.44853196177937343,0.21004047083659477
"'market group for electricity, medium voltage' (kilowatt hour, CN, None)",0.424627378764845,1.3503463237695213e-05,_market_for_battery__Li_ion__NCA__rechargeable__prismatic___kilogram__GLO__None_,17.277417211415685,2.457701712986832,7.815672373051851e-05
"'market for natural gas, high pressure' (cubic meter, ID, None)",0.000509457802267832,5.363604856399659e-10,_market_for_battery__Li_ion__NCA__rechargeable__prismatic___kilogram__GLO__None_,17.277417211415685,0.0029486919024633994,3.10440200104433e-09
"'market for phenol' (kilogram, RoW, None)",0.0044899762887319564,0.00015507858634833326,_market_for_battery__Li_ion__NCA__rechargeable__prismatic___kilogram__GLO__None_,17.277417211415685,0.025987543356684704,0.0008975796813303113
"'market for electricity, high voltage' (kilowatt hour, KZ, None)",0.036349460473522034,0.01616763639942315,_market_for_battery__Li_ion__NCA__rechargeable__prismatic___kilogram__GLO__None_,17.277417211415685,0.2103871199539298,0.09357669726665355
"'market for electricity, medium voltage' (kilowatt hour, SG, None)",0.025628671179699847,2.3531117288073567e-07,_market_for_battery__Li_ion__NCA__rechargeable__prismatic___kilogram__GLO__None_,17.277417211415685,0.14833624068976148,1.3619580403791998e-06
"'market for polyethylene terephthalate, granulate, amorphous' (kilogram, GLO, None)",0.0032477939246778223,0.0011852845547761924,_market_for_battery__Li_ion__NCA__rechargeable__prismatic___kilogram__GLO__None_,17.277417211415685,0.018797913397217217,0.0068603110075563896
"'market for polystyrene, expandable' (kilogram, GLO, None)",2.667757092567058e-07,8.258680471995319e-11,_market_for_battery__Li_ion__NCA__rechargeable__prismatic___kilogram__GLO__None_,17.277417211415685,1.5440716977097678e-06,4.780043435276062e-10
"'market for natural gas, high pressure' (cubic meter, LY, None)",0.00012724373178372162,3.762423876370047e-11,_market_for_battery__Li_ion__NCA__rechargeable__prismatic___kilogram__GLO__None_,17.277417211415685,0.0007364742671123785,2.1776541194387003e-10
"'market for anode, silicon coated graphite, for Li-ion battery' (kilogram, RoW, None)",0.0004631013158492792,8.686092290025182e-11,_market_for_battery__Li_ion__NCA__rechargeable__prismatic___kilogram__GLO__None_,17.277417211415685,0.002680385095657092,5.027425212771983e-10
"'market for electricity, high voltage, aluminium industry' (kilowatt hour, IAI Area, Russia & RER w/o EU27 & EFTA, None)",0.22649400152240134,0.03591776968464691,_market_for_battery__Li_ion__NCA__rechargeable__prismatic___kilogram__GLO__None_,17.277417211415685,1.310925115431896,0.20788853591447112
"'market for sulfuric acid' (kilogram, RoW, None)",0.14456324025008188,0.08307924263527659,_market_for_battery__Li_ion__NCA__rechargeable__prismatic___kilogram__GLO__None_,17.277417211415685,0.8367178871768218,0.4808545259900523
"'market for natural gas, high pressure' (cubic meter, KZ, None)",5.980934873468513e-05,2.9097719979655994e-10,_market_for_battery__Li_ion__NCA__rechargeable__prismatic___kilogram__GLO__None_,17.277417211415685,0.0003461706573547774,1.6841475565242643e-09
"'market for natural gas, high pressure' (cubic meter, DE, None)",0.023695707539629574,0.00939044568709712,_market_for_battery__Li_ion__NCA__rechargeable__prismatic___kilogram__GLO__None_,17.277417211415685,0.13714843630663234,0.05435098065984413
"'market for electricity, high voltage' (kilowatt hour, BR-Northern grid, None)",0.006630462910980218,0.0025600043618362084,_market_for_battery__Li_ion__NCA__rechargeable__prismatic___kilogram__GLO__None_,17.277417211415685,0.038376470451840915,0.01481705471663172
"'market for electricity, high voltage, aluminium industry' (kilowatt hour, IAI Area, South America, None)",0.09473513396621192,5.047200613094313e-07,_market_for_battery__Li_ion__NCA__rechargeable__prismatic___kilogram__GLO__None_,17.277417211415685,0.548317684333152,2.921270321445663e-06
"'market group for electricity, medium voltage' (kilowatt hour, CA, None)",0.2069983032101123,3.155232206684998e-05,_market_for_battery__Li_ion__NCA__rechargeable__prismatic___kilogram__GLO__None_,17.277417211415685,1.198085921507658,0.00018262175231841053
"'market for chlorine, liquid' (kilogram, RoW, None)",0.021457770991259385,0.011680118961097559,_market_for_battery__Li_ion__NCA__rechargeable__prismatic___kilogram__GLO__None_,17.277417211415685,0.12419547857582336,0.06760338549549043
"'market for natural gas, high pressure' (cubic meter, IT, None)",0.0034149861513445676,0.001703133753105704,_market_for_battery__Li_ion__NCA__rechargeable__prismatic___kilogram__GLO__None_,17.277417211415685,0.01976560564323346,0.009857571489217698
"'market for electricity, high voltage' (kilowatt hour, HK, None)",0.021563406912190518,0.0075202133343183625,_market_for_battery__Li_ion__NCA__rechargeable__prismatic___kilogram__GLO__None_,17.277417211415685,0.1248068889483259,0.043526258828487055
"'market for chlorine, gaseous' (kilogram, RoW, None)",0.008305854808287272,0.0031824868251717313,_market_for_battery__Li_ion__NCA__rechargeable__prismatic___kilogram__GLO__None_,17.277417211415685,0.048073474794596935,0.01841992229642386
"'market for electricity, low voltage' (kilowatt hour, CN-ECGC, None)",3.3331491675525634e-05,2.0303538246175622e-05,_market_for_battery__Li_ion__NCA__rechargeable__prismatic___kilogram__GLO__None_,17.277417211415685,0.00019291941189857105,0.00011751489240394387
"'market for electricity, high voltage' (kilowatt hour, AU, None)",0.1678390394932268,0.07499163588104829,_market_for_battery__Li_ion__NCA__rechargeable__prismatic___kilogram__GLO__None_,17.277417211415685,0.9714359353568814,0.43404424957394194
"'market for synthetic rubber' (kilogram, GLO, None)",0.0018878958679872325,4.257689403864655e-11,_market_for_battery__Li_ion__NCA__rechargeable__prismatic___kilogram__GLO__None_,17.277417211415685,0.010926956528779347,2.46430895993614e-10
"'market for electricity, high voltage, aluminium industry' (kilowatt hour, IAI Area, Africa, None)",0.13401926911818923,1.230306525047731e-06,_market_for_battery__Li_ion__NCA__rechargeable__prismatic___kilogram__GLO__None_,17.277417211415685,0.775690414129948,7.120893765503517e-06
"'market for electricity, high voltage' (kilowatt hour, GR, None)",0.012402846331335397,0.004739240197630541,_market_for_battery__Li_ion__NCA__rechargeable__prismatic___kilogram__GLO__None_,17.277417211415685,0.07178646078616706,0.027430258467678777
"'market for copper concentrate, sulfide ore' (kilogram, GLO, None)",0.0345522171161508,0.019043677467046213,_market_for_battery__Li_ion__NCA__rechargeable__prismatic___kilogram__GLO__None_,17.277417211415685,0.19998485128507032,0.1102229415080832
"'market for electricity, high voltage' (kilowatt hour, IN-Eastern grid, None)",0.028659354376749303,0.01330727485728735,_market_for_battery__Li_ion__NCA__rechargeable__prismatic___kilogram__GLO__None_,17.277417211415685,0.16587753844257028,0.07702120458429894
"'market for electricity, high voltage' (kilowatt hour, CL, None)",0.027118558305823104,0.012745316710342377,_market_for_battery__Li_ion__NCA__rechargeable__prismatic___kilogram__GLO__None_,17.277417211415685,0.1569595615709569,0.07376864582468484
"'market for oxygen, liquid' (kilogram, RoW, None)",0.1062574811306761,1.810320803297024e-06,_market_for_battery__Li_ion__NCA__rechargeable__prismatic___kilogram__GLO__None_,17.277417211415685,0.6150079021097479,1.0477959646080047e-05
"'market for lithium hexafluorophosphate' (kilogram, GLO, None)",0.09280822107764175,1.9921192488172667e-09,_market_for_battery__Li_ion__NCA__rechargeable__prismatic___kilogram__GLO__None_,17.277417211415685,0.5371649011075608,1.1530191257412111e-08
"'market for explosive, tovex' (kilogram, GLO, None)",0.04162672871172388,1.1628867740578612e-06,_market_for_battery__Li_ion__NCA__rechargeable__prismatic___kilogram__GLO__None_,17.277417211415685,0.2409314320674036,6.730674844672435e-06
"'aluminium ingot, primary, to aluminium, wrought alloy market' (kilogram, GLO, None)",0.0381441509079349,0.01670797368625699,_market_for_battery__Li_ion__NCA__rechargeable__prismatic___kilogram__GLO__None_,17.277417211415685,0.220774612554543,0.09670411660382637
"'market group for heat, district or industrial, natural gas' (megajoule, RER, None)",0.0411036476451506,8.61389613479114e-09,_market_for_battery__Li_ion__NCA__rechargeable__prismatic___kilogram__GLO__None_,17.277417211415685,0.2379038900443536,4.985638784655668e-08
"'market for bisphenol A, powder' (kilogram, GLO, None)",0.0014446160994848966,1.0942106611544618e-09,_market_for_battery__Li_ion__NCA__rechargeable__prismatic___kilogram__GLO__None_,17.277417211415685,0.008361296609370511,6.333184224037176e-09
"'market for natural gas, high pressure' (cubic meter, TR, None)",0.01005438240910257,0.0032440481700568265,_market_for_battery__Li_ion__NCA__rechargeable__prismatic___kilogram__GLO__None_,17.277417211415685,0.05819378143198018,0.018776233336041632
"'market for natural gas, high pressure' (cubic meter, NG, None)",0.0004758447718237413,5.410831685438158e-10,_market_for_battery__Li_ion__NCA__rechargeable__prismatic___kilogram__GLO__None_,17.277417211415685,0.002754142971724599,3.1317364275159516e-09
"'market for natural gas, high pressure' (cubic meter, FR, None)",0.011186434529188638,0.00462020022119961,_market_for_battery__Li_ion__NCA__rechargeable__prismatic___kilogram__GLO__None_,17.277417211415685,0.06474598831703526,0.026741266733704337
"'market group for electricity, high voltage' (kilowatt hour, RER, None)",0.013314856395642494,1.1482344619812496e-11,_market_for_battery__Li_ion__NCA__rechargeable__prismatic___kilogram__GLO__None_,17.277417211415685,0.07706508578634651,6.645868696292049e-11
"'market for electricity, high voltage' (kilowatt hour, MY, None)",0.03529515687179723,0.015358962273524296,_market_for_battery__Li_ion__NCA__rechargeable__prismatic___kilogram__GLO__None_,17.277417211415685,0.20428491388444744,0.08889617056521729
"'market for phosphorus pentachloride' (kilogram, GLO, None)",0.003807885280450307,1.8501752432312703e-10,_market_for_battery__Li_ion__NCA__rechargeable__prismatic___kilogram__GLO__None_,17.277417211415685,0.022039667352214708,1.0708633244144885e-09
"'market for steel, chromium steel 18/8, hot rolled' (kilogram, GLO, None)",0.00034482979294114813,2.1115905792465264e-09,_market_for_battery__Li_ion__NCA__rechargeable__prismatic___kilogram__GLO__None_,17.277417211415685,0.0019958410954694617,1.2221679626115285e-08
"'market for aluminium, primary, liquid' (kilogram, GLO, None)",0.008859131784801555,0.0030684530756176416,_market_for_battery__Li_ion__NCA__rechargeable__prismatic___kilogram__GLO__None_,17.277417211415685,0.05127578778932347,0.01775990611368826
"'market group for electricity, medium voltage' (kilowatt hour, RME, None)",0.020043402240474607,0.011599834026692209,_market_for_battery__Li_ion__NCA__rechargeable__prismatic___kilogram__GLO__None_,17.277417211415685,0.11600925066063321,0.06713870415207585
"'market for copper, cathode' (kilogram, GLO, None)",0.37318506116822125,0.16881955003026813,_market_for_battery__Li_ion__NCA__rechargeable__prismatic___kilogram__GLO__None_,17.277417211415685,2.1599586130364856,0.9771110343895859
"'market for sodium hydroxide, without water, in 50% solution state' (kilogram, GLO, None)",0.1535536208450404,0.02668578368211616,_market_for_battery__Li_ion__NCA__rechargeable__prismatic___kilogram__GLO__None_,17.277417211415685,0.8887533302349331,0.15445470440155892
"'market for polyethylene, high density, granulate' (kilogram, GLO, None)",0.0357489495288851,0.011891198696127194,_market_for_battery__Li_ion__NCA__rechargeable__prismatic___kilogram__GLO__None_,17.277417211415685,0.20691142137416663,0.06882509434494838
"'market for sheet rolling, copper' (kilogram, GLO, None)",0.011882114865612525,1.3510844721801632e-10,_market_for_battery__Li_ion__NCA__rechargeable__prismatic___kilogram__GLO__None_,17.277417211415685,0.06877251802290027,7.819944703815238e-10
"'market group for electricity, high voltage' (kilowatt hour, RNA, None)",0.010545697257999809,6.799073258910716e-07,_market_for_battery__Li_ion__NCA__rechargeable__prismatic___kilogram__GLO__None_,17.277417211415685,0.061037463695858225,3.9352370644950186e-06
"'market for electricity, medium voltage' (kilowatt hour, FI, None)",0.022335962250792818,6.38154884529283e-07,_market_for_battery__Li_ion__NCA__rechargeable__prismatic___kilogram__GLO__None_,17.277417211415685,0.12927836364358214,3.693578019911655e-06
"'market for electricity, medium voltage' (kilowatt hour, TW, None)",0.03804671278541614,5.258507568079313e-07,_market_for_battery__Li_ion__NCA__rechargeable__prismatic___kilogram__GLO__None_,17.277417211415685,0.22021065023699019,3.04357271907798e-06
"'market for electricity, medium voltage' (kilowatt hour, US-RFC, None)",0.04233774505265275,1.3757683792153382e-06,_market_for_battery__Li_ion__NCA__rechargeable__prismatic___kilogram__GLO__None_,17.277417211415685,0.24504672506651626,7.962812742093931e-06
"'market for aluminium, wrought alloy' (kilogram, GLO, None)",1.9980754467081858,0.7844110057936764,_market_for_battery__Li_ion__NCA__rechargeable__prismatic___kilogram__GLO__None_,17.277417211415685,11.564665147913427,4.540094136728918
"'market for electricity, high voltage' (kilowatt hour, PT, None)",0.011395464345171554,0.0065103665749774884,_market_for_battery__Li_ion__NCA__rechargeable__prismatic___kilogram__GLO__None_,17.277417211415685,0.06595583243566198,0.03768136461204342
"'market for heat, central or small-scale, other than natural gas' (megajoule, RoW, None)",0.002323023862453779,0.0008236511606638206,_market_for_battery__Li_ion__NCA__rechargeable__prismatic___kilogram__GLO__None_,17.277417211415685,0.013445434777825997,0.004767212312958505
"'market group for electricity, high voltage' (kilowatt hour, Europe without Switzerland, None)",0.0025206764451185765,0.001265958155565485,_market_for_battery__Li_ion__NCA__rechargeable__prismatic___kilogram__GLO__None_,17.277417211415685,0.01458942858341751,0.007327241913965186
"'market group for electricity, medium voltage' (kilowatt hour, RNA, None)",0.311823959092773,1.51342981070229e-05,_market_for_battery__Li_ion__NCA__rechargeable__prismatic___kilogram__GLO__None_,17.277417211415685,1.8048065592045897,8.759583635581385e-05
"'market for electricity, high voltage' (kilowatt hour, US-PR, None)",0.08751962023406605,0.016812671559882624,_market_for_battery__Li_ion__NCA__rechargeable__prismatic___kilogram__GLO__None_,17.277417211415685,0.5065549969832258,0.09731009765032478
"'market for zinc' (kilogram, GLO, None)",0.008726267483932482,0.0012228562164034024,_market_for_battery__Li_ion__NCA__rechargeable__prismatic___kilogram__GLO__None_,17.277417211415685,0.05050678221839076,0.007077772108179608
"'market for heat, district or industrial, other than natural gas' (megajoule, Europe without Switzerland, None)",0.006010203945087966,0.0026453569756477763,_market_for_battery__Li_ion__NCA__rechargeable__prismatic___kilogram__GLO__None_,17.277417211415685,0.03478647225765233,0.01531106729251125
"'market for electricity, high voltage' (kilowatt hour, UZ, None)",0.02800227656476162,0.013753923781020364,_market_for_battery__Li_ion__NCA__rechargeable__prismatic___kilogram__GLO__None_,17.277417211415685,0.1620744363703836,0.07960636484446734
"'market for electricity, high voltage' (kilowatt hour, ES, None)",0.0097178753782452,0.004623355991866867,_market_for_battery__Li_ion__NCA__rechargeable__prismatic___kilogram__GLO__None_,17.277417211415685,0.05624611166896127,0.026759532025493273
